{
  "address": "0x089734388312e5DB16787eC934a4F37089f043Ba",
  "abi": [
    {
      "anonymous": false,
      "inputs": [
        {
          "indexed": true,
          "internalType": "address",
          "name": "provider",
          "type": "address"
        },
        {
          "indexed": false,
          "internalType": "uint256[]",
          "name": "tokenAmounts",
          "type": "uint256[]"
        },
        {
          "indexed": false,
          "internalType": "uint256[]",
          "name": "fees",
          "type": "uint256[]"
        },
        {
          "indexed": false,
          "internalType": "uint256",
          "name": "invariant",
          "type": "uint256"
        },
        {
          "indexed": false,
          "internalType": "uint256",
          "name": "lpTokenSupply",
          "type": "uint256"
        }
      ],
      "name": "AddLiquidity",
      "type": "event"
    },
    {
      "anonymous": false,
      "inputs": [
        {
          "indexed": false,
          "internalType": "uint256",
          "name": "newAdminFee",
          "type": "uint256"
        }
      ],
      "name": "NewAdminFee",
      "type": "event"
    },
    {
      "anonymous": false,
      "inputs": [
        {
          "indexed": false,
          "internalType": "uint256",
          "name": "newSwapFee",
          "type": "uint256"
        }
      ],
      "name": "NewSwapFee",
      "type": "event"
    },
    {
      "anonymous": false,
      "inputs": [
        {
          "indexed": false,
          "internalType": "uint256",
          "name": "newWithdrawFee",
          "type": "uint256"
        }
      ],
      "name": "NewWithdrawFee",
      "type": "event"
    },
    {
      "anonymous": false,
      "inputs": [
        {
          "indexed": true,
          "internalType": "address",
          "name": "provider",
          "type": "address"
        },
        {
          "indexed": false,
          "internalType": "uint256[]",
          "name": "tokenAmounts",
          "type": "uint256[]"
        },
        {
          "indexed": false,
          "internalType": "uint256[]",
          "name": "fees",
          "type": "uint256[]"
        },
        {
          "indexed": false,
          "internalType": "uint256",
          "name": "invariant",
          "type": "uint256"
        },
        {
          "indexed": false,
          "internalType": "uint256",
          "name": "lpTokenSupply",
          "type": "uint256"
        }
      ],
      "name": "RemoveLiquidityImbalance",
      "type": "event"
    },
    {
      "anonymous": false,
      "inputs": [
        {
          "indexed": true,
          "internalType": "address",
          "name": "provider",
          "type": "address"
        },
        {
          "indexed": false,
          "internalType": "uint256",
          "name": "lpTokenAmount",
          "type": "uint256"
        },
        {
          "indexed": false,
          "internalType": "uint256",
          "name": "lpTokenSupply",
          "type": "uint256"
        },
        {
          "indexed": false,
          "internalType": "uint256",
          "name": "boughtId",
          "type": "uint256"
        },
        {
          "indexed": false,
          "internalType": "uint256",
          "name": "tokensBought",
          "type": "uint256"
        }
      ],
      "name": "RemoveLiquidityOne",
      "type": "event"
    },
    {
      "anonymous": false,
      "inputs": [
        {
          "indexed": true,
          "internalType": "address",
          "name": "buyer",
          "type": "address"
        },
        {
          "indexed": false,
          "internalType": "uint256",
          "name": "tokensSold",
          "type": "uint256"
        },
        {
          "indexed": false,
          "internalType": "uint256",
          "name": "tokensBought",
          "type": "uint256"
        },
        {
          "indexed": false,
          "internalType": "uint128",
          "name": "soldId",
          "type": "uint128"
        },
        {
          "indexed": false,
          "internalType": "uint128",
          "name": "boughtId",
          "type": "uint128"
        }
      ],
      "name": "TokenSwap",
      "type": "event"
    },
    {
      "anonymous": false,
      "inputs": [
        {
          "indexed": true,
          "internalType": "address",
          "name": "buyer",
          "type": "address"
        },
        {
          "indexed": false,
          "internalType": "uint256",
          "name": "tokensSold",
          "type": "uint256"
        },
        {
          "indexed": false,
          "internalType": "uint256",
          "name": "tokensBought",
          "type": "uint256"
        },
        {
          "indexed": false,
          "internalType": "uint128",
          "name": "soldId",
          "type": "uint128"
        },
        {
          "indexed": false,
          "internalType": "uint128",
          "name": "boughtId",
          "type": "uint128"
        }
      ],
      "name": "TokenSwapUnderlying",
      "type": "event"
    },
    {
      "inputs": [],
      "name": "A_PRECISION",
      "outputs": [
        {
          "internalType": "uint256",
          "name": "",
          "type": "uint256"
        }
      ],
      "stateMutability": "view",
      "type": "function"
    },
    {
      "inputs": [],
      "name": "BASE_CACHE_EXPIRE_TIME",
      "outputs": [
        {
          "internalType": "uint256",
          "name": "",
          "type": "uint256"
        }
      ],
      "stateMutability": "view",
      "type": "function"
    },
    {
      "inputs": [],
      "name": "BASE_VIRTUAL_PRICE_PRECISION",
      "outputs": [
        {
          "internalType": "uint256",
          "name": "",
          "type": "uint256"
        }
      ],
      "stateMutability": "view",
      "type": "function"
    },
    {
      "inputs": [],
      "name": "POOL_PRECISION_DECIMALS",
      "outputs": [
        {
          "internalType": "uint8",
          "name": "",
          "type": "uint8"
        }
      ],
      "stateMutability": "view",
      "type": "function"
    }
  ],
  "transactionHash": "0x6c19afc93f7f3533e80d7b8fcdc308b4092352a17fefb2af5088cee619bad015",
  "receipt": {
    "to": null,
    "from": "0x0aA282136b3924ca6767C4D5B9aad6f83bD40A9c",
    "contractAddress": "0x089734388312e5DB16787eC934a4F37089f043Ba",
    "transactionIndex": 9,
    "gasUsed": "4292844",
    "logsBloom": "0x00000000000000000000000000000000000000000000000000000000000000000000000000000000000000000000000000000000000000000000000000000000000000000000000000000000000000000000000000000000000000000000000000000000000000000000000000000000000000000000000000000000000000000000000000000000000000000000000000000000000000000000000000000000000000000000000000000000000000000000000000000000000000000000000000000000000000000000000000000000000000000000000000000000000000000000000000000000000000000000000000000000000000000000000000000000",
    "blockHash": "0x6d60f76e96d4315a142c13bdab2fa2b306c9b23aec601ea20c2708800957f500",
    "transactionHash": "0x6c19afc93f7f3533e80d7b8fcdc308b4092352a17fefb2af5088cee619bad015",
    "logs": [],
    "blockNumber": 19166733,
    "cumulativeGasUsed": "5476745",
    "status": 1,
    "byzantium": true
  },
  "args": [],
  "solcInputHash": "b0191412d6db60d2913615e97999bbd0",
  "metadata": "{\"compiler\":{\"version\":\"0.6.12+commit.27d51765\"},\"language\":\"Solidity\",\"output\":{\"abi\":[{\"anonymous\":false,\"inputs\":[{\"indexed\":true,\"internalType\":\"address\",\"name\":\"provider\",\"type\":\"address\"},{\"indexed\":false,\"internalType\":\"uint256[]\",\"name\":\"tokenAmounts\",\"type\":\"uint256[]\"},{\"indexed\":false,\"internalType\":\"uint256[]\",\"name\":\"fees\",\"type\":\"uint256[]\"},{\"indexed\":false,\"internalType\":\"uint256\",\"name\":\"invariant\",\"type\":\"uint256\"},{\"indexed\":false,\"internalType\":\"uint256\",\"name\":\"lpTokenSupply\",\"type\":\"uint256\"}],\"name\":\"AddLiquidity\",\"type\":\"event\"},{\"anonymous\":false,\"inputs\":[{\"indexed\":false,\"internalType\":\"uint256\",\"name\":\"newAdminFee\",\"type\":\"uint256\"}],\"name\":\"NewAdminFee\",\"type\":\"event\"},{\"anonymous\":false,\"inputs\":[{\"indexed\":false,\"internalType\":\"uint256\",\"name\":\"newSwapFee\",\"type\":\"uint256\"}],\"name\":\"NewSwapFee\",\"type\":\"event\"},{\"anonymous\":false,\"inputs\":[{\"indexed\":false,\"internalType\":\"uint256\",\"name\":\"newWithdrawFee\",\"type\":\"uint256\"}],\"name\":\"NewWithdrawFee\",\"type\":\"event\"},{\"anonymous\":false,\"inputs\":[{\"indexed\":true,\"internalType\":\"address\",\"name\":\"provider\",\"type\":\"address\"},{\"indexed\":false,\"internalType\":\"uint256[]\",\"name\":\"tokenAmounts\",\"type\":\"uint256[]\"},{\"indexed\":false,\"internalType\":\"uint256[]\",\"name\":\"fees\",\"type\":\"uint256[]\"},{\"indexed\":false,\"internalType\":\"uint256\",\"name\":\"invariant\",\"type\":\"uint256\"},{\"indexed\":false,\"internalType\":\"uint256\",\"name\":\"lpTokenSupply\",\"type\":\"uint256\"}],\"name\":\"RemoveLiquidityImbalance\",\"type\":\"event\"},{\"anonymous\":false,\"inputs\":[{\"indexed\":true,\"internalType\":\"address\",\"name\":\"provider\",\"type\":\"address\"},{\"indexed\":false,\"internalType\":\"uint256\",\"name\":\"lpTokenAmount\",\"type\":\"uint256\"},{\"indexed\":false,\"internalType\":\"uint256\",\"name\":\"lpTokenSupply\",\"type\":\"uint256\"},{\"indexed\":false,\"internalType\":\"uint256\",\"name\":\"boughtId\",\"type\":\"uint256\"},{\"indexed\":false,\"internalType\":\"uint256\",\"name\":\"tokensBought\",\"type\":\"uint256\"}],\"name\":\"RemoveLiquidityOne\",\"type\":\"event\"},{\"anonymous\":false,\"inputs\":[{\"indexed\":true,\"internalType\":\"address\",\"name\":\"buyer\",\"type\":\"address\"},{\"indexed\":false,\"internalType\":\"uint256\",\"name\":\"tokensSold\",\"type\":\"uint256\"},{\"indexed\":false,\"internalType\":\"uint256\",\"name\":\"tokensBought\",\"type\":\"uint256\"},{\"indexed\":false,\"internalType\":\"uint128\",\"name\":\"soldId\",\"type\":\"uint128\"},{\"indexed\":false,\"internalType\":\"uint128\",\"name\":\"boughtId\",\"type\":\"uint128\"}],\"name\":\"TokenSwap\",\"type\":\"event\"},{\"anonymous\":false,\"inputs\":[{\"indexed\":true,\"internalType\":\"address\",\"name\":\"buyer\",\"type\":\"address\"},{\"indexed\":false,\"internalType\":\"uint256\",\"name\":\"tokensSold\",\"type\":\"uint256\"},{\"indexed\":false,\"internalType\":\"uint256\",\"name\":\"tokensBought\",\"type\":\"uint256\"},{\"indexed\":false,\"internalType\":\"uint128\",\"name\":\"soldId\",\"type\":\"uint128\"},{\"indexed\":false,\"internalType\":\"uint128\",\"name\":\"boughtId\",\"type\":\"uint128\"}],\"name\":\"TokenSwapUnderlying\",\"type\":\"event\"},{\"inputs\":[],\"name\":\"A_PRECISION\",\"outputs\":[{\"internalType\":\"uint256\",\"name\":\"\",\"type\":\"uint256\"}],\"stateMutability\":\"view\",\"type\":\"function\"},{\"inputs\":[],\"name\":\"BASE_CACHE_EXPIRE_TIME\",\"outputs\":[{\"internalType\":\"uint256\",\"name\":\"\",\"type\":\"uint256\"}],\"stateMutability\":\"view\",\"type\":\"function\"},{\"inputs\":[],\"name\":\"BASE_VIRTUAL_PRICE_PRECISION\",\"outputs\":[{\"internalType\":\"uint256\",\"name\":\"\",\"type\":\"uint256\"}],\"stateMutability\":\"view\",\"type\":\"function\"},{\"inputs\":[],\"name\":\"POOL_PRECISION_DECIMALS\",\"outputs\":[{\"internalType\":\"uint8\",\"name\":\"\",\"type\":\"uint8\"}],\"stateMutability\":\"view\",\"type\":\"function\"}],\"devdoc\":{\"details\":\"Contracts relying on this library must initialize EvmoSwapUtils.Swap struct then use this library for EvmoSwapUtils.Swap struct. Note that this library contains both functions called by users and admins. Admin functions should be protected within contracts using this library.\",\"kind\":\"dev\",\"methods\":{\"addLiquidity(EvmoSwapUtils.Swap storage,MetaSwapUtils.MetaSwap storage,uint256[],uint256)\":{\"params\":{\"amounts\":\"the amounts of each token to add, in their native precision\",\"minToMint\":\"the minimum LP tokens adding this amount of liquidity should mint, otherwise revert. Handy for front-running mitigation allowed addresses. If the pool is not in the guarded launch phase, this parameter will be ignored.\",\"self\":\"Swap struct to read from and write to\"},\"returns\":{\"_0\":\"amount of LP token user received\"}},\"calculateCurrentWithdrawFee(EvmoSwapUtils.Swap storage,address)\":{\"params\":{\"user\":\"address you want to calculate withdraw fee of\"},\"returns\":{\"_0\":\"current withdraw fee of the user\"}},\"calculateSwap(EvmoSwapUtils.Swap storage,MetaSwapUtils.MetaSwap storage,uint8,uint8,uint256)\":{\"params\":{\"dx\":\"the number of tokens to sell. If the token charges a fee on transfers, use the amount that gets transferred after the fee.\",\"self\":\"Swap struct to read from\",\"tokenIndexFrom\":\"the token to sell\",\"tokenIndexTo\":\"the token to buy\"},\"returns\":{\"dy\":\"the number of tokens the user will get\"}},\"calculateTokenAmount(EvmoSwapUtils.Swap storage,MetaSwapUtils.MetaSwap storage,address,uint256[],bool)\":{\"details\":\"This shouldn't be used outside frontends for user estimates.\",\"params\":{\"account\":\"address of the account depositing or withdrawing tokens\",\"amounts\":\"an array of token amounts to deposit or withdrawal, corresponding to pooledTokens. The amount should be in each pooled token's native precision. If a token charges a fee on transfers, use the amount that gets transferred after the fee.\",\"deposit\":\"whether this is a deposit or a withdrawal\",\"self\":\"Swap struct to read from\"},\"returns\":{\"_0\":\"if deposit was true, total amount of lp token that will be minted and if deposit was false, total amount of lp token that will be burned\"}},\"calculateWithdrawOneToken(EvmoSwapUtils.Swap storage,MetaSwapUtils.MetaSwap storage,address,uint256,uint8)\":{\"params\":{\"account\":\"the address that is withdrawing\",\"self\":\"Swap struct to read from\",\"tokenAmount\":\"the amount to withdraw in the pool's precision\",\"tokenIndex\":\"which token will be withdrawn\"},\"returns\":{\"dy\":\"the amount of token user will receive\"}},\"getAPrecise(EvmoSwapUtils.Swap storage)\":{\"details\":\"See the StableSwap paper for details\",\"params\":{\"self\":\"Swap struct to read from\"},\"returns\":{\"_0\":\"A parameter in its raw precision form\"}},\"getVirtualPrice(EvmoSwapUtils.Swap storage,MetaSwapUtils.MetaSwap storage)\":{\"params\":{\"self\":\"Swap struct to read from\"},\"returns\":{\"_0\":\"the virtual price, scaled to precision of POOL_PRECISION_DECIMALS\"}},\"removeLiquidityImbalance(EvmoSwapUtils.Swap storage,MetaSwapUtils.MetaSwap storage,uint256[],uint256)\":{\"params\":{\"amounts\":\"how much of each token to withdraw\",\"maxBurnAmount\":\"the max LP token provider is willing to pay to remove liquidity. Useful as a front-running mitigation.\",\"self\":\"Swap struct to read from and write to\"},\"returns\":{\"_0\":\"actual amount of LP tokens burned in the withdrawal\"}},\"removeLiquidityOneToken(EvmoSwapUtils.Swap storage,MetaSwapUtils.MetaSwap storage,uint256,uint8,uint256)\":{\"params\":{\"minAmount\":\"the minimum amount to withdraw, otherwise revert\",\"self\":\"Swap struct to read from and write to\",\"tokenAmount\":\"the amount of the lp tokens to burn\",\"tokenIndex\":\"the index of the token you want to receive\"},\"returns\":{\"_0\":\"amount chosen token that user received\"}},\"swap(EvmoSwapUtils.Swap storage,MetaSwapUtils.MetaSwap storage,uint8,uint8,uint256,uint256)\":{\"params\":{\"dx\":\"the amount of tokens the user wants to sell\",\"minDy\":\"the min amount the user would like to receive, or revert.\",\"self\":\"Swap struct to read from and write to\",\"tokenIndexFrom\":\"the token the user wants to sell\",\"tokenIndexTo\":\"the token the user wants to buy\"},\"returns\":{\"_0\":\"amount of token user received on swap\"}}},\"title\":\"MetaSwapUtils library\",\"version\":1},\"userdoc\":{\"kind\":\"user\",\"methods\":{\"addLiquidity(EvmoSwapUtils.Swap storage,MetaSwapUtils.MetaSwap storage,uint256[],uint256)\":{\"notice\":\"Add liquidity to the pool\"},\"calculateCurrentWithdrawFee(EvmoSwapUtils.Swap storage,address)\":{\"notice\":\"Calculate the fee that is applied when the given user withdraws. Withdraw fee decays linearly over 4 weeks.\"},\"calculateSwap(EvmoSwapUtils.Swap storage,MetaSwapUtils.MetaSwap storage,uint8,uint8,uint256)\":{\"notice\":\"Externally calculates a swap between two tokens.\"},\"calculateTokenAmount(EvmoSwapUtils.Swap storage,MetaSwapUtils.MetaSwap storage,address,uint256[],bool)\":{\"notice\":\"A simple method to calculate prices from deposits or withdrawals, excluding fees but including slippage. This is helpful as an input into the various \\\"min\\\" parameters on calls to fight front-running\"},\"calculateWithdrawOneToken(EvmoSwapUtils.Swap storage,MetaSwapUtils.MetaSwap storage,address,uint256,uint8)\":{\"notice\":\"Calculate the dy, the amount of selected token that user receives.\"},\"getAPrecise(EvmoSwapUtils.Swap storage)\":{\"notice\":\"Return A in its raw precision\"},\"getVirtualPrice(EvmoSwapUtils.Swap storage,MetaSwapUtils.MetaSwap storage)\":{\"notice\":\"Get the virtual price, to help calculate profit\"},\"removeLiquidityImbalance(EvmoSwapUtils.Swap storage,MetaSwapUtils.MetaSwap storage,uint256[],uint256)\":{\"notice\":\"Remove liquidity from the pool, weighted differently than the pool's current balances.\"},\"removeLiquidityOneToken(EvmoSwapUtils.Swap storage,MetaSwapUtils.MetaSwap storage,uint256,uint8,uint256)\":{\"notice\":\"Remove liquidity from the pool all in one token.\"},\"swap(EvmoSwapUtils.Swap storage,MetaSwapUtils.MetaSwap storage,uint8,uint8,uint256,uint256)\":{\"notice\":\"swap two tokens in the pool\"}},\"notice\":\"A library to be used within MetaSwap.sol. Contains functions responsible for custody and AMM functionalities.\",\"version\":1}},\"settings\":{\"compilationTarget\":{\"contracts/stable/MetaSwapUtils.sol\":\"MetaSwapUtils\"},\"evmVersion\":\"istanbul\",\"libraries\":{},\"metadata\":{\"bytecodeHash\":\"ipfs\",\"useLiteralContent\":true},\"optimizer\":{\"enabled\":true,\"runs\":200},\"remappings\":[]},\"sources\":{\"@openzeppelin/contracts/access/Ownable.sol\":{\"content\":\"// SPDX-License-Identifier: MIT\\n\\npragma solidity >=0.6.0 <0.8.0;\\n\\nimport \\\"../utils/Context.sol\\\";\\n/**\\n * @dev Contract module which provides a basic access control mechanism, where\\n * there is an account (an owner) that can be granted exclusive access to\\n * specific functions.\\n *\\n * By default, the owner account will be the one that deploys the contract. This\\n * can later be changed with {transferOwnership}.\\n *\\n * This module is used through inheritance. It will make available the modifier\\n * `onlyOwner`, which can be applied to your functions to restrict their use to\\n * the owner.\\n */\\nabstract contract Ownable is Context {\\n    address private _owner;\\n\\n    event OwnershipTransferred(address indexed previousOwner, address indexed newOwner);\\n\\n    /**\\n     * @dev Initializes the contract setting the deployer as the initial owner.\\n     */\\n    constructor () internal {\\n        address msgSender = _msgSender();\\n        _owner = msgSender;\\n        emit OwnershipTransferred(address(0), msgSender);\\n    }\\n\\n    /**\\n     * @dev Returns the address of the current owner.\\n     */\\n    function owner() public view virtual returns (address) {\\n        return _owner;\\n    }\\n\\n    /**\\n     * @dev Throws if called by any account other than the owner.\\n     */\\n    modifier onlyOwner() {\\n        require(owner() == _msgSender(), \\\"Ownable: caller is not the owner\\\");\\n        _;\\n    }\\n\\n    /**\\n     * @dev Leaves the contract without owner. It will not be possible to call\\n     * `onlyOwner` functions anymore. Can only be called by the current owner.\\n     *\\n     * NOTE: Renouncing ownership will leave the contract without an owner,\\n     * thereby removing any functionality that is only available to the owner.\\n     */\\n    function renounceOwnership() public virtual onlyOwner {\\n        emit OwnershipTransferred(_owner, address(0));\\n        _owner = address(0);\\n    }\\n\\n    /**\\n     * @dev Transfers ownership of the contract to a new account (`newOwner`).\\n     * Can only be called by the current owner.\\n     */\\n    function transferOwnership(address newOwner) public virtual onlyOwner {\\n        require(newOwner != address(0), \\\"Ownable: new owner is the zero address\\\");\\n        emit OwnershipTransferred(_owner, newOwner);\\n        _owner = newOwner;\\n    }\\n}\\n\",\"keccak256\":\"0x15e2d5bd4c28a88548074c54d220e8086f638a71ed07e6b3ba5a70066fcf458d\",\"license\":\"MIT\"},\"@openzeppelin/contracts/math/SafeMath.sol\":{\"content\":\"// SPDX-License-Identifier: MIT\\n\\npragma solidity >=0.6.0 <0.8.0;\\n\\n/**\\n * @dev Wrappers over Solidity's arithmetic operations with added overflow\\n * checks.\\n *\\n * Arithmetic operations in Solidity wrap on overflow. This can easily result\\n * in bugs, because programmers usually assume that an overflow raises an\\n * error, which is the standard behavior in high level programming languages.\\n * `SafeMath` restores this intuition by reverting the transaction when an\\n * operation overflows.\\n *\\n * Using this library instead of the unchecked operations eliminates an entire\\n * class of bugs, so it's recommended to use it always.\\n */\\nlibrary SafeMath {\\n    /**\\n     * @dev Returns the addition of two unsigned integers, with an overflow flag.\\n     *\\n     * _Available since v3.4._\\n     */\\n    function tryAdd(uint256 a, uint256 b) internal pure returns (bool, uint256) {\\n        uint256 c = a + b;\\n        if (c < a) return (false, 0);\\n        return (true, c);\\n    }\\n\\n    /**\\n     * @dev Returns the substraction of two unsigned integers, with an overflow flag.\\n     *\\n     * _Available since v3.4._\\n     */\\n    function trySub(uint256 a, uint256 b) internal pure returns (bool, uint256) {\\n        if (b > a) return (false, 0);\\n        return (true, a - b);\\n    }\\n\\n    /**\\n     * @dev Returns the multiplication of two unsigned integers, with an overflow flag.\\n     *\\n     * _Available since v3.4._\\n     */\\n    function tryMul(uint256 a, uint256 b) internal pure returns (bool, uint256) {\\n        // Gas optimization: this is cheaper than requiring 'a' not being zero, but the\\n        // benefit is lost if 'b' is also tested.\\n        // See: https://github.com/OpenZeppelin/openzeppelin-contracts/pull/522\\n        if (a == 0) return (true, 0);\\n        uint256 c = a * b;\\n        if (c / a != b) return (false, 0);\\n        return (true, c);\\n    }\\n\\n    /**\\n     * @dev Returns the division of two unsigned integers, with a division by zero flag.\\n     *\\n     * _Available since v3.4._\\n     */\\n    function tryDiv(uint256 a, uint256 b) internal pure returns (bool, uint256) {\\n        if (b == 0) return (false, 0);\\n        return (true, a / b);\\n    }\\n\\n    /**\\n     * @dev Returns the remainder of dividing two unsigned integers, with a division by zero flag.\\n     *\\n     * _Available since v3.4._\\n     */\\n    function tryMod(uint256 a, uint256 b) internal pure returns (bool, uint256) {\\n        if (b == 0) return (false, 0);\\n        return (true, a % b);\\n    }\\n\\n    /**\\n     * @dev Returns the addition of two unsigned integers, reverting on\\n     * overflow.\\n     *\\n     * Counterpart to Solidity's `+` operator.\\n     *\\n     * Requirements:\\n     *\\n     * - Addition cannot overflow.\\n     */\\n    function add(uint256 a, uint256 b) internal pure returns (uint256) {\\n        uint256 c = a + b;\\n        require(c >= a, \\\"SafeMath: addition overflow\\\");\\n        return c;\\n    }\\n\\n    /**\\n     * @dev Returns the subtraction of two unsigned integers, reverting on\\n     * overflow (when the result is negative).\\n     *\\n     * Counterpart to Solidity's `-` operator.\\n     *\\n     * Requirements:\\n     *\\n     * - Subtraction cannot overflow.\\n     */\\n    function sub(uint256 a, uint256 b) internal pure returns (uint256) {\\n        require(b <= a, \\\"SafeMath: subtraction overflow\\\");\\n        return a - b;\\n    }\\n\\n    /**\\n     * @dev Returns the multiplication of two unsigned integers, reverting on\\n     * overflow.\\n     *\\n     * Counterpart to Solidity's `*` operator.\\n     *\\n     * Requirements:\\n     *\\n     * - Multiplication cannot overflow.\\n     */\\n    function mul(uint256 a, uint256 b) internal pure returns (uint256) {\\n        if (a == 0) return 0;\\n        uint256 c = a * b;\\n        require(c / a == b, \\\"SafeMath: multiplication overflow\\\");\\n        return c;\\n    }\\n\\n    /**\\n     * @dev Returns the integer division of two unsigned integers, reverting on\\n     * division by zero. The result is rounded towards zero.\\n     *\\n     * Counterpart to Solidity's `/` operator. Note: this function uses a\\n     * `revert` opcode (which leaves remaining gas untouched) while Solidity\\n     * uses an invalid opcode to revert (consuming all remaining gas).\\n     *\\n     * Requirements:\\n     *\\n     * - The divisor cannot be zero.\\n     */\\n    function div(uint256 a, uint256 b) internal pure returns (uint256) {\\n        require(b > 0, \\\"SafeMath: division by zero\\\");\\n        return a / b;\\n    }\\n\\n    /**\\n     * @dev Returns the remainder of dividing two unsigned integers. (unsigned integer modulo),\\n     * reverting when dividing by zero.\\n     *\\n     * Counterpart to Solidity's `%` operator. This function uses a `revert`\\n     * opcode (which leaves remaining gas untouched) while Solidity uses an\\n     * invalid opcode to revert (consuming all remaining gas).\\n     *\\n     * Requirements:\\n     *\\n     * - The divisor cannot be zero.\\n     */\\n    function mod(uint256 a, uint256 b) internal pure returns (uint256) {\\n        require(b > 0, \\\"SafeMath: modulo by zero\\\");\\n        return a % b;\\n    }\\n\\n    /**\\n     * @dev Returns the subtraction of two unsigned integers, reverting with custom message on\\n     * overflow (when the result is negative).\\n     *\\n     * CAUTION: This function is deprecated because it requires allocating memory for the error\\n     * message unnecessarily. For custom revert reasons use {trySub}.\\n     *\\n     * Counterpart to Solidity's `-` operator.\\n     *\\n     * Requirements:\\n     *\\n     * - Subtraction cannot overflow.\\n     */\\n    function sub(uint256 a, uint256 b, string memory errorMessage) internal pure returns (uint256) {\\n        require(b <= a, errorMessage);\\n        return a - b;\\n    }\\n\\n    /**\\n     * @dev Returns the integer division of two unsigned integers, reverting with custom message on\\n     * division by zero. The result is rounded towards zero.\\n     *\\n     * CAUTION: This function is deprecated because it requires allocating memory for the error\\n     * message unnecessarily. For custom revert reasons use {tryDiv}.\\n     *\\n     * Counterpart to Solidity's `/` operator. Note: this function uses a\\n     * `revert` opcode (which leaves remaining gas untouched) while Solidity\\n     * uses an invalid opcode to revert (consuming all remaining gas).\\n     *\\n     * Requirements:\\n     *\\n     * - The divisor cannot be zero.\\n     */\\n    function div(uint256 a, uint256 b, string memory errorMessage) internal pure returns (uint256) {\\n        require(b > 0, errorMessage);\\n        return a / b;\\n    }\\n\\n    /**\\n     * @dev Returns the remainder of dividing two unsigned integers. (unsigned integer modulo),\\n     * reverting with custom message when dividing by zero.\\n     *\\n     * CAUTION: This function is deprecated because it requires allocating memory for the error\\n     * message unnecessarily. For custom revert reasons use {tryMod}.\\n     *\\n     * Counterpart to Solidity's `%` operator. This function uses a `revert`\\n     * opcode (which leaves remaining gas untouched) while Solidity uses an\\n     * invalid opcode to revert (consuming all remaining gas).\\n     *\\n     * Requirements:\\n     *\\n     * - The divisor cannot be zero.\\n     */\\n    function mod(uint256 a, uint256 b, string memory errorMessage) internal pure returns (uint256) {\\n        require(b > 0, errorMessage);\\n        return a % b;\\n    }\\n}\\n\",\"keccak256\":\"0xcc78a17dd88fa5a2edc60c8489e2f405c0913b377216a5b26b35656b2d0dab52\",\"license\":\"MIT\"},\"@openzeppelin/contracts/token/ERC20/ERC20.sol\":{\"content\":\"// SPDX-License-Identifier: MIT\\n\\npragma solidity >=0.6.0 <0.8.0;\\n\\nimport \\\"../../utils/Context.sol\\\";\\nimport \\\"./IERC20.sol\\\";\\nimport \\\"../../math/SafeMath.sol\\\";\\n\\n/**\\n * @dev Implementation of the {IERC20} interface.\\n *\\n * This implementation is agnostic to the way tokens are created. This means\\n * that a supply mechanism has to be added in a derived contract using {_mint}.\\n * For a generic mechanism see {ERC20PresetMinterPauser}.\\n *\\n * TIP: For a detailed writeup see our guide\\n * https://forum.zeppelin.solutions/t/how-to-implement-erc20-supply-mechanisms/226[How\\n * to implement supply mechanisms].\\n *\\n * We have followed general OpenZeppelin guidelines: functions revert instead\\n * of returning `false` on failure. This behavior is nonetheless conventional\\n * and does not conflict with the expectations of ERC20 applications.\\n *\\n * Additionally, an {Approval} event is emitted on calls to {transferFrom}.\\n * This allows applications to reconstruct the allowance for all accounts just\\n * by listening to said events. Other implementations of the EIP may not emit\\n * these events, as it isn't required by the specification.\\n *\\n * Finally, the non-standard {decreaseAllowance} and {increaseAllowance}\\n * functions have been added to mitigate the well-known issues around setting\\n * allowances. See {IERC20-approve}.\\n */\\ncontract ERC20 is Context, IERC20 {\\n    using SafeMath for uint256;\\n\\n    mapping (address => uint256) private _balances;\\n\\n    mapping (address => mapping (address => uint256)) private _allowances;\\n\\n    uint256 private _totalSupply;\\n\\n    string private _name;\\n    string private _symbol;\\n    uint8 private _decimals;\\n\\n    /**\\n     * @dev Sets the values for {name} and {symbol}, initializes {decimals} with\\n     * a default value of 18.\\n     *\\n     * To select a different value for {decimals}, use {_setupDecimals}.\\n     *\\n     * All three of these values are immutable: they can only be set once during\\n     * construction.\\n     */\\n    constructor (string memory name_, string memory symbol_) public {\\n        _name = name_;\\n        _symbol = symbol_;\\n        _decimals = 18;\\n    }\\n\\n    /**\\n     * @dev Returns the name of the token.\\n     */\\n    function name() public view virtual returns (string memory) {\\n        return _name;\\n    }\\n\\n    /**\\n     * @dev Returns the symbol of the token, usually a shorter version of the\\n     * name.\\n     */\\n    function symbol() public view virtual returns (string memory) {\\n        return _symbol;\\n    }\\n\\n    /**\\n     * @dev Returns the number of decimals used to get its user representation.\\n     * For example, if `decimals` equals `2`, a balance of `505` tokens should\\n     * be displayed to a user as `5,05` (`505 / 10 ** 2`).\\n     *\\n     * Tokens usually opt for a value of 18, imitating the relationship between\\n     * Ether and Wei. This is the value {ERC20} uses, unless {_setupDecimals} is\\n     * called.\\n     *\\n     * NOTE: This information is only used for _display_ purposes: it in\\n     * no way affects any of the arithmetic of the contract, including\\n     * {IERC20-balanceOf} and {IERC20-transfer}.\\n     */\\n    function decimals() public view virtual returns (uint8) {\\n        return _decimals;\\n    }\\n\\n    /**\\n     * @dev See {IERC20-totalSupply}.\\n     */\\n    function totalSupply() public view virtual override returns (uint256) {\\n        return _totalSupply;\\n    }\\n\\n    /**\\n     * @dev See {IERC20-balanceOf}.\\n     */\\n    function balanceOf(address account) public view virtual override returns (uint256) {\\n        return _balances[account];\\n    }\\n\\n    /**\\n     * @dev See {IERC20-transfer}.\\n     *\\n     * Requirements:\\n     *\\n     * - `recipient` cannot be the zero address.\\n     * - the caller must have a balance of at least `amount`.\\n     */\\n    function transfer(address recipient, uint256 amount) public virtual override returns (bool) {\\n        _transfer(_msgSender(), recipient, amount);\\n        return true;\\n    }\\n\\n    /**\\n     * @dev See {IERC20-allowance}.\\n     */\\n    function allowance(address owner, address spender) public view virtual override returns (uint256) {\\n        return _allowances[owner][spender];\\n    }\\n\\n    /**\\n     * @dev See {IERC20-approve}.\\n     *\\n     * Requirements:\\n     *\\n     * - `spender` cannot be the zero address.\\n     */\\n    function approve(address spender, uint256 amount) public virtual override returns (bool) {\\n        _approve(_msgSender(), spender, amount);\\n        return true;\\n    }\\n\\n    /**\\n     * @dev See {IERC20-transferFrom}.\\n     *\\n     * Emits an {Approval} event indicating the updated allowance. This is not\\n     * required by the EIP. See the note at the beginning of {ERC20}.\\n     *\\n     * Requirements:\\n     *\\n     * - `sender` and `recipient` cannot be the zero address.\\n     * - `sender` must have a balance of at least `amount`.\\n     * - the caller must have allowance for ``sender``'s tokens of at least\\n     * `amount`.\\n     */\\n    function transferFrom(address sender, address recipient, uint256 amount) public virtual override returns (bool) {\\n        _transfer(sender, recipient, amount);\\n        _approve(sender, _msgSender(), _allowances[sender][_msgSender()].sub(amount, \\\"ERC20: transfer amount exceeds allowance\\\"));\\n        return true;\\n    }\\n\\n    /**\\n     * @dev Atomically increases the allowance granted to `spender` by the caller.\\n     *\\n     * This is an alternative to {approve} that can be used as a mitigation for\\n     * problems described in {IERC20-approve}.\\n     *\\n     * Emits an {Approval} event indicating the updated allowance.\\n     *\\n     * Requirements:\\n     *\\n     * - `spender` cannot be the zero address.\\n     */\\n    function increaseAllowance(address spender, uint256 addedValue) public virtual returns (bool) {\\n        _approve(_msgSender(), spender, _allowances[_msgSender()][spender].add(addedValue));\\n        return true;\\n    }\\n\\n    /**\\n     * @dev Atomically decreases the allowance granted to `spender` by the caller.\\n     *\\n     * This is an alternative to {approve} that can be used as a mitigation for\\n     * problems described in {IERC20-approve}.\\n     *\\n     * Emits an {Approval} event indicating the updated allowance.\\n     *\\n     * Requirements:\\n     *\\n     * - `spender` cannot be the zero address.\\n     * - `spender` must have allowance for the caller of at least\\n     * `subtractedValue`.\\n     */\\n    function decreaseAllowance(address spender, uint256 subtractedValue) public virtual returns (bool) {\\n        _approve(_msgSender(), spender, _allowances[_msgSender()][spender].sub(subtractedValue, \\\"ERC20: decreased allowance below zero\\\"));\\n        return true;\\n    }\\n\\n    /**\\n     * @dev Moves tokens `amount` from `sender` to `recipient`.\\n     *\\n     * This is internal function is equivalent to {transfer}, and can be used to\\n     * e.g. implement automatic token fees, slashing mechanisms, etc.\\n     *\\n     * Emits a {Transfer} event.\\n     *\\n     * Requirements:\\n     *\\n     * - `sender` cannot be the zero address.\\n     * - `recipient` cannot be the zero address.\\n     * - `sender` must have a balance of at least `amount`.\\n     */\\n    function _transfer(address sender, address recipient, uint256 amount) internal virtual {\\n        require(sender != address(0), \\\"ERC20: transfer from the zero address\\\");\\n        require(recipient != address(0), \\\"ERC20: transfer to the zero address\\\");\\n\\n        _beforeTokenTransfer(sender, recipient, amount);\\n\\n        _balances[sender] = _balances[sender].sub(amount, \\\"ERC20: transfer amount exceeds balance\\\");\\n        _balances[recipient] = _balances[recipient].add(amount);\\n        emit Transfer(sender, recipient, amount);\\n    }\\n\\n    /** @dev Creates `amount` tokens and assigns them to `account`, increasing\\n     * the total supply.\\n     *\\n     * Emits a {Transfer} event with `from` set to the zero address.\\n     *\\n     * Requirements:\\n     *\\n     * - `to` cannot be the zero address.\\n     */\\n    function _mint(address account, uint256 amount) internal virtual {\\n        require(account != address(0), \\\"ERC20: mint to the zero address\\\");\\n\\n        _beforeTokenTransfer(address(0), account, amount);\\n\\n        _totalSupply = _totalSupply.add(amount);\\n        _balances[account] = _balances[account].add(amount);\\n        emit Transfer(address(0), account, amount);\\n    }\\n\\n    /**\\n     * @dev Destroys `amount` tokens from `account`, reducing the\\n     * total supply.\\n     *\\n     * Emits a {Transfer} event with `to` set to the zero address.\\n     *\\n     * Requirements:\\n     *\\n     * - `account` cannot be the zero address.\\n     * - `account` must have at least `amount` tokens.\\n     */\\n    function _burn(address account, uint256 amount) internal virtual {\\n        require(account != address(0), \\\"ERC20: burn from the zero address\\\");\\n\\n        _beforeTokenTransfer(account, address(0), amount);\\n\\n        _balances[account] = _balances[account].sub(amount, \\\"ERC20: burn amount exceeds balance\\\");\\n        _totalSupply = _totalSupply.sub(amount);\\n        emit Transfer(account, address(0), amount);\\n    }\\n\\n    /**\\n     * @dev Sets `amount` as the allowance of `spender` over the `owner` s tokens.\\n     *\\n     * This internal function is equivalent to `approve`, and can be used to\\n     * e.g. set automatic allowances for certain subsystems, etc.\\n     *\\n     * Emits an {Approval} event.\\n     *\\n     * Requirements:\\n     *\\n     * - `owner` cannot be the zero address.\\n     * - `spender` cannot be the zero address.\\n     */\\n    function _approve(address owner, address spender, uint256 amount) internal virtual {\\n        require(owner != address(0), \\\"ERC20: approve from the zero address\\\");\\n        require(spender != address(0), \\\"ERC20: approve to the zero address\\\");\\n\\n        _allowances[owner][spender] = amount;\\n        emit Approval(owner, spender, amount);\\n    }\\n\\n    /**\\n     * @dev Sets {decimals} to a value other than the default one of 18.\\n     *\\n     * WARNING: This function should only be called from the constructor. Most\\n     * applications that interact with token contracts will not expect\\n     * {decimals} to ever change, and may work incorrectly if it does.\\n     */\\n    function _setupDecimals(uint8 decimals_) internal virtual {\\n        _decimals = decimals_;\\n    }\\n\\n    /**\\n     * @dev Hook that is called before any transfer of tokens. This includes\\n     * minting and burning.\\n     *\\n     * Calling conditions:\\n     *\\n     * - when `from` and `to` are both non-zero, `amount` of ``from``'s tokens\\n     * will be to transferred to `to`.\\n     * - when `from` is zero, `amount` tokens will be minted for `to`.\\n     * - when `to` is zero, `amount` of ``from``'s tokens will be burned.\\n     * - `from` and `to` are never both zero.\\n     *\\n     * To learn more about hooks, head to xref:ROOT:extending-contracts.adoc#using-hooks[Using Hooks].\\n     */\\n    function _beforeTokenTransfer(address from, address to, uint256 amount) internal virtual { }\\n}\\n\",\"keccak256\":\"0xca0c2396dbeb3503b51abf4248ebf77a1461edad513c01529df51850a012bee3\",\"license\":\"MIT\"},\"@openzeppelin/contracts/token/ERC20/ERC20Burnable.sol\":{\"content\":\"// SPDX-License-Identifier: MIT\\n\\npragma solidity >=0.6.0 <0.8.0;\\n\\nimport \\\"../../utils/Context.sol\\\";\\nimport \\\"./ERC20.sol\\\";\\n\\n/**\\n * @dev Extension of {ERC20} that allows token holders to destroy both their own\\n * tokens and those that they have an allowance for, in a way that can be\\n * recognized off-chain (via event analysis).\\n */\\nabstract contract ERC20Burnable is Context, ERC20 {\\n    using SafeMath for uint256;\\n\\n    /**\\n     * @dev Destroys `amount` tokens from the caller.\\n     *\\n     * See {ERC20-_burn}.\\n     */\\n    function burn(uint256 amount) public virtual {\\n        _burn(_msgSender(), amount);\\n    }\\n\\n    /**\\n     * @dev Destroys `amount` tokens from `account`, deducting from the caller's\\n     * allowance.\\n     *\\n     * See {ERC20-_burn} and {ERC20-allowance}.\\n     *\\n     * Requirements:\\n     *\\n     * - the caller must have allowance for ``accounts``'s tokens of at least\\n     * `amount`.\\n     */\\n    function burnFrom(address account, uint256 amount) public virtual {\\n        uint256 decreasedAllowance = allowance(account, _msgSender()).sub(amount, \\\"ERC20: burn amount exceeds allowance\\\");\\n\\n        _approve(account, _msgSender(), decreasedAllowance);\\n        _burn(account, amount);\\n    }\\n}\\n\",\"keccak256\":\"0x9c0eb3b0e11d2480d49991dc384f1e5f9c9b9967cc81944d50916a9b9c6c4984\",\"license\":\"MIT\"},\"@openzeppelin/contracts/token/ERC20/IERC20.sol\":{\"content\":\"// SPDX-License-Identifier: MIT\\n\\npragma solidity >=0.6.0 <0.8.0;\\n\\n/**\\n * @dev Interface of the ERC20 standard as defined in the EIP.\\n */\\ninterface IERC20 {\\n    /**\\n     * @dev Returns the amount of tokens in existence.\\n     */\\n    function totalSupply() external view returns (uint256);\\n\\n    /**\\n     * @dev Returns the amount of tokens owned by `account`.\\n     */\\n    function balanceOf(address account) external view returns (uint256);\\n\\n    /**\\n     * @dev Moves `amount` tokens from the caller's account to `recipient`.\\n     *\\n     * Returns a boolean value indicating whether the operation succeeded.\\n     *\\n     * Emits a {Transfer} event.\\n     */\\n    function transfer(address recipient, uint256 amount) external returns (bool);\\n\\n    /**\\n     * @dev Returns the remaining number of tokens that `spender` will be\\n     * allowed to spend on behalf of `owner` through {transferFrom}. This is\\n     * zero by default.\\n     *\\n     * This value changes when {approve} or {transferFrom} are called.\\n     */\\n    function allowance(address owner, address spender) external view returns (uint256);\\n\\n    /**\\n     * @dev Sets `amount` as the allowance of `spender` over the caller's tokens.\\n     *\\n     * Returns a boolean value indicating whether the operation succeeded.\\n     *\\n     * IMPORTANT: Beware that changing an allowance with this method brings the risk\\n     * that someone may use both the old and the new allowance by unfortunate\\n     * transaction ordering. One possible solution to mitigate this race\\n     * condition is to first reduce the spender's allowance to 0 and set the\\n     * desired value afterwards:\\n     * https://github.com/ethereum/EIPs/issues/20#issuecomment-263524729\\n     *\\n     * Emits an {Approval} event.\\n     */\\n    function approve(address spender, uint256 amount) external returns (bool);\\n\\n    /**\\n     * @dev Moves `amount` tokens from `sender` to `recipient` using the\\n     * allowance mechanism. `amount` is then deducted from the caller's\\n     * allowance.\\n     *\\n     * Returns a boolean value indicating whether the operation succeeded.\\n     *\\n     * Emits a {Transfer} event.\\n     */\\n    function transferFrom(address sender, address recipient, uint256 amount) external returns (bool);\\n\\n    /**\\n     * @dev Emitted when `value` tokens are moved from one account (`from`) to\\n     * another (`to`).\\n     *\\n     * Note that `value` may be zero.\\n     */\\n    event Transfer(address indexed from, address indexed to, uint256 value);\\n\\n    /**\\n     * @dev Emitted when the allowance of a `spender` for an `owner` is set by\\n     * a call to {approve}. `value` is the new allowance.\\n     */\\n    event Approval(address indexed owner, address indexed spender, uint256 value);\\n}\\n\",\"keccak256\":\"0x5f02220344881ce43204ae4a6281145a67bc52c2bb1290a791857df3d19d78f5\",\"license\":\"MIT\"},\"@openzeppelin/contracts/token/ERC20/SafeERC20.sol\":{\"content\":\"// SPDX-License-Identifier: MIT\\n\\npragma solidity >=0.6.0 <0.8.0;\\n\\nimport \\\"./IERC20.sol\\\";\\nimport \\\"../../math/SafeMath.sol\\\";\\nimport \\\"../../utils/Address.sol\\\";\\n\\n/**\\n * @title SafeERC20\\n * @dev Wrappers around ERC20 operations that throw on failure (when the token\\n * contract returns false). Tokens that return no value (and instead revert or\\n * throw on failure) are also supported, non-reverting calls are assumed to be\\n * successful.\\n * To use this library you can add a `using SafeERC20 for IERC20;` statement to your contract,\\n * which allows you to call the safe operations as `token.safeTransfer(...)`, etc.\\n */\\nlibrary SafeERC20 {\\n    using SafeMath for uint256;\\n    using Address for address;\\n\\n    function safeTransfer(IERC20 token, address to, uint256 value) internal {\\n        _callOptionalReturn(token, abi.encodeWithSelector(token.transfer.selector, to, value));\\n    }\\n\\n    function safeTransferFrom(IERC20 token, address from, address to, uint256 value) internal {\\n        _callOptionalReturn(token, abi.encodeWithSelector(token.transferFrom.selector, from, to, value));\\n    }\\n\\n    /**\\n     * @dev Deprecated. This function has issues similar to the ones found in\\n     * {IERC20-approve}, and its usage is discouraged.\\n     *\\n     * Whenever possible, use {safeIncreaseAllowance} and\\n     * {safeDecreaseAllowance} instead.\\n     */\\n    function safeApprove(IERC20 token, address spender, uint256 value) internal {\\n        // safeApprove should only be called when setting an initial allowance,\\n        // or when resetting it to zero. To increase and decrease it, use\\n        // 'safeIncreaseAllowance' and 'safeDecreaseAllowance'\\n        // solhint-disable-next-line max-line-length\\n        require((value == 0) || (token.allowance(address(this), spender) == 0),\\n            \\\"SafeERC20: approve from non-zero to non-zero allowance\\\"\\n        );\\n        _callOptionalReturn(token, abi.encodeWithSelector(token.approve.selector, spender, value));\\n    }\\n\\n    function safeIncreaseAllowance(IERC20 token, address spender, uint256 value) internal {\\n        uint256 newAllowance = token.allowance(address(this), spender).add(value);\\n        _callOptionalReturn(token, abi.encodeWithSelector(token.approve.selector, spender, newAllowance));\\n    }\\n\\n    function safeDecreaseAllowance(IERC20 token, address spender, uint256 value) internal {\\n        uint256 newAllowance = token.allowance(address(this), spender).sub(value, \\\"SafeERC20: decreased allowance below zero\\\");\\n        _callOptionalReturn(token, abi.encodeWithSelector(token.approve.selector, spender, newAllowance));\\n    }\\n\\n    /**\\n     * @dev Imitates a Solidity high-level call (i.e. a regular function call to a contract), relaxing the requirement\\n     * on the return value: the return value is optional (but if data is returned, it must not be false).\\n     * @param token The token targeted by the call.\\n     * @param data The call data (encoded using abi.encode or one of its variants).\\n     */\\n    function _callOptionalReturn(IERC20 token, bytes memory data) private {\\n        // We need to perform a low level call here, to bypass Solidity's return data size checking mechanism, since\\n        // we're implementing it ourselves. We use {Address.functionCall} to perform this call, which verifies that\\n        // the target address contains contract code and also asserts for success in the low-level call.\\n\\n        bytes memory returndata = address(token).functionCall(data, \\\"SafeERC20: low-level call failed\\\");\\n        if (returndata.length > 0) { // Return data is optional\\n            // solhint-disable-next-line max-line-length\\n            require(abi.decode(returndata, (bool)), \\\"SafeERC20: ERC20 operation did not succeed\\\");\\n        }\\n    }\\n}\\n\",\"keccak256\":\"0xf12dfbe97e6276980b83d2830bb0eb75e0cf4f3e626c2471137f82158ae6a0fc\",\"license\":\"MIT\"},\"@openzeppelin/contracts/utils/Address.sol\":{\"content\":\"// SPDX-License-Identifier: MIT\\n\\npragma solidity >=0.6.2 <0.8.0;\\n\\n/**\\n * @dev Collection of functions related to the address type\\n */\\nlibrary Address {\\n    /**\\n     * @dev Returns true if `account` is a contract.\\n     *\\n     * [IMPORTANT]\\n     * ====\\n     * It is unsafe to assume that an address for which this function returns\\n     * false is an externally-owned account (EOA) and not a contract.\\n     *\\n     * Among others, `isContract` will return false for the following\\n     * types of addresses:\\n     *\\n     *  - an externally-owned account\\n     *  - a contract in construction\\n     *  - an address where a contract will be created\\n     *  - an address where a contract lived, but was destroyed\\n     * ====\\n     */\\n    function isContract(address account) internal view returns (bool) {\\n        // This method relies on extcodesize, which returns 0 for contracts in\\n        // construction, since the code is only stored at the end of the\\n        // constructor execution.\\n\\n        uint256 size;\\n        // solhint-disable-next-line no-inline-assembly\\n        assembly { size := extcodesize(account) }\\n        return size > 0;\\n    }\\n\\n    /**\\n     * @dev Replacement for Solidity's `transfer`: sends `amount` wei to\\n     * `recipient`, forwarding all available gas and reverting on errors.\\n     *\\n     * https://eips.ethereum.org/EIPS/eip-1884[EIP1884] increases the gas cost\\n     * of certain opcodes, possibly making contracts go over the 2300 gas limit\\n     * imposed by `transfer`, making them unable to receive funds via\\n     * `transfer`. {sendValue} removes this limitation.\\n     *\\n     * https://diligence.consensys.net/posts/2019/09/stop-using-soliditys-transfer-now/[Learn more].\\n     *\\n     * IMPORTANT: because control is transferred to `recipient`, care must be\\n     * taken to not create reentrancy vulnerabilities. Consider using\\n     * {ReentrancyGuard} or the\\n     * https://solidity.readthedocs.io/en/v0.5.11/security-considerations.html#use-the-checks-effects-interactions-pattern[checks-effects-interactions pattern].\\n     */\\n    function sendValue(address payable recipient, uint256 amount) internal {\\n        require(address(this).balance >= amount, \\\"Address: insufficient balance\\\");\\n\\n        // solhint-disable-next-line avoid-low-level-calls, avoid-call-value\\n        (bool success, ) = recipient.call{ value: amount }(\\\"\\\");\\n        require(success, \\\"Address: unable to send value, recipient may have reverted\\\");\\n    }\\n\\n    /**\\n     * @dev Performs a Solidity function call using a low level `call`. A\\n     * plain`call` is an unsafe replacement for a function call: use this\\n     * function instead.\\n     *\\n     * If `target` reverts with a revert reason, it is bubbled up by this\\n     * function (like regular Solidity function calls).\\n     *\\n     * Returns the raw returned data. To convert to the expected return value,\\n     * use https://solidity.readthedocs.io/en/latest/units-and-global-variables.html?highlight=abi.decode#abi-encoding-and-decoding-functions[`abi.decode`].\\n     *\\n     * Requirements:\\n     *\\n     * - `target` must be a contract.\\n     * - calling `target` with `data` must not revert.\\n     *\\n     * _Available since v3.1._\\n     */\\n    function functionCall(address target, bytes memory data) internal returns (bytes memory) {\\n      return functionCall(target, data, \\\"Address: low-level call failed\\\");\\n    }\\n\\n    /**\\n     * @dev Same as {xref-Address-functionCall-address-bytes-}[`functionCall`], but with\\n     * `errorMessage` as a fallback revert reason when `target` reverts.\\n     *\\n     * _Available since v3.1._\\n     */\\n    function functionCall(address target, bytes memory data, string memory errorMessage) internal returns (bytes memory) {\\n        return functionCallWithValue(target, data, 0, errorMessage);\\n    }\\n\\n    /**\\n     * @dev Same as {xref-Address-functionCall-address-bytes-}[`functionCall`],\\n     * but also transferring `value` wei to `target`.\\n     *\\n     * Requirements:\\n     *\\n     * - the calling contract must have an ETH balance of at least `value`.\\n     * - the called Solidity function must be `payable`.\\n     *\\n     * _Available since v3.1._\\n     */\\n    function functionCallWithValue(address target, bytes memory data, uint256 value) internal returns (bytes memory) {\\n        return functionCallWithValue(target, data, value, \\\"Address: low-level call with value failed\\\");\\n    }\\n\\n    /**\\n     * @dev Same as {xref-Address-functionCallWithValue-address-bytes-uint256-}[`functionCallWithValue`], but\\n     * with `errorMessage` as a fallback revert reason when `target` reverts.\\n     *\\n     * _Available since v3.1._\\n     */\\n    function functionCallWithValue(address target, bytes memory data, uint256 value, string memory errorMessage) internal returns (bytes memory) {\\n        require(address(this).balance >= value, \\\"Address: insufficient balance for call\\\");\\n        require(isContract(target), \\\"Address: call to non-contract\\\");\\n\\n        // solhint-disable-next-line avoid-low-level-calls\\n        (bool success, bytes memory returndata) = target.call{ value: value }(data);\\n        return _verifyCallResult(success, returndata, errorMessage);\\n    }\\n\\n    /**\\n     * @dev Same as {xref-Address-functionCall-address-bytes-}[`functionCall`],\\n     * but performing a static call.\\n     *\\n     * _Available since v3.3._\\n     */\\n    function functionStaticCall(address target, bytes memory data) internal view returns (bytes memory) {\\n        return functionStaticCall(target, data, \\\"Address: low-level static call failed\\\");\\n    }\\n\\n    /**\\n     * @dev Same as {xref-Address-functionCall-address-bytes-string-}[`functionCall`],\\n     * but performing a static call.\\n     *\\n     * _Available since v3.3._\\n     */\\n    function functionStaticCall(address target, bytes memory data, string memory errorMessage) internal view returns (bytes memory) {\\n        require(isContract(target), \\\"Address: static call to non-contract\\\");\\n\\n        // solhint-disable-next-line avoid-low-level-calls\\n        (bool success, bytes memory returndata) = target.staticcall(data);\\n        return _verifyCallResult(success, returndata, errorMessage);\\n    }\\n\\n    /**\\n     * @dev Same as {xref-Address-functionCall-address-bytes-}[`functionCall`],\\n     * but performing a delegate call.\\n     *\\n     * _Available since v3.4._\\n     */\\n    function functionDelegateCall(address target, bytes memory data) internal returns (bytes memory) {\\n        return functionDelegateCall(target, data, \\\"Address: low-level delegate call failed\\\");\\n    }\\n\\n    /**\\n     * @dev Same as {xref-Address-functionCall-address-bytes-string-}[`functionCall`],\\n     * but performing a delegate call.\\n     *\\n     * _Available since v3.4._\\n     */\\n    function functionDelegateCall(address target, bytes memory data, string memory errorMessage) internal returns (bytes memory) {\\n        require(isContract(target), \\\"Address: delegate call to non-contract\\\");\\n\\n        // solhint-disable-next-line avoid-low-level-calls\\n        (bool success, bytes memory returndata) = target.delegatecall(data);\\n        return _verifyCallResult(success, returndata, errorMessage);\\n    }\\n\\n    function _verifyCallResult(bool success, bytes memory returndata, string memory errorMessage) private pure returns(bytes memory) {\\n        if (success) {\\n            return returndata;\\n        } else {\\n            // Look for revert reason and bubble it up if present\\n            if (returndata.length > 0) {\\n                // The easiest way to bubble the revert reason is using memory via assembly\\n\\n                // solhint-disable-next-line no-inline-assembly\\n                assembly {\\n                    let returndata_size := mload(returndata)\\n                    revert(add(32, returndata), returndata_size)\\n                }\\n            } else {\\n                revert(errorMessage);\\n            }\\n        }\\n    }\\n}\\n\",\"keccak256\":\"0x28911e614500ae7c607a432a709d35da25f3bc5ddc8bd12b278b66358070c0ea\",\"license\":\"MIT\"},\"@openzeppelin/contracts/utils/Context.sol\":{\"content\":\"// SPDX-License-Identifier: MIT\\n\\npragma solidity >=0.6.0 <0.8.0;\\n\\n/*\\n * @dev Provides information about the current execution context, including the\\n * sender of the transaction and its data. While these are generally available\\n * via msg.sender and msg.data, they should not be accessed in such a direct\\n * manner, since when dealing with GSN meta-transactions the account sending and\\n * paying for execution may not be the actual sender (as far as an application\\n * is concerned).\\n *\\n * This contract is only required for intermediate, library-like contracts.\\n */\\nabstract contract Context {\\n    function _msgSender() internal view virtual returns (address payable) {\\n        return msg.sender;\\n    }\\n\\n    function _msgData() internal view virtual returns (bytes memory) {\\n        this; // silence state mutability warning without generating bytecode - see https://github.com/ethereum/solidity/issues/2691\\n        return msg.data;\\n    }\\n}\\n\",\"keccak256\":\"0x8d3cb350f04ff49cfb10aef08d87f19dcbaecc8027b0bed12f3275cd12f38cf0\",\"license\":\"MIT\"},\"contracts/stable/EvmoSwapUtils.sol\":{\"content\":\"// SPDX-License-Identifier: MIT\\n\\npragma solidity 0.6.12;\\n\\nimport \\\"@openzeppelin/contracts/math/SafeMath.sol\\\";\\nimport \\\"@openzeppelin/contracts/token/ERC20/SafeERC20.sol\\\";\\nimport \\\"./LPToken.sol\\\";\\nimport \\\"./MathUtils.sol\\\";\\n\\n/**\\n * @title SwapUtils library\\n * @notice A library to be used within Swap.sol. Contains functions responsible for custody and AMM functionalities.\\n * @dev Contracts relying on this library must initialize SwapUtils.Swap struct then use this library\\n * for SwapUtils.Swap struct. Note that this library contains both functions called by users and admins.\\n * Admin functions should be protected within contracts using this library.\\n */\\nlibrary EvmoSwapUtils {\\n    using SafeERC20 for IERC20;\\n    using SafeMath for uint256;\\n    using MathUtils for uint256;\\n\\n    /*** EVENTS ***/\\n\\n    event TokenSwap(\\n        address indexed buyer,\\n        uint256 tokensSold,\\n        uint256 tokensBought,\\n        uint128 soldId,\\n        uint128 boughtId\\n    );\\n    event AddLiquidity(\\n        address indexed provider,\\n        uint256[] tokenAmounts,\\n        uint256[] fees,\\n        uint256 invariant,\\n        uint256 lpTokenSupply\\n    );\\n    event RemoveLiquidity(\\n        address indexed provider,\\n        uint256[] tokenAmounts,\\n        uint256 lpTokenSupply\\n    );\\n    event RemoveLiquidityOne(\\n        address indexed provider,\\n        uint256 lpTokenAmount,\\n        uint256 lpTokenSupply,\\n        uint256 boughtId,\\n        uint256 tokensBought\\n    );\\n    event RemoveLiquidityImbalance(\\n        address indexed provider,\\n        uint256[] tokenAmounts,\\n        uint256[] fees,\\n        uint256 invariant,\\n        uint256 lpTokenSupply\\n    );\\n    event NewAdminFee(uint256 newAdminFee);\\n    event NewSwapFee(uint256 newSwapFee);\\n    event NewWithdrawFee(uint256 newWithdrawFee);\\n    event NewDepositFee(uint256 newDepositFee);\\n    event RampA(\\n        uint256 oldA,\\n        uint256 newA,\\n        uint256 initialTime,\\n        uint256 futureTime\\n    );\\n    event StopRampA(uint256 currentA, uint256 time);\\n\\n    struct Swap {\\n        // variables around the ramp management of A,\\n        // the amplification coefficient * n * (n - 1)\\n        // see https://www.curve.fi/stableswap-paper.pdf for details\\n        uint256 initialA;\\n        uint256 futureA;\\n        uint256 initialATime;\\n        uint256 futureATime;\\n        // fee calculation\\n        uint256 swapFee;\\n        uint256 adminFee;\\n        uint256 defaultDepositFee;\\n        uint256 defaultWithdrawFee;\\n        address devaddr;\\n        LPToken lpToken;\\n        // contract references for all tokens being pooled\\n        IERC20[] pooledTokens;\\n        // multipliers for each pooled token's precision to get to POOL_PRECISION_DECIMALS\\n        // for example, TBTC has 18 decimals, so the multiplier should be 1. WBTC\\n        // has 8, so the multiplier should be 10 ** 18 / 10 ** 8 => 10 ** 10\\n        uint256[] tokenPrecisionMultipliers;\\n        // the pool balance of each token, in the token's precision\\n        // the contract's actual token balance might differ\\n        uint256[] balances;\\n        mapping(address => uint256) depositTimestamp;\\n        mapping(address => uint256) withdrawFeeMultiplier;\\n    }\\n\\n    // Struct storing variables used in calculations in the\\n    // calculateWithdrawOneTokenDY function to avoid stack too deep errors\\n    struct CalculateWithdrawOneTokenDYInfo {\\n        uint256 d0;\\n        uint256 d1;\\n        uint256 newY;\\n        uint256 feePerToken;\\n        uint256 preciseA;\\n    }\\n\\n    // Struct storing variables used in calculation in addLiquidity function\\n    // to avoid stack too deep error\\n    struct AddLiquidityInfo {\\n        uint256 d0;\\n        uint256 d1;\\n        uint256 d2;\\n        uint256 preciseA;\\n    }\\n\\n    // Struct storing variables used in calculation in removeLiquidityImbalance function\\n    // to avoid stack too deep error\\n    struct RemoveLiquidityImbalanceInfo {\\n        uint256 d0;\\n        uint256 d1;\\n        uint256 d2;\\n        uint256 preciseA;\\n    }\\n\\n    // the precision all pools tokens will be converted to\\n    uint8 public constant POOL_PRECISION_DECIMALS = 18;\\n\\n    // the denominator used to calculate admin and LP fees. For example, an\\n    // LP fee might be something like tradeAmount.mul(fee).div(FEE_DENOMINATOR)\\n    uint256 private constant FEE_DENOMINATOR = 10**10;\\n\\n    // Max swap fee is 1% or 100bps of each swap\\n    uint256 public constant MAX_SWAP_FEE = 10**8;\\n\\n    // Max adminFee is 100% of the swapFee\\n    // adminFee does not add additional fee on top of swapFee\\n    // Instead it takes a certain % of the swapFee. Therefore it has no impact on the\\n    // users but only on the earnings of LPs\\n    uint256 public constant MAX_ADMIN_FEE = 10**10;\\n\\n    // Max withdrawFee is 1% of the value withdrawn\\n    // Fee will be redistributed to the LPs in the pool, rewarding\\n    // long term providers.\\n    uint256 public constant MAX_WITHDRAW_FEE = 10**8;\\n\\n    // Max depositFee is 1% of the value deposited\\n    uint256 public constant MAX_DEPOSIT_FEE = 10**8;\\n    \\n    // Constant value used as max loop limit\\n    uint256 private constant MAX_LOOP_LIMIT = 256;\\n\\n    // Constant values used in ramping A calculations\\n    uint256 public constant A_PRECISION = 100;\\n    uint256 public constant MAX_A = 10**6;\\n    uint256 private constant MAX_A_CHANGE = 2;\\n    uint256 private constant MIN_RAMP_TIME = 14 days;\\n\\n    /*** VIEW & PURE FUNCTIONS ***/\\n\\n    /**\\n     * @notice Return A, the amplification coefficient * n * (n - 1)\\n     * @dev See the StableSwap paper for details\\n     * @param self Swap struct to read from\\n     * @return A parameter\\n     */\\n    function getA(Swap storage self) external view returns (uint256) {\\n        return _getA(self);\\n    }\\n\\n    /**\\n     * @notice Return A, the amplification coefficient * n * (n - 1)\\n     * @dev See the StableSwap paper for details\\n     * @param self Swap struct to read from\\n     * @return A parameter\\n     */\\n    function _getA(Swap storage self) internal view returns (uint256) {\\n        return _getAPrecise(self).div(A_PRECISION);\\n    }\\n\\n    /**\\n     * @notice Return A in its raw precision\\n     * @dev See the StableSwap paper for details\\n     * @param self Swap struct to read from\\n     * @return A parameter in its raw precision form\\n     */\\n    function getAPrecise(Swap storage self) external view returns (uint256) {\\n        return _getAPrecise(self);\\n    }\\n\\n    /**\\n     * @notice Calculates and returns A based on the ramp settings\\n     * @dev See the StableSwap paper for details\\n     * @param self Swap struct to read from\\n     * @return A parameter in its raw precision form\\n     */\\n    function _getAPrecise(Swap storage self) internal view returns (uint256) {\\n        uint256 t1 = self.futureATime; // time when ramp is finished\\n        uint256 a1 = self.futureA; // final A value when ramp is finished\\n\\n        if (block.timestamp < t1) {\\n            uint256 t0 = self.initialATime; // time when ramp is started\\n            uint256 a0 = self.initialA; // initial A value when ramp is started\\n            if (a1 > a0) {\\n                // a0 + (a1 - a0) * (block.timestamp - t0) / (t1 - t0)\\n                return\\n                    a0.add(\\n                        a1.sub(a0).mul(block.timestamp.sub(t0)).div(t1.sub(t0))\\n                    );\\n            } else {\\n                // a0 - (a0 - a1) * (block.timestamp - t0) / (t1 - t0)\\n                return\\n                    a0.sub(\\n                        a0.sub(a1).mul(block.timestamp.sub(t0)).div(t1.sub(t0))\\n                    );\\n            }\\n        } else {\\n            return a1;\\n        }\\n    }\\n\\n    /**\\n     * @notice Retrieves the timestamp of last deposit made by the given address\\n     * @param self Swap struct to read from\\n     * @return timestamp of last deposit\\n     */\\n    function getDepositTimestamp(Swap storage self, address user)\\n        external\\n        view\\n        returns (uint256)\\n    {\\n        return self.depositTimestamp[user];\\n    }\\n\\n    /**\\n     * @notice Calculate the dy, the amount of selected token that user receives and\\n     * the fee of withdrawing in one token\\n     * @param account the address that is withdrawing\\n     * @param tokenAmount the amount to withdraw in the pool's precision\\n     * @param tokenIndex which token will be withdrawn\\n     * @param self Swap struct to read from\\n     * @return the amount of token user will receive and the associated swap fee\\n     */\\n    function calculateWithdrawOneToken(\\n        Swap storage self,\\n        address account,\\n        uint256 tokenAmount,\\n        uint8 tokenIndex\\n    ) public view returns (uint256, uint256) {\\n        uint256 dy;\\n        uint256 newY;\\n\\n        (dy, newY) = calculateWithdrawOneTokenDY(self, tokenIndex, tokenAmount);\\n\\n        // dy_0 (without fees)\\n        // dy, dy_0 - dy\\n\\n        uint256 dySwapFee =\\n            _xp(self)[tokenIndex]\\n                .sub(newY)\\n                .div(self.tokenPrecisionMultipliers[tokenIndex])\\n                .sub(dy);\\n\\n        dy = dy\\n            .mul(\\n            FEE_DENOMINATOR.sub(calculateCurrentWithdrawFee(self, account))\\n        )\\n            .div(FEE_DENOMINATOR);\\n\\n        return (dy, dySwapFee);\\n    }\\n\\n    /**\\n     * @notice Calculate the dy of withdrawing in one token\\n     * @param self Swap struct to read from\\n     * @param tokenIndex which token will be withdrawn\\n     * @param tokenAmount the amount to withdraw in the pools precision\\n     * @return the d and the new y after withdrawing one token\\n     */\\n    function calculateWithdrawOneTokenDY(\\n        Swap storage self,\\n        uint8 tokenIndex,\\n        uint256 tokenAmount\\n    ) internal view returns (uint256, uint256) {\\n        require(\\n            tokenIndex < self.pooledTokens.length,\\n            \\\"Token index out of range\\\"\\n        );\\n\\n        // Get the current D, then solve the stableswap invariant\\n        // y_i for D - tokenAmount\\n        uint256[] memory xp = _xp(self);\\n        CalculateWithdrawOneTokenDYInfo memory v =\\n            CalculateWithdrawOneTokenDYInfo(0, 0, 0, 0, 0);\\n        v.preciseA = _getAPrecise(self);\\n        v.d0 = getD(xp, v.preciseA);\\n        v.d1 = v.d0.sub(tokenAmount.mul(v.d0).div(self.lpToken.totalSupply()));\\n\\n        require(tokenAmount <= xp[tokenIndex], \\\"Withdraw exceeds available\\\");\\n\\n        v.newY = getYD(v.preciseA, tokenIndex, xp, v.d1);\\n\\n        uint256[] memory xpReduced = new uint256[](xp.length);\\n\\n        v.feePerToken = _feePerToken(self);\\n        for (uint256 i = 0; i < self.pooledTokens.length; i++) {\\n            uint256 xpi = xp[i];\\n            // if i == tokenIndex, dxExpected = xp[i] * d1 / d0 - newY\\n            // else dxExpected = xp[i] - (xp[i] * d1 / d0)\\n            // xpReduced[i] -= dxExpected * fee / FEE_DENOMINATOR\\n            xpReduced[i] = xpi.sub(\\n                (\\n                    (i == tokenIndex)\\n                        ? xpi.mul(v.d1).div(v.d0).sub(v.newY)\\n                        : xpi.sub(xpi.mul(v.d1).div(v.d0))\\n                )\\n                    .mul(v.feePerToken)\\n                    .div(FEE_DENOMINATOR)\\n            );\\n        }\\n\\n        uint256 dy =\\n            xpReduced[tokenIndex].sub(\\n                getYD(v.preciseA, tokenIndex, xpReduced, v.d1)\\n            );\\n        dy = dy.sub(1).div(self.tokenPrecisionMultipliers[tokenIndex]);\\n\\n        return (dy, v.newY);\\n    }\\n\\n    /**\\n     * @notice Calculate the price of a token in the pool with given\\n     * precision-adjusted balances and a particular D.\\n     *\\n     * @dev This is accomplished via solving the invariant iteratively.\\n     * See the StableSwap paper and Curve.fi implementation for further details.\\n     *\\n     * x_1**2 + x1 * (sum' - (A*n**n - 1) * D / (A * n**n)) = D ** (n + 1) / (n ** (2 * n) * prod' * A)\\n     * x_1**2 + b*x_1 = c\\n     * x_1 = (x_1**2 + c) / (2*x_1 + b)\\n     *\\n     * @param a the amplification coefficient * n * (n - 1). See the StableSwap paper for details.\\n     * @param tokenIndex Index of token we are calculating for.\\n     * @param xp a precision-adjusted set of pool balances. Array should be\\n     * the same cardinality as the pool.\\n     * @param d the stableswap invariant\\n     * @return the price of the token, in the same precision as in xp\\n     */\\n    function getYD(\\n        uint256 a,\\n        uint8 tokenIndex,\\n        uint256[] memory xp,\\n        uint256 d\\n    ) internal pure returns (uint256) {\\n        uint256 numTokens = xp.length;\\n        require(tokenIndex < numTokens, \\\"Token not found\\\");\\n\\n        uint256 c = d;\\n        uint256 s;\\n        uint256 nA = a.mul(numTokens);\\n\\n        for (uint256 i = 0; i < numTokens; i++) {\\n            if (i != tokenIndex) {\\n                s = s.add(xp[i]);\\n                c = c.mul(d).div(xp[i].mul(numTokens));\\n                // If we were to protect the division loss we would have to keep the denominator separate\\n                // and divide at the end. However this leads to overflow with large numTokens or/and D.\\n                // c = c * D * D * D * ... overflow!\\n            }\\n        }\\n        c = c.mul(d).mul(A_PRECISION).div(nA.mul(numTokens));\\n\\n        uint256 b = s.add(d.mul(A_PRECISION).div(nA));\\n        uint256 yPrev;\\n        uint256 y = d;\\n        for (uint256 i = 0; i < MAX_LOOP_LIMIT; i++) {\\n            yPrev = y;\\n            y = y.mul(y).add(c).div(y.mul(2).add(b).sub(d));\\n            if (y.within1(yPrev)) {\\n                return y;\\n            }\\n        }\\n        revert(\\\"Approximation did not converge\\\");\\n    }\\n\\n    /**\\n     * @notice Get D, the StableSwap invariant, based on a set of balances and a particular A.\\n     * @param xp a precision-adjusted set of pool balances. Array should be the same cardinality\\n     * as the pool.\\n     * @param a the amplification coefficient * n * (n - 1) in A_PRECISION.\\n     * See the StableSwap paper for details\\n     * @return the invariant, at the precision of the pool\\n     */\\n    function getD(uint256[] memory xp, uint256 a)\\n        internal\\n        pure\\n        returns (uint256)\\n    {\\n        uint256 numTokens = xp.length;\\n        uint256 s;\\n        for (uint256 i = 0; i < numTokens; i++) {\\n            s = s.add(xp[i]);\\n        }\\n        if (s == 0) {\\n            return 0;\\n        }\\n\\n        uint256 prevD;\\n        uint256 d = s;\\n        uint256 nA = a.mul(numTokens);\\n\\n        for (uint256 i = 0; i < MAX_LOOP_LIMIT; i++) {\\n            uint256 dP = d;\\n            for (uint256 j = 0; j < numTokens; j++) {\\n                dP = dP.mul(d).div(xp[j].mul(numTokens));\\n                // If we were to protect the division loss we would have to keep the denominator separate\\n                // and divide at the end. However this leads to overflow with large numTokens or/and D.\\n                // dP = dP * D * D * D * ... overflow!\\n            }\\n            prevD = d;\\n            d = nA.mul(s).div(A_PRECISION).add(dP.mul(numTokens)).mul(d).div(\\n                nA.sub(A_PRECISION).mul(d).div(A_PRECISION).add(\\n                    numTokens.add(1).mul(dP)\\n                )\\n            );\\n            if (d.within1(prevD)) {\\n                return d;\\n            }\\n        }\\n\\n        // Convergence should occur in 4 loops or less. If this is reached, there may be something wrong\\n        // with the pool. If this were to occur repeatedly, LPs should withdraw via `removeLiquidity()`\\n        // function which does not rely on D.\\n        revert(\\\"D does not converge\\\");\\n    }\\n\\n    /**\\n     * @notice Get D, the StableSwap invariant, based on self Swap struct\\n     * @param self Swap struct to read from\\n     * @return The invariant, at the precision of the pool\\n     */\\n    function getD(Swap storage self) internal view returns (uint256) {\\n        return getD(_xp(self), _getAPrecise(self));\\n    }\\n\\n    /**\\n     * @notice Given a set of balances and precision multipliers, return the\\n     * precision-adjusted balances.\\n     *\\n     * @param balances an array of token balances, in their native precisions.\\n     * These should generally correspond with pooled tokens.\\n     *\\n     * @param precisionMultipliers an array of multipliers, corresponding to\\n     * the amounts in the balances array. When multiplied together they\\n     * should yield amounts at the pool's precision.\\n     *\\n     * @return an array of amounts \\\"scaled\\\" to the pool's precision\\n     */\\n    function _xp(\\n        uint256[] memory balances,\\n        uint256[] memory precisionMultipliers\\n    ) internal pure returns (uint256[] memory) {\\n        uint256 numTokens = balances.length;\\n        require(\\n            numTokens == precisionMultipliers.length,\\n            \\\"Balances must match multipliers\\\"\\n        );\\n        uint256[] memory xp = new uint256[](numTokens);\\n        for (uint256 i = 0; i < numTokens; i++) {\\n            xp[i] = balances[i].mul(precisionMultipliers[i]);\\n        }\\n        return xp;\\n    }\\n\\n    /**\\n     * @notice Return the precision-adjusted balances of all tokens in the pool\\n     * @param self Swap struct to read from\\n     * @param balances array of balances to scale\\n     * @return balances array \\\"scaled\\\" to the pool's precision, allowing\\n     * them to be more easily compared.\\n     */\\n    function _xp(Swap storage self, uint256[] memory balances)\\n        internal\\n        view\\n        returns (uint256[] memory)\\n    {\\n        return _xp(balances, self.tokenPrecisionMultipliers);\\n    }\\n\\n    /**\\n     * @notice Return the precision-adjusted balances of all tokens in the pool\\n     * @param self Swap struct to read from\\n     * @return the pool balances \\\"scaled\\\" to the pool's precision, allowing\\n     * them to be more easily compared.\\n     */\\n    function _xp(Swap storage self) internal view returns (uint256[] memory) {\\n        return _xp(self.balances, self.tokenPrecisionMultipliers);\\n    }\\n\\n    /**\\n     * @notice Get the virtual price, to help calculate profit\\n     * @param self Swap struct to read from\\n     * @return the virtual price, scaled to precision of POOL_PRECISION_DECIMALS\\n     */\\n    function getVirtualPrice(Swap storage self)\\n        external\\n        view\\n        returns (uint256)\\n    {\\n        uint256 d = getD(_xp(self), _getAPrecise(self));\\n        uint256 supply = self.lpToken.totalSupply();\\n        if (supply > 0) {\\n            return\\n                d.mul(10**uint256(ERC20(self.lpToken).decimals())).div(supply);\\n        }\\n        return 0;\\n    }\\n\\n    /**\\n     * @notice Calculate the new balances of the tokens given the indexes of the token\\n     * that is swapped from (FROM) and the token that is swapped to (TO).\\n     * This function is used as a helper function to calculate how much TO token\\n     * the user should receive on swap.\\n     *\\n     * @param self Swap struct to read from\\n     * @param tokenIndexFrom index of FROM token\\n     * @param tokenIndexTo index of TO token\\n     * @param x the new total amount of FROM token\\n     * @param xp balances of the tokens in the pool\\n     * @return the amount of TO token that should remain in the pool\\n     */\\n    function getY(\\n        Swap storage self,\\n        uint8 tokenIndexFrom,\\n        uint8 tokenIndexTo,\\n        uint256 x,\\n        uint256[] memory xp\\n    ) internal view returns (uint256) {\\n        uint256 numTokens = self.pooledTokens.length;\\n        require(\\n            tokenIndexFrom != tokenIndexTo,\\n            \\\"Can't compare token to itself\\\"\\n        );\\n        require(\\n            tokenIndexFrom < numTokens && tokenIndexTo < numTokens,\\n            \\\"Tokens must be in pool\\\"\\n        );\\n\\n        uint256 a = _getAPrecise(self);\\n        uint256 d = getD(xp, a);\\n        uint256 c = d;\\n        uint256 s;\\n        uint256 nA = numTokens.mul(a);\\n\\n        uint256 _x;\\n        for (uint256 i = 0; i < numTokens; i++) {\\n            if (i == tokenIndexFrom) {\\n                _x = x;\\n            } else if (i != tokenIndexTo) {\\n                _x = xp[i];\\n            } else {\\n                continue;\\n            }\\n            s = s.add(_x);\\n            c = c.mul(d).div(_x.mul(numTokens));\\n            // If we were to protect the division loss we would have to keep the denominator separate\\n            // and divide at the end. However this leads to overflow with large numTokens or/and D.\\n            // c = c * D * D * D * ... overflow!\\n        }\\n        c = c.mul(d).mul(A_PRECISION).div(nA.mul(numTokens));\\n        uint256 b = s.add(d.mul(A_PRECISION).div(nA));\\n        uint256 yPrev;\\n        uint256 y = d;\\n\\n        // iterative approximation\\n        for (uint256 i = 0; i < MAX_LOOP_LIMIT; i++) {\\n            yPrev = y;\\n            y = y.mul(y).add(c).div(y.mul(2).add(b).sub(d));\\n            if (y.within1(yPrev)) {\\n                return y;\\n            }\\n        }\\n        revert(\\\"Approximation did not converge\\\");\\n    }\\n\\n    /**\\n     * @notice Externally calculates a swap between two tokens.\\n     * @param self Swap struct to read from\\n     * @param tokenIndexFrom the token to sell\\n     * @param tokenIndexTo the token to buy\\n     * @param dx the number of tokens to sell. If the token charges a fee on transfers,\\n     * use the amount that gets transferred after the fee.\\n     * @return dy the number of tokens the user will get\\n     */\\n    function calculateSwap(\\n        Swap storage self,\\n        uint8 tokenIndexFrom,\\n        uint8 tokenIndexTo,\\n        uint256 dx\\n    ) external view returns (uint256 dy) {\\n        (dy, ) = _calculateSwap(self, tokenIndexFrom, tokenIndexTo, dx);\\n    }\\n\\n    /**\\n     * @notice Internally calculates a swap between two tokens.\\n     *\\n     * @dev The caller is expected to transfer the actual amounts (dx and dy)\\n     * using the token contracts.\\n     *\\n     * @param self Swap struct to read from\\n     * @param tokenIndexFrom the token to sell\\n     * @param tokenIndexTo the token to buy\\n     * @param dx the number of tokens to sell. If the token charges a fee on transfers,\\n     * use the amount that gets transferred after the fee.\\n     * @return dy the number of tokens the user will get\\n     * @return dyFee the associated fee\\n     */\\n    function _calculateSwap(\\n        Swap storage self,\\n        uint8 tokenIndexFrom,\\n        uint8 tokenIndexTo,\\n        uint256 dx\\n    ) internal view returns (uint256 dy, uint256 dyFee) {\\n        uint256[] memory xp = _xp(self);\\n        require(\\n            tokenIndexFrom < xp.length && tokenIndexTo < xp.length,\\n            \\\"Token index out of range\\\"\\n        );\\n        uint256 x =\\n            dx.mul(self.tokenPrecisionMultipliers[tokenIndexFrom]).add(\\n                xp[tokenIndexFrom]\\n            );\\n        uint256 y = getY(self, tokenIndexFrom, tokenIndexTo, x, xp);\\n        dy = xp[tokenIndexTo].sub(y).sub(1);\\n        dyFee = dy.mul(self.swapFee).div(FEE_DENOMINATOR);\\n        dy = dy.sub(dyFee).div(self.tokenPrecisionMultipliers[tokenIndexTo]);\\n    }\\n\\n    /**\\n     * @notice A simple method to calculate amount of each underlying\\n     * tokens that is returned upon burning given amount of\\n     * LP tokens\\n     *\\n     * @param account the address that is removing liquidity. required for withdraw fee calculation\\n     * @param amount the amount of LP tokens that would to be burned on\\n     * withdrawal\\n     * @return array of amounts of tokens user will receive\\n     */\\n    function calculateRemoveLiquidity(\\n        Swap storage self,\\n        address account,\\n        uint256 amount\\n    ) external view returns (uint256[] memory) {\\n        return _calculateRemoveLiquidity(self, account, amount);\\n    }\\n\\n    function _calculateRemoveLiquidity(\\n        Swap storage self,\\n        address account,\\n        uint256 amount\\n    ) internal view returns (uint256[] memory) {\\n        uint256 totalSupply = self.lpToken.totalSupply();\\n        require(amount <= totalSupply, \\\"Cannot exceed total supply\\\");\\n\\n        uint256 feeAdjustedAmount =\\n            amount\\n                .mul(\\n                FEE_DENOMINATOR.sub(calculateCurrentWithdrawFee(self, account))\\n            )\\n                .div(FEE_DENOMINATOR);\\n\\n        uint256[] memory amounts = new uint256[](self.pooledTokens.length);\\n\\n        for (uint256 i = 0; i < self.pooledTokens.length; i++) {\\n            amounts[i] = self.balances[i].mul(feeAdjustedAmount).div(\\n                totalSupply\\n            );\\n        }\\n        return amounts;\\n    }\\n\\n    /**\\n     * @notice Calculate the fee that is applied when the given user withdraws.\\n     * Withdraw fee decays linearly over 4 weeks.\\n     * @param user address you want to calculate withdraw fee of\\n     * @return current withdraw fee of the user\\n     */\\n    function calculateCurrentWithdrawFee(Swap storage self, address user)\\n        public\\n        view\\n        returns (uint256)\\n    {\\n        uint256 endTime = self.depositTimestamp[user].add(4 weeks);\\n        if (endTime > block.timestamp) {\\n            uint256 timeLeftover = endTime.sub(block.timestamp);\\n            return\\n                self\\n                    .defaultWithdrawFee\\n                    .mul(self.withdrawFeeMultiplier[user])\\n                    .mul(timeLeftover)\\n                    .div(4 weeks)\\n                    .div(FEE_DENOMINATOR);\\n        }\\n        return 0;\\n    }\\n\\n    /**\\n     * @notice A simple method to calculate prices from deposits or\\n     * withdrawals, excluding fees but including slippage. This is\\n     * helpful as an input into the various \\\"min\\\" parameters on calls\\n     * to fight front-running\\n     *\\n     * @dev This shouldn't be used outside frontends for user estimates.\\n     *\\n     * @param self Swap struct to read from\\n     * @param account address of the account depositing or withdrawing tokens\\n     * @param amounts an array of token amounts to deposit or withdrawal,\\n     * corresponding to pooledTokens. The amount should be in each\\n     * pooled token's native precision. If a token charges a fee on transfers,\\n     * use the amount that gets transferred after the fee.\\n     * @param deposit whether this is a deposit or a withdrawal\\n     * @return if deposit was true, total amount of lp token that will be minted and if\\n     * deposit was false, total amount of lp token that will be burned\\n     */\\n    function calculateTokenAmount(\\n        Swap storage self,\\n        address account,\\n        uint256[] calldata amounts,\\n        bool deposit\\n    ) external view returns (uint256) {\\n        uint256 numTokens = self.pooledTokens.length;\\n        uint256 a = _getAPrecise(self);\\n        uint256 d0 = getD(_xp(self, self.balances), a);\\n        uint256[] memory balances1 = self.balances;\\n        for (uint256 i = 0; i < numTokens; i++) {\\n            if (deposit) {\\n                balances1[i] = balances1[i].add(amounts[i]);\\n            } else {\\n                balances1[i] = balances1[i].sub(\\n                    amounts[i],\\n                    \\\"Cannot withdraw more than available\\\"\\n                );\\n            }\\n        }\\n        uint256 d1 = getD(_xp(self, balances1), a);\\n        uint256 totalSupply = self.lpToken.totalSupply();\\n\\n        if (deposit) {\\n            return d1.sub(d0).mul(totalSupply).div(d0);\\n        } else {\\n            return\\n                d0.sub(d1).mul(totalSupply).div(d0).mul(FEE_DENOMINATOR).div(\\n                    FEE_DENOMINATOR.sub(\\n                        calculateCurrentWithdrawFee(self, account)\\n                    )\\n                );\\n        }\\n    }\\n\\n    /**\\n     * @notice return accumulated amount of admin fees of the token with given index\\n     * @param self Swap struct to read from\\n     * @param index Index of the pooled token\\n     * @return admin balance in the token's precision\\n     */\\n    function getAdminBalance(Swap storage self, uint256 index)\\n        external\\n        view\\n        returns (uint256)\\n    {\\n        require(index < self.pooledTokens.length, \\\"Token index out of range\\\");\\n        return\\n            self.pooledTokens[index].balanceOf(address(this)).sub(\\n                self.balances[index]\\n            );\\n    }\\n\\n    /**\\n     * @notice internal helper function to calculate fee per token multiplier used in\\n     * swap fee calculations\\n     * @param self Swap struct to read from\\n     */\\n    function _feePerToken(Swap storage self) internal view returns (uint256) {\\n        return\\n            self.swapFee.mul(self.pooledTokens.length).div(\\n                self.pooledTokens.length.sub(1).mul(4)\\n            );\\n    }\\n\\n    /*** STATE MODIFYING FUNCTIONS ***/\\n\\n    /**\\n     * @notice swap two tokens in the pool\\n     * @param self Swap struct to read from and write to\\n     * @param tokenIndexFrom the token the user wants to sell\\n     * @param tokenIndexTo the token the user wants to buy\\n     * @param dx the amount of tokens the user wants to sell\\n     * @param minDy the min amount the user would like to receive, or revert.\\n     * @return amount of token user received on swap\\n     */\\n    function swap(\\n        Swap storage self,\\n        uint8 tokenIndexFrom,\\n        uint8 tokenIndexTo,\\n        uint256 dx,\\n        uint256 minDy\\n    ) external returns (uint256) {\\n        require(\\n            dx <= self.pooledTokens[tokenIndexFrom].balanceOf(msg.sender),\\n            \\\"Cannot swap more than you own\\\"\\n        );\\n\\n        // Transfer tokens first to see if a fee was charged on transfer\\n        uint256 beforeBalance =\\n            self.pooledTokens[tokenIndexFrom].balanceOf(address(this));\\n        self.pooledTokens[tokenIndexFrom].safeTransferFrom(\\n            msg.sender,\\n            address(this),\\n            dx\\n        );\\n\\n        // Use the actual transferred amount for AMM math\\n        uint256 transferredDx =\\n            self.pooledTokens[tokenIndexFrom].balanceOf(address(this)).sub(\\n                beforeBalance\\n            );\\n\\n        (uint256 dy, uint256 dyFee) =\\n            _calculateSwap(self, tokenIndexFrom, tokenIndexTo, transferredDx);\\n        require(dy >= minDy, \\\"Swap didn't result in min tokens\\\");\\n\\n        uint256 dyAdminFee =\\n            dyFee.mul(self.adminFee).div(FEE_DENOMINATOR).div(\\n                self.tokenPrecisionMultipliers[tokenIndexTo]\\n            );\\n\\n        self.balances[tokenIndexFrom] = self.balances[tokenIndexFrom].add(\\n            transferredDx\\n        );\\n        self.balances[tokenIndexTo] = self.balances[tokenIndexTo].sub(dy).sub(\\n            dyAdminFee\\n        );\\n\\n        self.pooledTokens[tokenIndexTo].safeTransfer(msg.sender, dy);\\n\\n        emit TokenSwap(\\n            msg.sender,\\n            transferredDx,\\n            dy,\\n            tokenIndexFrom,\\n            tokenIndexTo\\n        );\\n\\n        return dy;\\n    }\\n\\n    /**\\n     * @notice Add liquidity to the pool\\n     * @param self Swap struct to read from and write to\\n     * @param amounts the amounts of each token to add, in their native precision\\n     * @param minToMint the minimum LP tokens adding this amount of liquidity\\n     * should mint, otherwise revert. Handy for front-running mitigation\\n     * @return amount of LP token user received\\n     */\\n    function addLiquidity(\\n        Swap storage self,\\n        uint256[] memory amounts,\\n        uint256 minToMint\\n    ) external returns (uint256) {\\n        require(\\n            amounts.length == self.pooledTokens.length,\\n            \\\"Amounts must match pooled tokens\\\"\\n        );\\n\\n        uint256[] memory fees = new uint256[](self.pooledTokens.length);\\n\\n        // current state\\n        AddLiquidityInfo memory v = AddLiquidityInfo(0, 0, 0, 0);\\n\\n        if (self.lpToken.totalSupply() != 0) {\\n            v.d0 = getD(self);\\n        }\\n        uint256[] memory newBalances = self.balances;\\n\\n        for (uint256 i = 0; i < self.pooledTokens.length; i++) {\\n            require(\\n                self.lpToken.totalSupply() != 0 || amounts[i] > 0,\\n                \\\"Must supply all tokens in pool\\\"\\n            );\\n\\n            // Transfer tokens first to see if a fee was charged on transfer\\n            if (amounts[i] != 0) {\\n                uint256 beforeBalance =\\n                    self.pooledTokens[i].balanceOf(address(this));\\n                self.pooledTokens[i].safeTransferFrom(\\n                    msg.sender,\\n                    address(this),\\n                    amounts[i]\\n                );\\n\\n                // Update the amounts[] with actual transfer amount\\n                amounts[i] = self.pooledTokens[i].balanceOf(address(this)).sub(\\n                    beforeBalance\\n                );\\n            }\\n\\n            newBalances[i] = self.balances[i].add(amounts[i]);\\n        }\\n\\n        // invariant after change\\n        v.preciseA = _getAPrecise(self);\\n        v.d1 = getD(_xp(self, newBalances), v.preciseA);\\n        require(v.d1 > v.d0, \\\"D should increase\\\");\\n\\n        // updated to reflect fees and calculate the user's LP tokens\\n        v.d2 = v.d1;\\n        if (self.lpToken.totalSupply() != 0) {\\n            uint256 feePerToken = _feePerToken(self);\\n            for (uint256 i = 0; i < self.pooledTokens.length; i++) {\\n                uint256 idealBalance = v.d1.mul(self.balances[i]).div(v.d0);\\n                fees[i] = feePerToken\\n                    .mul(idealBalance.difference(newBalances[i]))\\n                    .div(FEE_DENOMINATOR);\\n                self.balances[i] = newBalances[i].sub(\\n                    fees[i].mul(self.adminFee).div(FEE_DENOMINATOR)\\n                );\\n                newBalances[i] = newBalances[i].sub(fees[i]);\\n            }\\n            v.d2 = getD(_xp(self, newBalances), v.preciseA);\\n        } else {\\n            // the initial depositor doesn't pay fees\\n            self.balances = newBalances;\\n        }\\n\\n        uint256 toMint;\\n        uint256 toMintFee;\\n        uint256 toMintUser;\\n        if (self.lpToken.totalSupply() == 0) {\\n            toMint = v.d1;\\n        } else {\\n            toMint = v.d2.sub(v.d0).mul(self.lpToken.totalSupply()).div(v.d0);\\n        }\\n\\n        require(toMint >= minToMint, \\\"Couldn't mint min requested\\\");\\n        // if deposit fee is none, mint full amount\\n        if (self.defaultDepositFee == 0) {\\n            self.lpToken.mint(msg.sender, toMint);\\n        } else {\\n            // mint the user's LP tokens minus the deposit fee\\n            toMintFee = toMint.mul(self.defaultDepositFee).div(FEE_DENOMINATOR);\\n            toMintUser = toMint.sub(toMintFee);\\n            self.lpToken.mint(self.devaddr, toMintFee);\\n            self.lpToken.mint(msg.sender, toMintUser);\\n        }\\n       \\n        emit AddLiquidity(\\n            msg.sender,\\n            amounts,\\n            fees,\\n            v.d1,\\n            self.lpToken.totalSupply()\\n        );\\n\\n        return toMint;\\n    }\\n\\n    /**\\n     * @notice Update the withdraw fee for `user`. If the user is currently\\n     * not providing liquidity in the pool, sets to default value. If not, recalculate\\n     * the starting withdraw fee based on the last deposit's time & amount relative\\n     * to the new deposit.\\n     *\\n     * @param self Swap struct to read from and write to\\n     * @param user address of the user depositing tokens\\n     * @param toMint amount of pool tokens to be minted\\n     */\\n    function updateUserWithdrawFee(\\n        Swap storage self,\\n        address user,\\n        uint256 toMint\\n    ) external {\\n        _updateUserWithdrawFee(self, user, toMint);\\n    }\\n\\n    function _updateUserWithdrawFee(\\n        Swap storage self,\\n        address user,\\n        uint256 toMint\\n    ) internal {\\n        // If token is transferred to address 0 (or burned), don't update the fee.\\n        if (user == address(0)) {\\n            return;\\n        }\\n        if (self.defaultWithdrawFee == 0) {\\n            // If current fee is set to 0%, set multiplier to FEE_DENOMINATOR\\n            self.withdrawFeeMultiplier[user] = FEE_DENOMINATOR;\\n        } else {\\n            // Otherwise, calculate appropriate discount based on last deposit amount\\n            uint256 currentFee = calculateCurrentWithdrawFee(self, user);\\n            uint256 currentBalance = self.lpToken.balanceOf(user);\\n\\n            // ((currentBalance * currentFee) + (toMint * defaultWithdrawFee)) * FEE_DENOMINATOR /\\n            // ((toMint + currentBalance) * defaultWithdrawFee)\\n            self.withdrawFeeMultiplier[user] = currentBalance\\n                .mul(currentFee)\\n                .add(toMint.mul(self.defaultWithdrawFee))\\n                .mul(FEE_DENOMINATOR)\\n                .div(toMint.add(currentBalance).mul(self.defaultWithdrawFee));\\n        }\\n        self.depositTimestamp[user] = block.timestamp;\\n    }\\n\\n    /**\\n     * @notice Burn LP tokens to remove liquidity from the pool.\\n     * @dev Liquidity can always be removed, even when the pool is paused.\\n     * @param self Swap struct to read from and write to\\n     * @param amount the amount of LP tokens to burn\\n     * @param minAmounts the minimum amounts of each token in the pool\\n     * acceptable for this burn. Useful as a front-running mitigation\\n     * @return amounts of tokens the user received\\n     */\\n    function removeLiquidity(\\n        Swap storage self,\\n        uint256 amount,\\n        uint256[] calldata minAmounts\\n    ) external returns (uint256[] memory) {\\n        require(amount <= self.lpToken.balanceOf(msg.sender), \\\">LP.balanceOf\\\");\\n        require(\\n            minAmounts.length == self.pooledTokens.length,\\n            \\\"minAmounts must match poolTokens\\\"\\n        );\\n\\n        uint256[] memory amounts =\\n            _calculateRemoveLiquidity(self, msg.sender, amount);\\n\\n        for (uint256 i = 0; i < amounts.length; i++) {\\n            require(amounts[i] >= minAmounts[i], \\\"amounts[i] < minAmounts[i]\\\");\\n            self.balances[i] = self.balances[i].sub(amounts[i]);\\n            self.pooledTokens[i].safeTransfer(msg.sender, amounts[i]);\\n        }\\n\\n        self.lpToken.burnFrom(msg.sender, amount);\\n\\n        emit RemoveLiquidity(msg.sender, amounts, self.lpToken.totalSupply());\\n\\n        return amounts;\\n    }\\n\\n    /**\\n     * @notice Remove liquidity from the pool all in one token.\\n     * @param self Swap struct to read from and write to\\n     * @param tokenAmount the amount of the lp tokens to burn\\n     * @param tokenIndex the index of the token you want to receive\\n     * @param minAmount the minimum amount to withdraw, otherwise revert\\n     * @return amount chosen token that user received\\n     */\\n    function removeLiquidityOneToken(\\n        Swap storage self,\\n        uint256 tokenAmount,\\n        uint8 tokenIndex,\\n        uint256 minAmount\\n    ) external returns (uint256) {\\n        uint256 totalSupply = self.lpToken.totalSupply();\\n        uint256 numTokens = self.pooledTokens.length;\\n        require(\\n            tokenAmount <= self.lpToken.balanceOf(msg.sender),\\n            \\\">LP.balanceOf\\\"\\n        );\\n        require(tokenIndex < numTokens, \\\"Token not found\\\");\\n\\n        uint256 dyFee;\\n        uint256 dy;\\n\\n        (dy, dyFee) = calculateWithdrawOneToken(\\n            self,\\n            msg.sender,\\n            tokenAmount,\\n            tokenIndex\\n        );\\n\\n        require(dy >= minAmount, \\\"dy < minAmount\\\");\\n\\n        self.balances[tokenIndex] = self.balances[tokenIndex].sub(\\n            dy.add(dyFee.mul(self.adminFee).div(FEE_DENOMINATOR))\\n        );\\n        self.lpToken.burnFrom(msg.sender, tokenAmount);\\n        self.pooledTokens[tokenIndex].safeTransfer(msg.sender, dy);\\n\\n        emit RemoveLiquidityOne(\\n            msg.sender,\\n            tokenAmount,\\n            totalSupply,\\n            tokenIndex,\\n            dy\\n        );\\n\\n        return dy;\\n    }\\n\\n    /**\\n     * @notice Remove liquidity from the pool, weighted differently than the\\n     * pool's current balances.\\n     *\\n     * @param self Swap struct to read from and write to\\n     * @param amounts how much of each token to withdraw\\n     * @param maxBurnAmount the max LP token provider is willing to pay to\\n     * remove liquidity. Useful as a front-running mitigation.\\n     * @return actual amount of LP tokens burned in the withdrawal\\n     */\\n    function removeLiquidityImbalance(\\n        Swap storage self,\\n        uint256[] memory amounts,\\n        uint256 maxBurnAmount\\n    ) public returns (uint256) {\\n        require(\\n            amounts.length == self.pooledTokens.length,\\n            \\\"Amounts should match pool tokens\\\"\\n        );\\n        require(\\n            maxBurnAmount <= self.lpToken.balanceOf(msg.sender) &&\\n                maxBurnAmount != 0,\\n            \\\">LP.balanceOf\\\"\\n        );\\n\\n        RemoveLiquidityImbalanceInfo memory v =\\n            RemoveLiquidityImbalanceInfo(0, 0, 0, 0);\\n\\n        uint256 tokenSupply = self.lpToken.totalSupply();\\n        uint256 feePerToken = _feePerToken(self);\\n\\n        uint256[] memory balances1 = self.balances;\\n\\n        v.preciseA = _getAPrecise(self);\\n        v.d0 = getD(_xp(self), v.preciseA);\\n        for (uint256 i = 0; i < self.pooledTokens.length; i++) {\\n            balances1[i] = balances1[i].sub(\\n                amounts[i],\\n                \\\"Cannot withdraw more than available\\\"\\n            );\\n        }\\n        v.d1 = getD(_xp(self, balances1), v.preciseA);\\n        uint256[] memory fees = new uint256[](self.pooledTokens.length);\\n\\n        for (uint256 i = 0; i < self.pooledTokens.length; i++) {\\n            uint256 idealBalance = v.d1.mul(self.balances[i]).div(v.d0);\\n            uint256 difference = idealBalance.difference(balances1[i]);\\n            fees[i] = feePerToken.mul(difference).div(FEE_DENOMINATOR);\\n            self.balances[i] = balances1[i].sub(\\n                fees[i].mul(self.adminFee).div(FEE_DENOMINATOR)\\n            );\\n            balances1[i] = balances1[i].sub(fees[i]);\\n        }\\n\\n        v.d2 = getD(_xp(self, balances1), v.preciseA);\\n\\n        uint256 tokenAmount = v.d0.sub(v.d2).mul(tokenSupply).div(v.d0);\\n        require(tokenAmount != 0, \\\"Burnt amount cannot be zero\\\");\\n        tokenAmount = tokenAmount.add(1).mul(FEE_DENOMINATOR).div(\\n            FEE_DENOMINATOR.sub(calculateCurrentWithdrawFee(self, msg.sender))\\n        );\\n\\n        require(tokenAmount <= maxBurnAmount, \\\"tokenAmount > maxBurnAmount\\\");\\n\\n        self.lpToken.burnFrom(msg.sender, tokenAmount);\\n\\n        for (uint256 i = 0; i < self.pooledTokens.length; i++) {\\n            self.pooledTokens[i].safeTransfer(msg.sender, amounts[i]);\\n        }\\n\\n        emit RemoveLiquidityImbalance(\\n            msg.sender,\\n            amounts,\\n            fees,\\n            v.d1,\\n            tokenSupply.sub(tokenAmount)\\n        );\\n\\n        return tokenAmount;\\n    }\\n\\n    /**\\n     * @notice withdraw all admin fees to a given address\\n     * @param self Swap struct to withdraw fees from\\n     * @param to Address to send the fees to\\n     */\\n    function withdrawAdminFees(Swap storage self, address to) external {\\n        for (uint256 i = 0; i < self.pooledTokens.length; i++) {\\n            IERC20 token = self.pooledTokens[i];\\n            uint256 balance =\\n                token.balanceOf(address(this)).sub(self.balances[i]);\\n            if (balance != 0) {\\n                token.safeTransfer(to, balance);\\n            }\\n        }\\n    }\\n\\n    /**\\n     * @notice Sets the admin fee\\n     * @dev adminFee cannot be higher than 100% of the swap fee\\n     * @param self Swap struct to update\\n     * @param newAdminFee new admin fee to be applied on future transactions\\n     */\\n    function setAdminFee(Swap storage self, uint256 newAdminFee) external {\\n        require(newAdminFee <= MAX_ADMIN_FEE, \\\"Fee is too high\\\");\\n        self.adminFee = newAdminFee;\\n\\n        emit NewAdminFee(newAdminFee);\\n    }\\n\\n    /**\\n     * @notice update the swap fee\\n     * @dev fee cannot be higher than 1% of each swap\\n     * @param self Swap struct to update\\n     * @param newSwapFee new swap fee to be applied on future transactions\\n     */\\n    function setSwapFee(Swap storage self, uint256 newSwapFee) external {\\n        require(newSwapFee <= MAX_SWAP_FEE, \\\"Fee is too high\\\");\\n        self.swapFee = newSwapFee;\\n\\n        emit NewSwapFee(newSwapFee);\\n    }\\n\\n    /**\\n     * @notice update the default withdraw fee. This also affects deposits made in the past as well.\\n     * @param self Swap struct to update\\n     * @param newWithdrawFee new withdraw fee to be applied\\n     */\\n    function setDefaultWithdrawFee(Swap storage self, uint256 newWithdrawFee)\\n        external\\n    {\\n        require(newWithdrawFee <= MAX_WITHDRAW_FEE, \\\"Fee is too high\\\");\\n        self.defaultWithdrawFee = newWithdrawFee;\\n\\n        emit NewWithdrawFee(newWithdrawFee);\\n    }\\n\\n    /**\\n     * @notice update the default deposit fee. \\n     * @param self Swap struct to update\\n     * @param newDepositFee new deposit fee to be applied\\n     */\\n    function setDefaultDepositFee(Swap storage self, uint256 newDepositFee)\\n        external\\n    {\\n        require(newDepositFee <= MAX_DEPOSIT_FEE, \\\"Fee is too high\\\");\\n        self.defaultDepositFee = newDepositFee;\\n\\n        emit NewDepositFee(newDepositFee);\\n    }\\n\\n\\n    /**\\n     * @notice Start ramping up or down A parameter towards given futureA_ and futureTime_\\n     * Checks if the change is too rapid, and commits the new A value only when it falls under\\n     * the limit range.\\n     * @param self Swap struct to update\\n     * @param futureA_ the new A to ramp towards\\n     * @param futureTime_ timestamp when the new A should be reached\\n     */\\n    function rampA(\\n        Swap storage self,\\n        uint256 futureA_,\\n        uint256 futureTime_\\n    ) external {\\n        require(\\n            block.timestamp >= self.initialATime.add(1 days),\\n            \\\"Wait 1 day before starting ramp\\\"\\n        );\\n        require(\\n            futureTime_ >= block.timestamp.add(MIN_RAMP_TIME),\\n            \\\"Insufficient ramp time\\\"\\n        );\\n        require(\\n            futureA_ > 0 && futureA_ < MAX_A,\\n            \\\"futureA_ must be > 0 and < MAX_A\\\"\\n        );\\n\\n        uint256 initialAPrecise = _getAPrecise(self);\\n        uint256 futureAPrecise = futureA_.mul(A_PRECISION);\\n\\n        if (futureAPrecise < initialAPrecise) {\\n            require(\\n                futureAPrecise.mul(MAX_A_CHANGE) >= initialAPrecise,\\n                \\\"futureA_ is too small\\\"\\n            );\\n        } else {\\n            require(\\n                futureAPrecise <= initialAPrecise.mul(MAX_A_CHANGE),\\n                \\\"futureA_ is too large\\\"\\n            );\\n        }\\n\\n        self.initialA = initialAPrecise;\\n        self.futureA = futureAPrecise;\\n        self.initialATime = block.timestamp;\\n        self.futureATime = futureTime_;\\n\\n        emit RampA(\\n            initialAPrecise,\\n            futureAPrecise,\\n            block.timestamp,\\n            futureTime_\\n        );\\n    }\\n\\n    /**\\n     * @notice Stops ramping A immediately. Once this function is called, rampA()\\n     * cannot be called for another 24 hours\\n     * @param self Swap struct to update\\n     */\\n    function stopRampA(Swap storage self) external {\\n        require(self.futureATime > block.timestamp, \\\"Ramp is already stopped\\\");\\n        uint256 currentA = _getAPrecise(self);\\n\\n        self.initialA = currentA;\\n        self.futureA = currentA;\\n        self.initialATime = block.timestamp;\\n        self.futureATime = block.timestamp;\\n\\n        emit StopRampA(currentA, block.timestamp);\\n    }\\n\\n    function setDevAddress(Swap storage self, address _devaddr) public {\\n        require(msg.sender == self.devaddr, \\\"dev: wut?\\\");\\n        self.devaddr = _devaddr;\\n    }\\n}\",\"keccak256\":\"0xd26a683a65183b6700f13e8105cfb726ad488060600d6c7f05368147a905fe0e\",\"license\":\"MIT\"},\"contracts/stable/ISwap.sol\":{\"content\":\"// SPDX-License-Identifier: MIT\\n\\npragma solidity 0.6.12;\\n\\nimport \\\"@openzeppelin/contracts/token/ERC20/ERC20.sol\\\";\\n\\ninterface ISwap {\\n    // pool data view functions\\n    function getA() external view returns (uint256);\\n\\n    function getToken(uint8 index) external view returns (IERC20);\\n\\n    function getTokenIndex(address tokenAddress) external view returns (uint8);\\n\\n    function getTokenBalance(uint8 index) external view returns (uint256);\\n\\n    function getVirtualPrice() external view returns (uint256);\\n\\n    // min return calculation functions\\n    function calculateSwap(\\n        uint8 tokenIndexFrom,\\n        uint8 tokenIndexTo,\\n        uint256 dx\\n    ) external view returns (uint256);\\n\\n    function calculateTokenAmount(\\n        address account,\\n        uint256[] calldata amounts,\\n        bool deposit\\n    ) external view returns (uint256);\\n\\n    function calculateRemoveLiquidity(address account, uint256 amount)\\n        external\\n        view\\n        returns (uint256[] memory);\\n\\n    function calculateRemoveLiquidityOneToken(\\n        address account,\\n        uint256 tokenAmount,\\n        uint8 tokenIndex\\n    ) external view returns (uint256 availableTokenAmount);\\n\\n    function swap(\\n        uint8 tokenIndexFrom,\\n        uint8 tokenIndexTo,\\n        uint256 dx,\\n        uint256 minDy,\\n        uint256 deadline\\n    ) external returns (uint256);\\n\\n    function addLiquidity(\\n        uint256[] calldata amounts,\\n        uint256 minToMint,\\n        uint256 deadline\\n    ) external returns (uint256);\\n\\n    function removeLiquidity(\\n        uint256 amount,\\n        uint256[] calldata minAmounts,\\n        uint256 deadline\\n    ) external returns (uint256[] memory);\\n\\n    function removeLiquidityOneToken(\\n        uint256 tokenAmount,\\n        uint8 tokenIndex,\\n        uint256 minAmount,\\n        uint256 deadline\\n    ) external returns (uint256);\\n\\n    function removeLiquidityImbalance(\\n        uint256[] calldata amounts,\\n        uint256 maxBurnAmount,\\n        uint256 deadline\\n    ) external returns (uint256);\\n\\n    // withdraw fee update function\\n    function updateUserWithdrawFee(address recipient, uint256 transferAmount)\\n        external;\\n}\",\"keccak256\":\"0x48fca3a23b5ab64504811b274cfe36d98994f36934c77b64f9a7a356ced06869\",\"license\":\"MIT\"},\"contracts/stable/LPToken.sol\":{\"content\":\"// SPDX-License-Identifier: MIT\\n\\npragma solidity 0.6.12;\\n\\nimport \\\"@openzeppelin/contracts/token/ERC20/ERC20Burnable.sol\\\";\\nimport \\\"@openzeppelin/contracts/access/Ownable.sol\\\";\\nimport \\\"@openzeppelin/contracts/math/SafeMath.sol\\\";\\nimport \\\"./ISwap.sol\\\";\\n\\n/**\\n * @title Liquidity Provider Token\\n * @notice This token is an ERC20 detailed token with added capability to be minted by the owner.\\n * It is used to represent user's shares when providing liquidity to swap contracts.\\n */\\ncontract LPToken is ERC20Burnable, Ownable {\\n    using SafeMath for uint256;\\n\\n    // Address of the swap contract that owns this LP token. When a user adds liquidity to the swap contract,\\n    // they receive a proportionate amount of this LPToken.\\n    ISwap public immutable swap;\\n\\n    /**\\n     * @notice Deploys LPToken contract with given name, symbol, and decimals\\n     * @dev the caller of this constructor will become the owner of this contract\\n     * @param name_ name of this token\\n     * @param symbol_ symbol of this token\\n     * @param decimals_ number of decimals this token will be based on\\n     */\\n    constructor(\\n        string memory name_,\\n        string memory symbol_,\\n        uint8 decimals_\\n    ) public ERC20(name_, symbol_) {\\n        _setupDecimals(decimals_);\\n        swap = ISwap(_msgSender());\\n    }\\n\\n    /**\\n     * @notice Mints the given amount of LPToken to the recipient.\\n     * @dev only owner can call this mint function\\n     * @param recipient address of account to receive the tokens\\n     * @param amount amount of tokens to mint\\n     */\\n    function mint(\\n        address recipient,\\n        uint256 amount\\n    ) external onlyOwner {\\n        require(amount != 0, \\\"amount == 0\\\");\\n        _mint(recipient, amount);\\n    }\\n\\n    /**\\n     * @dev Overrides ERC20._beforeTokenTransfer() which get called on every transfers including\\n     * minting and burning. This ensures that swap.updateUserWithdrawFees are called everytime.\\n     */\\n    function _beforeTokenTransfer(\\n        address from,\\n        address to,\\n        uint256 amount\\n    ) internal override(ERC20) {\\n        super._beforeTokenTransfer(from, to, amount);\\n        swap.updateUserWithdrawFee(to, amount);\\n    }\\n}\\n\",\"keccak256\":\"0xccbed85c3e6809b28342fb1b38365a1b664ae12f5ca072d23235a3d5ee4a817c\",\"license\":\"MIT\"},\"contracts/stable/MathUtils.sol\":{\"content\":\"// SPDX-License-Identifier: MIT\\n\\npragma solidity 0.6.12;\\n\\nimport \\\"@openzeppelin/contracts/math/SafeMath.sol\\\";\\n\\n/**\\n * @title MathUtils library\\n * @notice A library to be used in conjunction with SafeMath. Contains functions for calculating\\n * differences between two uint256.\\n */\\nlibrary MathUtils {\\n    /**\\n     * @notice Compares a and b and returns true if the difference between a and b\\n     *         is less than 1 or equal to each other.\\n     * @param a uint256 to compare with\\n     * @param b uint256 to compare with\\n     * @return True if the difference between a and b is less than 1 or equal,\\n     *         otherwise return false\\n     */\\n    function within1(uint256 a, uint256 b) external pure returns (bool) {\\n        return (_difference(a, b) <= 1);\\n    }\\n\\n    /**\\n     * @notice Calculates absolute difference between a and b\\n     * @param a uint256 to compare with\\n     * @param b uint256 to compare with\\n     * @return Difference between a and b\\n     */\\n    function difference(uint256 a, uint256 b) external pure returns (uint256) {\\n        return _difference(a, b);\\n    }\\n\\n    /**\\n     * @notice Calculates absolute difference between a and b\\n     * @param a uint256 to compare with\\n     * @param b uint256 to compare with\\n     * @return Difference between a and b\\n     */\\n    function _difference(uint256 a, uint256 b) internal pure returns (uint256) {\\n        if (a > b) {\\n            return a - b;\\n        }\\n        return b - a;\\n    }\\n}\\n\",\"keccak256\":\"0xfcbf4da0de5a883f3c009d389011cc926034d9957269a1f0a5f5985e9ddee163\",\"license\":\"MIT\"},\"contracts/stable/MetaSwapUtils.sol\":{\"content\":\"// SPDX-License-Identifier: MIT\\npragma solidity 0.6.12;\\n\\nimport \\\"@openzeppelin/contracts/math/SafeMath.sol\\\";\\nimport \\\"@openzeppelin/contracts/token/ERC20/SafeERC20.sol\\\";\\n\\nimport \\\"./MathUtils.sol\\\";\\nimport \\\"./ISwap.sol\\\";\\nimport \\\"./EvmoSwapUtils.sol\\\";\\nimport \\\"./LPToken.sol\\\";\\n\\n\\n/**\\n * @title MetaSwapUtils library\\n * @notice A library to be used within MetaSwap.sol. Contains functions responsible for custody and AMM functionalities.\\n * @dev Contracts relying on this library must initialize EvmoSwapUtils.Swap struct then use this library\\n * for EvmoSwapUtils.Swap struct. Note that this library contains both functions called by users and admins.\\n * Admin functions should be protected within contracts using this library.\\n */\\nlibrary MetaSwapUtils {\\n    using SafeERC20 for IERC20;\\n    using SafeMath for uint256;\\n    using MathUtils for uint256;\\n\\n    /*** EVENTS ***/\\n\\n    event TokenSwap(\\n        address indexed buyer,\\n        uint256 tokensSold,\\n        uint256 tokensBought,\\n        uint128 soldId,\\n        uint128 boughtId\\n    );\\n    event TokenSwapUnderlying(\\n        address indexed buyer,\\n        uint256 tokensSold,\\n        uint256 tokensBought,\\n        uint128 soldId,\\n        uint128 boughtId\\n    );\\n    event AddLiquidity(\\n        address indexed provider,\\n        uint256[] tokenAmounts,\\n        uint256[] fees,\\n        uint256 invariant,\\n        uint256 lpTokenSupply\\n    );\\n    event RemoveLiquidityOne(\\n        address indexed provider,\\n        uint256 lpTokenAmount,\\n        uint256 lpTokenSupply,\\n        uint256 boughtId,\\n        uint256 tokensBought\\n    );\\n    event RemoveLiquidityImbalance(\\n        address indexed provider,\\n        uint256[] tokenAmounts,\\n        uint256[] fees,\\n        uint256 invariant,\\n        uint256 lpTokenSupply\\n    );\\n    event NewAdminFee(uint256 newAdminFee);\\n    event NewSwapFee(uint256 newSwapFee);\\n    event NewWithdrawFee(uint256 newWithdrawFee);\\n\\n    struct MetaSwap {\\n        // Meta-Swap related parameters\\n        ISwap baseSwap;\\n        uint256 baseVirtualPrice;\\n        uint256 baseCacheLastUpdated;\\n        IERC20[] baseTokens;\\n    }\\n\\n    // Struct storing variables used in calculations in the\\n    // calculateWithdrawOneTokenDY function to avoid stack too deep errors\\n    struct CalculateWithdrawOneTokenDYInfo {\\n        uint256 d0;\\n        uint256 d1;\\n        uint256 newY;\\n        uint256 feePerToken;\\n        uint256 preciseA;\\n        uint256 xpi;\\n    }\\n\\n    // Struct storing variables used in calculation in removeLiquidityImbalance function\\n    // to avoid stack too deep error\\n    struct ManageLiquidityInfo {\\n        uint256 d0;\\n        uint256 d1;\\n        uint256 d2;\\n        LPToken lpToken;\\n        uint256 totalSupply;\\n        uint256 preciseA;\\n        uint256 baseVirtualPrice;\\n        uint256[] tokenPrecisionMultipliers;\\n        uint256[] newBalances;\\n    }\\n\\n    struct SwapUnderlyingInfo {\\n        uint256 x;\\n        uint256 dx;\\n        uint256 dy;\\n        uint8 metaIndexFrom;\\n        uint8 metaIndexTo;\\n        uint256[] oldBalances;\\n        IERC20[] baseTokens;\\n        IERC20 tokenFrom;\\n        IERC20 tokenTo;\\n        uint256 baseVirtualPrice;\\n    }\\n\\n    struct CalculateSwapUnderlyingInfo {\\n        uint256 baseVirtualPrice;\\n        ISwap baseSwap;\\n        uint8 baseLPTokenIndex;\\n        uint8 baseTokensLength;\\n        uint8 metaIndexTo;\\n        uint256 x;\\n        uint256 dy;\\n    }\\n\\n    // the precision all pools tokens will be converted to\\n    uint8 public constant POOL_PRECISION_DECIMALS = 18;\\n\\n    // the denominator used to calculate admin and LP fees. For example, an\\n    // LP fee might be something like tradeAmount.mul(fee).div(FEE_DENOMINATOR)\\n    uint256 private constant FEE_DENOMINATOR = 10**10;\\n\\n    // Constant value used as max loop limit\\n    uint256 private constant MAX_LOOP_LIMIT = 256;\\n\\n    // Precision used in A parameter calculation\\n    uint256 public constant A_PRECISION = 100;\\n\\n    // Cache expire time for the stored value of base swap's virtual price\\n    uint256 public constant BASE_CACHE_EXPIRE_TIME = 10 minutes;\\n    uint256 public constant BASE_VIRTUAL_PRICE_PRECISION = 10**18;\\n\\n    /*** VIEW & PURE FUNCTIONS ***/\\n\\n    /**\\n     * @notice Return A in its raw precision\\n     * @dev See the StableSwap paper for details\\n     * @param self Swap struct to read from\\n     * @return A parameter in its raw precision form\\n     */\\n    function getAPrecise(EvmoSwapUtils.Swap storage self)\\n        public\\n        view\\n        returns (uint256)\\n    {\\n        uint256 t1 = self.futureATime; // time when ramp is finished\\n        uint256 a1 = self.futureA; // final A value when ramp is finished\\n\\n        if (block.timestamp < t1) {\\n            uint256 t0 = self.initialATime; // time when ramp is started\\n            uint256 a0 = self.initialA; // initial A value when ramp is started\\n            if (a1 > a0) {\\n                // a0 + (a1 - a0) * (block.timestamp - t0) / (t1 - t0)\\n                return\\n                    a0.add(\\n                        a1.sub(a0).mul(block.timestamp.sub(t0)).div(t1.sub(t0))\\n                    );\\n            } else {\\n                // a0 - (a0 - a1) * (block.timestamp - t0) / (t1 - t0)\\n                return\\n                    a0.sub(\\n                        a0.sub(a1).mul(block.timestamp.sub(t0)).div(t1.sub(t0))\\n                    );\\n            }\\n        } else {\\n            return a1;\\n        }\\n    }\\n\\n    function _updateBaseVirtualPrice(MetaSwap storage metaSwapStorage)\\n        internal\\n        returns (uint256)\\n    {\\n        if (\\n            block.timestamp >\\n            metaSwapStorage.baseCacheLastUpdated + BASE_CACHE_EXPIRE_TIME\\n        ) {\\n            uint256 baseVirtualPrice =\\n                ISwap(metaSwapStorage.baseSwap).getVirtualPrice();\\n            metaSwapStorage.baseVirtualPrice = baseVirtualPrice;\\n            metaSwapStorage.baseCacheLastUpdated = block.timestamp;\\n            return baseVirtualPrice;\\n        } else {\\n            return metaSwapStorage.baseVirtualPrice;\\n        }\\n    }\\n\\n    function _getBaseVirtualPrice(\\n        MetaSwap storage metaSwapStorage,\\n        ISwap baseSwap\\n    ) internal view returns (uint256) {\\n        if (\\n            block.timestamp >\\n            metaSwapStorage.baseCacheLastUpdated + BASE_CACHE_EXPIRE_TIME\\n        ) {\\n            return baseSwap.getVirtualPrice();\\n        } else {\\n            return metaSwapStorage.baseVirtualPrice;\\n        }\\n    }\\n\\n    function _getBaseVirtualPrice(MetaSwap storage metaSwapStorage)\\n        internal\\n        view\\n        returns (uint256)\\n    {\\n        return _getBaseVirtualPrice(metaSwapStorage, metaSwapStorage.baseSwap);\\n    }\\n\\n    /**\\n     * @notice Calculate the dy, the amount of selected token that user receives.\\n     * @param account the address that is withdrawing\\n     * @param tokenAmount the amount to withdraw in the pool's precision\\n     * @param tokenIndex which token will be withdrawn\\n     * @param self Swap struct to read from\\n     * @return dy the amount of token user will receive\\n     */\\n    function calculateWithdrawOneToken(\\n        EvmoSwapUtils.Swap storage self,\\n        MetaSwap storage metaSwapStorage,\\n        address account,\\n        uint256 tokenAmount,\\n        uint8 tokenIndex\\n    ) external view returns (uint256 dy) {\\n        (dy, ) = calculateWithdrawOneToken(\\n            self,\\n            account,\\n            tokenAmount,\\n            tokenIndex,\\n            _getBaseVirtualPrice(metaSwapStorage),\\n            self.lpToken.totalSupply()\\n        );\\n    }\\n\\n    function calculateWithdrawOneToken(\\n        EvmoSwapUtils.Swap storage self,\\n        address account,\\n        uint256 tokenAmount,\\n        uint8 tokenIndex,\\n        uint256 baseVirtualPrice,\\n        uint256 totalSupply\\n    ) internal view returns (uint256, uint256) {\\n        uint256 dy;\\n        uint256 dySwapFee;\\n\\n        {\\n            uint256 currentY;\\n            uint256 newY;\\n\\n            (dy, newY, currentY) = calculateWithdrawOneTokenDY(\\n                self,\\n                tokenIndex,\\n                tokenAmount,\\n                baseVirtualPrice,\\n                totalSupply\\n            );\\n\\n            dySwapFee = currentY\\n                .sub(newY)\\n                .div(self.tokenPrecisionMultipliers[tokenIndex])\\n                .sub(dy);\\n        }\\n\\n        dy = dy\\n            .mul(\\n            FEE_DENOMINATOR.sub(calculateCurrentWithdrawFee(self, account))\\n        )\\n            .div(FEE_DENOMINATOR);\\n\\n        return (dy, dySwapFee);\\n    }\\n\\n    /**\\n     * @notice Calculate the dy of withdrawing in one token\\n     * @param self Swap struct to read from\\n     * @param tokenIndex which token will be withdrawn\\n     * @param tokenAmount the amount to withdraw in the pools precision\\n     * @return the d and the new y after withdrawing one token\\n     */\\n    function calculateWithdrawOneTokenDY(\\n        EvmoSwapUtils.Swap storage self,\\n        uint8 tokenIndex,\\n        uint256 tokenAmount,\\n        uint256 baseVirtualPrice,\\n        uint256 totalSupply\\n    )\\n        internal\\n        view\\n        returns (\\n            uint256,\\n            uint256,\\n            uint256\\n        )\\n    {\\n        // Get the current D, then solve the stableswap invariant\\n        // y_i for D - tokenAmount\\n        uint256[] memory xp = _xp(self, baseVirtualPrice);\\n        require(tokenIndex < xp.length, \\\"Token index out of range\\\");\\n\\n        CalculateWithdrawOneTokenDYInfo memory v =\\n            CalculateWithdrawOneTokenDYInfo(0, 0, 0, 0, 0, 0);\\n        v.preciseA = getAPrecise(self);\\n        v.d0 = getD(xp, v.preciseA);\\n        v.d1 = v.d0.sub(tokenAmount.mul(v.d0).div(totalSupply));\\n\\n        require(tokenAmount <= xp[tokenIndex], \\\"Withdraw exceeds available\\\");\\n\\n        v.newY = getYD(v.preciseA, tokenIndex, xp, v.d1);\\n\\n        uint256[] memory xpReduced = new uint256[](xp.length);\\n\\n        v.feePerToken = _feePerToken(self);\\n        for (uint256 i = 0; i < xp.length; i++) {\\n            v.xpi = xp[i];\\n            // if i == tokenIndex, dxExpected = xp[i] * d1 / d0 - newY\\n            // else dxExpected = xp[i] - (xp[i] * d1 / d0)\\n            // xpReduced[i] -= dxExpected * fee / FEE_DENOMINATOR\\n            xpReduced[i] = v.xpi.sub(\\n                (\\n                    (i == tokenIndex)\\n                        ? v.xpi.mul(v.d1).div(v.d0).sub(v.newY)\\n                        : v.xpi.sub(v.xpi.mul(v.d1).div(v.d0))\\n                )\\n                    .mul(v.feePerToken)\\n                    .div(FEE_DENOMINATOR)\\n            );\\n        }\\n\\n        uint256 dy =\\n            xpReduced[tokenIndex].sub(\\n                getYD(v.preciseA, tokenIndex, xpReduced, v.d1)\\n            );\\n        dy = dy.sub(1).div(self.tokenPrecisionMultipliers[tokenIndex]);\\n\\n        if (tokenIndex == xp.length - 1) {\\n            dy = dy.mul(BASE_VIRTUAL_PRICE_PRECISION).div(baseVirtualPrice);\\n        }\\n\\n        return (dy, v.newY, xp[tokenIndex]);\\n    }\\n\\n    /**\\n     * @notice Calculate the price of a token in the pool with given\\n     * precision-adjusted balances and a particular D.\\n     *\\n     * @dev This is accomplished via solving the invariant iteratively.\\n     * See the StableSwap paper and Curve.fi implementation for further details.\\n     *\\n     * x_1**2 + x1 * (sum' - (A*n**n - 1) * D / (A * n**n)) = D ** (n + 1) / (n ** (2 * n) * prod' * A)\\n     * x_1**2 + b*x_1 = c\\n     * x_1 = (x_1**2 + c) / (2*x_1 + b)\\n     *\\n     * @param a the amplification coefficient * n * (n - 1). See the StableSwap paper for details.\\n     * @param tokenIndex Index of token we are calculating for.\\n     * @param xp a precision-adjusted set of pool balances. Array should be\\n     * the same cardinality as the pool.\\n     * @param d the stableswap invariant\\n     * @return the price of the token, in the same precision as in xp\\n     */\\n    function getYD(\\n        uint256 a,\\n        uint8 tokenIndex,\\n        uint256[] memory xp,\\n        uint256 d\\n    ) internal pure returns (uint256) {\\n        uint256 numTokens = xp.length;\\n        require(tokenIndex < numTokens, \\\"Token not found\\\");\\n\\n        uint256 c = d;\\n        uint256 s;\\n        uint256 nA = a.mul(numTokens);\\n\\n        for (uint256 i = 0; i < numTokens; i++) {\\n            if (i != tokenIndex) {\\n                s = s.add(xp[i]);\\n                c = c.mul(d).div(xp[i].mul(numTokens));\\n                // If we were to protect the division loss we would have to keep the denominator separate\\n                // and divide at the end. However this leads to overflow with large numTokens or/and D.\\n                // c = c * D * D * D * ... overflow!\\n            }\\n        }\\n        c = c.mul(d).mul(A_PRECISION).div(nA.mul(numTokens));\\n\\n        uint256 b = s.add(d.mul(A_PRECISION).div(nA));\\n        uint256 yPrev;\\n        uint256 y = d;\\n        for (uint256 i = 0; i < MAX_LOOP_LIMIT; i++) {\\n            yPrev = y;\\n            y = y.mul(y).add(c).div(y.mul(2).add(b).sub(d));\\n            if (y.within1(yPrev)) {\\n                return y;\\n            }\\n        }\\n        revert(\\\"Approximation did not converge\\\");\\n    }\\n\\n    /**\\n     * @notice Get D, the StableSwap invariant, based on a set of balances and a particular A.\\n     * @param xp a precision-adjusted set of pool balances. Array should be the same cardinality\\n     * as the pool.\\n     * @param a the amplification coefficient * n * (n - 1) in A_PRECISION.\\n     * See the StableSwap paper for details\\n     * @return the invariant, at the precision of the pool\\n     */\\n    function getD(uint256[] memory xp, uint256 a)\\n        internal\\n        pure\\n        returns (uint256)\\n    {\\n        uint256 numTokens = xp.length;\\n        uint256 s;\\n        for (uint256 i = 0; i < numTokens; i++) {\\n            s = s.add(xp[i]);\\n        }\\n        if (s == 0) {\\n            return 0;\\n        }\\n\\n        uint256 prevD;\\n        uint256 d = s;\\n        uint256 nA = a.mul(numTokens);\\n\\n        for (uint256 i = 0; i < MAX_LOOP_LIMIT; i++) {\\n            uint256 dP = d;\\n            for (uint256 j = 0; j < numTokens; j++) {\\n                dP = dP.mul(d).div(xp[j].mul(numTokens));\\n                // If we were to protect the division loss we would have to keep the denominator separate\\n                // and divide at the end. However this leads to overflow with large numTokens or/and D.\\n                // dP = dP * D * D * D * ... overflow!\\n            }\\n            prevD = d;\\n            d = nA.mul(s).div(A_PRECISION).add(dP.mul(numTokens)).mul(d).div(\\n                nA.sub(A_PRECISION).mul(d).div(A_PRECISION).add(\\n                    numTokens.add(1).mul(dP)\\n                )\\n            );\\n            if (d.within1(prevD)) {\\n                return d;\\n            }\\n        }\\n\\n        // Convergence should occur in 4 loops or less. If this is reached, there may be something wrong\\n        // with the pool. If this were to occur repeatedly, LPs should withdraw via `removeLiquidity()`\\n        // function which does not rely on D.\\n        revert(\\\"D does not converge\\\");\\n    }\\n\\n    /**\\n     * @notice Given a set of balances and precision multipliers, return the\\n     * precision-adjusted balances.\\n     *\\n     * @param balances an array of token balances, in their native precisions.\\n     * These should generally correspond with pooled tokens.\\n     *\\n     * @param precisionMultipliers an array of multipliers, corresponding to\\n     * the amounts in the balances array. When multiplied together they\\n     * should yield amounts at the pool's precision.\\n     *\\n     * @return an array of amounts \\\"scaled\\\" to the pool's precision\\n     */\\n    function _xp(\\n        uint256[] memory balances,\\n        uint256[] memory precisionMultipliers,\\n        uint256 baseVirtualPrice\\n    ) internal pure returns (uint256[] memory) {\\n        uint256 numTokens = balances.length;\\n        require(\\n            numTokens == precisionMultipliers.length,\\n            \\\"Balances must match multipliers\\\"\\n        );\\n        uint256[] memory xp = new uint256[](numTokens);\\n        for (uint256 i = 0; i < numTokens; i++) {\\n            xp[i] = balances[i].mul(precisionMultipliers[i]);\\n        }\\n        uint256 baseLPTokenIndex = numTokens - 1;\\n        xp[baseLPTokenIndex] = xp[baseLPTokenIndex].mul(baseVirtualPrice).div(\\n            BASE_VIRTUAL_PRICE_PRECISION\\n        );\\n        return xp;\\n    }\\n\\n    /**\\n     * @notice Return the precision-adjusted balances of all tokens in the pool\\n     * @param self Swap struct to read from\\n     * @param balances array of balances to scale\\n     * @return balances array \\\"scaled\\\" to the pool's precision, allowing\\n     * them to be more easily compared.\\n     */\\n    function _xp(\\n        EvmoSwapUtils.Swap storage self,\\n        uint256[] memory balances,\\n        uint256 baseVirtualPrice\\n    ) internal view returns (uint256[] memory) {\\n        return _xp(balances, self.tokenPrecisionMultipliers, baseVirtualPrice);\\n    }\\n\\n    /**\\n     * @notice Return the precision-adjusted balances of all tokens in the pool\\n     * @param self Swap struct to read from\\n     * @return the pool balances \\\"scaled\\\" to the pool's precision, allowing\\n     * them to be more easily compared.\\n     */\\n    function _xp(EvmoSwapUtils.Swap storage self, uint256 baseVirtualPrice)\\n        internal\\n        view\\n        returns (uint256[] memory)\\n    {\\n        return\\n            _xp(\\n                self.balances,\\n                self.tokenPrecisionMultipliers,\\n                baseVirtualPrice\\n            );\\n    }\\n\\n    /**\\n     * @notice Get the virtual price, to help calculate profit\\n     * @param self Swap struct to read from\\n     * @return the virtual price, scaled to precision of POOL_PRECISION_DECIMALS\\n     */\\n    function getVirtualPrice(\\n        EvmoSwapUtils.Swap storage self,\\n        MetaSwap storage metaSwapStorage\\n    ) external view returns (uint256) {\\n        uint256 d =\\n            getD(\\n                _xp(self, _getBaseVirtualPrice(metaSwapStorage)),\\n                getAPrecise(self)\\n            );\\n        ERC20 lpToken = self.lpToken;\\n        uint256 supply = lpToken.totalSupply();\\n        if (supply != 0) {\\n            return d.mul(10**uint256(lpToken.decimals())).div(supply);\\n        }\\n        return 0;\\n    }\\n\\n    /**\\n     * @notice Calculate the new balances of the tokens given the indexes of the token\\n     * that is swapped from (FROM) and the token that is swapped to (TO).\\n     * This function is used as a helper function to calculate how much TO token\\n     * the user should receive on swap.\\n     *\\n     * @param preciseA value of A parameter to use for calculation\\n     * @param tokenIndexFrom index of FROM token\\n     * @param tokenIndexTo index of TO token\\n     * @param x the new total amount of FROM token\\n     * @param xp balances of the tokens in the pool\\n     * @return the amount of TO token that should remain in the pool\\n     */\\n    function getY(\\n        uint256 preciseA,\\n        uint8 tokenIndexFrom,\\n        uint8 tokenIndexTo,\\n        uint256 x,\\n        uint256[] memory xp\\n    ) internal pure returns (uint256) {\\n        uint256 numTokens = xp.length;\\n        require(\\n            tokenIndexFrom != tokenIndexTo,\\n            \\\"Can't compare token to itself\\\"\\n        );\\n        require(\\n            tokenIndexFrom < numTokens && tokenIndexTo < numTokens,\\n            \\\"Tokens must be in pool\\\"\\n        );\\n\\n        uint256 d = getD(xp, preciseA);\\n        uint256 c = d;\\n        uint256 s;\\n        uint256 nA = numTokens.mul(preciseA);\\n\\n        uint256 _x;\\n        for (uint256 i = 0; i < numTokens; i++) {\\n            if (i == tokenIndexFrom) {\\n                _x = x;\\n            } else if (i != tokenIndexTo) {\\n                _x = xp[i];\\n            } else {\\n                continue;\\n            }\\n            s = s.add(_x);\\n            c = c.mul(d).div(_x.mul(numTokens));\\n            // If we were to protect the division loss we would have to keep the denominator separate\\n            // and divide at the end. However this leads to overflow with large numTokens or/and D.\\n            // c = c * D * D * D * ... overflow!\\n        }\\n        c = c.mul(d).mul(A_PRECISION).div(nA.mul(numTokens));\\n        uint256 b = s.add(d.mul(A_PRECISION).div(nA));\\n        uint256 yPrev;\\n        uint256 y = d;\\n\\n        // iterative approximation\\n        for (uint256 i = 0; i < MAX_LOOP_LIMIT; i++) {\\n            yPrev = y;\\n            y = y.mul(y).add(c).div(y.mul(2).add(b).sub(d));\\n            if (y.within1(yPrev)) {\\n                return y;\\n            }\\n        }\\n        revert(\\\"Approximation did not converge\\\");\\n    }\\n\\n    /**\\n     * @notice Externally calculates a swap between two tokens.\\n     * @param self Swap struct to read from\\n     * @param tokenIndexFrom the token to sell\\n     * @param tokenIndexTo the token to buy\\n     * @param dx the number of tokens to sell. If the token charges a fee on transfers,\\n     * use the amount that gets transferred after the fee.\\n     * @return dy the number of tokens the user will get\\n     */\\n    function calculateSwap(\\n        EvmoSwapUtils.Swap storage self,\\n        MetaSwap storage metaSwapStorage,\\n        uint8 tokenIndexFrom,\\n        uint8 tokenIndexTo,\\n        uint256 dx\\n    ) external view returns (uint256 dy) {\\n        (dy, ) = _calculateSwap(\\n            self,\\n            tokenIndexFrom,\\n            tokenIndexTo,\\n            dx,\\n            _getBaseVirtualPrice(metaSwapStorage)\\n        );\\n    }\\n\\n    /**\\n     * @notice Internally calculates a swap between two tokens.\\n     *\\n     * @dev The caller is expected to transfer the actual amounts (dx and dy)\\n     * using the token contracts.\\n     *\\n     * @param self Swap struct to read from\\n     * @param tokenIndexFrom the token to sell\\n     * @param tokenIndexTo the token to buy\\n     * @param dx the number of tokens to sell. If the token charges a fee on transfers,\\n     * use the amount that gets transferred after the fee.\\n     * @return dy the number of tokens the user will get\\n     * @return dyFee the associated fee\\n     */\\n    function _calculateSwap(\\n        EvmoSwapUtils.Swap storage self,\\n        uint8 tokenIndexFrom,\\n        uint8 tokenIndexTo,\\n        uint256 dx,\\n        uint256 baseVirtualPrice\\n    ) internal view returns (uint256 dy, uint256 dyFee) {\\n        uint256[] memory xp = _xp(self, baseVirtualPrice);\\n        require(\\n            tokenIndexFrom < xp.length && tokenIndexTo < xp.length,\\n            \\\"Token index out of range\\\"\\n        );\\n        uint256 baseLPTokenIndex = xp.length.sub(1);\\n\\n        uint256 x = dx.mul(self.tokenPrecisionMultipliers[tokenIndexFrom]);\\n        if (tokenIndexFrom == baseLPTokenIndex) {\\n            // When swapping from a base Swap token, scale up dx by its virtual price\\n            x = x.mul(baseVirtualPrice).div(BASE_VIRTUAL_PRICE_PRECISION);\\n        }\\n        x = x.add(xp[tokenIndexFrom]);\\n\\n        uint256 y = getY(\\n            getAPrecise(self),\\n            tokenIndexFrom,\\n            tokenIndexTo,\\n            x,\\n            xp\\n        );\\n        dy = xp[tokenIndexTo].sub(y).sub(1);\\n\\n        if (tokenIndexTo == baseLPTokenIndex) {\\n            // When swapping to a base Swap token, scale down dy by its virtual price\\n            dy = dy.mul(BASE_VIRTUAL_PRICE_PRECISION).div(baseVirtualPrice);\\n        }\\n\\n        dyFee = dy.mul(self.swapFee).div(FEE_DENOMINATOR);\\n        dy = dy.sub(dyFee);\\n\\n        dy = dy.div(self.tokenPrecisionMultipliers[tokenIndexTo]);\\n    }\\n\\n    function calculateSwapUnderlying(\\n        EvmoSwapUtils.Swap storage self,\\n        MetaSwap storage metaSwapStorage,\\n        uint8 tokenIndexFrom,\\n        uint8 tokenIndexTo,\\n        uint256 dx\\n    ) external view returns (uint256) {\\n        CalculateSwapUnderlyingInfo memory v =\\n            CalculateSwapUnderlyingInfo(\\n                _getBaseVirtualPrice(metaSwapStorage),\\n                metaSwapStorage.baseSwap,\\n                0,\\n                uint8(metaSwapStorage.baseTokens.length),\\n                0,\\n                0,\\n                0\\n            );\\n\\n        uint256[] memory xp = _xp(self, v.baseVirtualPrice);\\n        v.baseLPTokenIndex = uint8(xp.length) - 1;\\n        {\\n            uint8 maxRange = v.baseLPTokenIndex + v.baseTokensLength;\\n            require(\\n                tokenIndexFrom < maxRange && tokenIndexTo < maxRange,\\n                \\\"Token index out of range\\\"\\n            );\\n        }\\n\\n        if (tokenIndexFrom < v.baseLPTokenIndex) {\\n            // tokenFrom is from this pool\\n            v.x = xp[tokenIndexFrom].add(\\n                dx.mul(self.tokenPrecisionMultipliers[tokenIndexFrom])\\n            );\\n        } else {\\n            // tokenFrom is from the base pool\\n            tokenIndexFrom = tokenIndexFrom - v.baseLPTokenIndex;\\n            if (tokenIndexTo < v.baseLPTokenIndex) {\\n                uint256[] memory baseInputs = new uint256[](v.baseTokensLength);\\n                baseInputs[tokenIndexFrom] = dx;\\n                v.x = v\\n                    .baseSwap\\n                    .calculateTokenAmount(address(this), baseInputs, true)\\n                    .mul(v.baseVirtualPrice)\\n                    .div(BASE_VIRTUAL_PRICE_PRECISION)\\n                    .add(xp[v.baseLPTokenIndex]);\\n            } else {\\n                // both from and to are from the base pool\\n                return\\n                    v.baseSwap.calculateSwap(\\n                        tokenIndexFrom,\\n                        tokenIndexTo - v.baseLPTokenIndex,\\n                        dx\\n                    );\\n            }\\n            tokenIndexFrom = v.baseLPTokenIndex;\\n        }\\n\\n        v.metaIndexTo = v.baseLPTokenIndex;\\n        if (tokenIndexTo < v.baseLPTokenIndex) {\\n            v.metaIndexTo = tokenIndexTo;\\n        }\\n\\n        {\\n            uint256 y =\\n                getY(getAPrecise(self), tokenIndexFrom, v.metaIndexTo, v.x, xp);\\n            v.dy = xp[v.metaIndexTo].sub(y).sub(1);\\n            uint256 dyFee = v.dy.mul(self.swapFee).div(FEE_DENOMINATOR);\\n            v.dy = v.dy.sub(dyFee);\\n        }\\n\\n        if (tokenIndexTo < v.baseLPTokenIndex) {\\n            // tokenTo is from this pool\\n            v.dy = v.dy.div(self.tokenPrecisionMultipliers[v.metaIndexTo]);\\n        } else {\\n            // tokenTo is from the base pool\\n            v.dy = v.baseSwap.calculateRemoveLiquidityOneToken(\\n                address(this),\\n                v.dy.mul(BASE_VIRTUAL_PRICE_PRECISION).div(v.baseVirtualPrice),\\n                tokenIndexTo - v.baseLPTokenIndex\\n            );\\n        }\\n\\n        return v.dy;\\n    }\\n\\n    /**\\n     * @notice Calculate the fee that is applied when the given user withdraws.\\n     * Withdraw fee decays linearly over 4 weeks.\\n     * @param user address you want to calculate withdraw fee of\\n     * @return current withdraw fee of the user\\n     */\\n    function calculateCurrentWithdrawFee(\\n        EvmoSwapUtils.Swap storage self,\\n        address user\\n    ) public view returns (uint256) {\\n        uint256 endTime = self.depositTimestamp[user].add(4 weeks);\\n        if (endTime > block.timestamp) {\\n            uint256 timeLeftover = endTime.sub(block.timestamp);\\n            return\\n                self\\n                    .defaultWithdrawFee\\n                    .mul(self.withdrawFeeMultiplier[user])\\n                    .mul(timeLeftover)\\n                    .div(4 weeks)\\n                    .div(FEE_DENOMINATOR);\\n        }\\n        return 0;\\n    }\\n\\n    /**\\n     * @notice A simple method to calculate prices from deposits or\\n     * withdrawals, excluding fees but including slippage. This is\\n     * helpful as an input into the various \\\"min\\\" parameters on calls\\n     * to fight front-running\\n     *\\n     * @dev This shouldn't be used outside frontends for user estimates.\\n     *\\n     * @param self Swap struct to read from\\n     * @param account address of the account depositing or withdrawing tokens\\n     * @param amounts an array of token amounts to deposit or withdrawal,\\n     * corresponding to pooledTokens. The amount should be in each\\n     * pooled token's native precision. If a token charges a fee on transfers,\\n     * use the amount that gets transferred after the fee.\\n     * @param deposit whether this is a deposit or a withdrawal\\n     * @return if deposit was true, total amount of lp token that will be minted and if\\n     * deposit was false, total amount of lp token that will be burned\\n     */\\n    function calculateTokenAmount(\\n        EvmoSwapUtils.Swap storage self,\\n        MetaSwap storage metaSwapStorage,\\n        address account,\\n        uint256[] calldata amounts,\\n        bool deposit\\n    ) external view returns (uint256) {\\n        uint256 a = getAPrecise(self);\\n        uint256 d0;\\n        uint256 d1;\\n        {\\n            uint256 baseVirtualPrice = _getBaseVirtualPrice(metaSwapStorage);\\n            uint256[] memory balances1 = self.balances;\\n            uint256 numTokens = balances1.length;\\n            d0 = getD(_xp(self, balances1, baseVirtualPrice), a);\\n            for (uint256 i = 0; i < numTokens; i++) {\\n                if (deposit) {\\n                    balances1[i] = balances1[i].add(amounts[i]);\\n                } else {\\n                    balances1[i] = balances1[i].sub(\\n                        amounts[i],\\n                        \\\"Cannot withdraw more than available\\\"\\n                    );\\n                }\\n            }\\n            d1 = getD(_xp(self, balances1, baseVirtualPrice), a);\\n        }\\n        uint256 totalSupply = self.lpToken.totalSupply();\\n\\n        if (deposit) {\\n            return d1.sub(d0).mul(totalSupply).div(d0);\\n        } else {\\n            return\\n                d0.sub(d1).mul(totalSupply).div(d0).mul(FEE_DENOMINATOR).div(\\n                    FEE_DENOMINATOR.sub(\\n                        calculateCurrentWithdrawFee(self, account)\\n                    )\\n                );\\n        }\\n    }\\n\\n    /**\\n     * @notice internal helper function to calculate fee per token multiplier used in\\n     * swap fee calculations\\n     * @param self Swap struct to read from\\n     */\\n    function _feePerToken(EvmoSwapUtils.Swap storage self)\\n        internal\\n        view\\n        returns (uint256)\\n    {\\n        IERC20[] memory pooledTokens = self.pooledTokens;\\n        return\\n            self.swapFee.mul(pooledTokens.length).div(\\n                pooledTokens.length.sub(1).mul(4)\\n            );\\n    }\\n\\n    /*** STATE MODIFYING FUNCTIONS ***/\\n\\n    /**\\n     * @notice swap two tokens in the pool\\n     * @param self Swap struct to read from and write to\\n     * @param tokenIndexFrom the token the user wants to sell\\n     * @param tokenIndexTo the token the user wants to buy\\n     * @param dx the amount of tokens the user wants to sell\\n     * @param minDy the min amount the user would like to receive, or revert.\\n     * @return amount of token user received on swap\\n     */\\n    function swap(\\n        EvmoSwapUtils.Swap storage self,\\n        MetaSwap storage metaSwapStorage,\\n        uint8 tokenIndexFrom,\\n        uint8 tokenIndexTo,\\n        uint256 dx,\\n        uint256 minDy\\n    ) external returns (uint256) {\\n        uint256 transferredDx;\\n        {\\n            IERC20 tokenFrom = self.pooledTokens[tokenIndexFrom];\\n            require(\\n                dx <= tokenFrom.balanceOf(msg.sender),\\n                \\\"Cannot swap more than you own\\\"\\n            );\\n\\n            {\\n                // Transfer tokens first to see if a fee was charged on transfer\\n                uint256 beforeBalance = tokenFrom.balanceOf(address(this));\\n                tokenFrom.safeTransferFrom(msg.sender, address(this), dx);\\n\\n                // Use the actual transferred amount for AMM math\\n                transferredDx = tokenFrom.balanceOf(address(this)).sub(\\n                    beforeBalance\\n                );\\n            }\\n        }\\n\\n        (uint256 dy, uint256 dyFee) =\\n            _calculateSwap(\\n                self,\\n                tokenIndexFrom,\\n                tokenIndexTo,\\n                transferredDx,\\n                _updateBaseVirtualPrice(metaSwapStorage)\\n            );\\n        require(dy >= minDy, \\\"Swap didn't result in min tokens\\\");\\n\\n        uint256 dyAdminFee =\\n            dyFee.mul(self.adminFee).div(FEE_DENOMINATOR).div(\\n                self.tokenPrecisionMultipliers[tokenIndexTo]\\n            );\\n\\n        self.balances[tokenIndexFrom] = self.balances[tokenIndexFrom].add(\\n            transferredDx\\n        );\\n        self.balances[tokenIndexTo] = self.balances[tokenIndexTo].sub(dy).sub(\\n            dyAdminFee\\n        );\\n\\n        self.pooledTokens[tokenIndexTo].safeTransfer(msg.sender, dy);\\n\\n        emit TokenSwap(\\n            msg.sender,\\n            transferredDx,\\n            dy,\\n            tokenIndexFrom,\\n            tokenIndexTo\\n        );\\n\\n        return dy;\\n    }\\n\\n    function swapUnderlying(\\n        EvmoSwapUtils.Swap storage self,\\n        MetaSwap storage metaSwapStorage,\\n        uint8 tokenIndexFrom,\\n        uint8 tokenIndexTo,\\n        uint256 dx,\\n        uint256 minDy\\n    ) external returns (uint256) {\\n        SwapUnderlyingInfo memory v =\\n            SwapUnderlyingInfo(\\n                0,\\n                0,\\n                0,\\n                0,\\n                0,\\n                self.balances,\\n                metaSwapStorage.baseTokens,\\n                IERC20(address(0)),\\n                IERC20(address(0)),\\n                _updateBaseVirtualPrice(metaSwapStorage)\\n            );\\n\\n        uint8 baseLPTokenIndex = uint8(v.oldBalances.length) - 1;\\n\\n        {\\n            uint8 maxRange = baseLPTokenIndex + uint8(v.baseTokens.length);\\n            require(\\n                tokenIndexFrom < maxRange && tokenIndexTo < maxRange,\\n                \\\"Token index out of range\\\"\\n            );\\n        }\\n\\n        ISwap baseSwap = metaSwapStorage.baseSwap;\\n\\n        // Find the address of the token swapping from\\n        if (tokenIndexFrom < baseLPTokenIndex) {\\n            v.tokenFrom = self.pooledTokens[tokenIndexFrom];\\n            v.metaIndexFrom = tokenIndexFrom;\\n        } else {\\n            v.tokenFrom = v.baseTokens[tokenIndexFrom - baseLPTokenIndex];\\n            v.metaIndexFrom = baseLPTokenIndex;\\n        }\\n\\n        // Find the address of the token swapping to\\n        if (tokenIndexTo < baseLPTokenIndex) {\\n            v.tokenTo = self.pooledTokens[tokenIndexTo];\\n            v.metaIndexTo = tokenIndexTo;\\n        } else {\\n            v.tokenTo = v.baseTokens[tokenIndexTo - baseLPTokenIndex];\\n            v.metaIndexTo = baseLPTokenIndex;\\n        }\\n\\n        v.dx = v.tokenFrom.balanceOf(address(this));\\n        v.tokenFrom.safeTransferFrom(msg.sender, address(this), dx);\\n        v.dx = v.tokenFrom.balanceOf(address(this)).sub(v.dx); // update dx in case of fee on transfer\\n\\n        if (\\n            tokenIndexFrom < baseLPTokenIndex || tokenIndexTo < baseLPTokenIndex\\n        ) {\\n            uint256[] memory xp = _xp(self, v.oldBalances, v.baseVirtualPrice);\\n\\n            if (tokenIndexFrom < baseLPTokenIndex) {\\n                v.x =\\n                    xp[tokenIndexFrom] +\\n                    dx.mul(self.tokenPrecisionMultipliers[tokenIndexFrom]);\\n            } else {\\n                // tokenFrom is in the base pool\\n                uint256[] memory baseAmounts =\\n                    new uint256[](v.baseTokens.length);\\n                baseAmounts[tokenIndexFrom - baseLPTokenIndex] = v.dx;\\n                IERC20 baseLPToken = self.pooledTokens[baseLPTokenIndex];\\n                v.x = baseLPToken.balanceOf(address(this));\\n                // Add liquidity to the underlying swap contract\\n                baseSwap.addLiquidity(baseAmounts, 0, block.timestamp);\\n                // Now we have more of the base LP token\\n                v.dx = baseLPToken.balanceOf(address(this)).sub(v.x);\\n                v.x = v\\n                    .dx\\n                    .mul(v.baseVirtualPrice)\\n                    .div(BASE_VIRTUAL_PRICE_PRECISION)\\n                    .add(xp[baseLPTokenIndex]);\\n            }\\n\\n            uint256 dyFee;\\n            {\\n                uint256 y =\\n                    getY(\\n                        getAPrecise(self),\\n                        v.metaIndexFrom,\\n                        v.metaIndexTo,\\n                        v.x,\\n                        xp\\n                    );\\n                v.dy = xp[v.metaIndexTo].sub(y).sub(1);\\n                dyFee = v.dy.mul(self.swapFee).div(FEE_DENOMINATOR);\\n                v.dy = v.dy.sub(dyFee).div(\\n                    self.tokenPrecisionMultipliers[v.metaIndexTo]\\n                );\\n            }\\n\\n            if (tokenIndexTo >= baseLPTokenIndex) {\\n                v.dy = v.dy.mul(BASE_VIRTUAL_PRICE_PRECISION).div(\\n                    v.baseVirtualPrice\\n                );\\n            }\\n\\n            {\\n                uint256 dyAdminFee =\\n                    dyFee.mul(self.adminFee).div(FEE_DENOMINATOR);\\n                dyAdminFee = dyAdminFee.div(\\n                    self.tokenPrecisionMultipliers[v.metaIndexTo]\\n                );\\n                self.balances[v.metaIndexFrom] = v.oldBalances[v.metaIndexFrom]\\n                    .add(v.dx);\\n                self.balances[v.metaIndexTo] = v.oldBalances[v.metaIndexTo]\\n                    .sub(v.dy)\\n                    .sub(dyAdminFee);\\n            }\\n\\n            if (tokenIndexTo >= baseLPTokenIndex) {\\n                // tokenTo is from the base pool\\n                // burn the LP token and withdraw the desired token from the base pool\\n                uint256 oldBalance = v.tokenTo.balanceOf(address(this));\\n                baseSwap.removeLiquidityOneToken(\\n                    v.dy,\\n                    tokenIndexTo - baseLPTokenIndex,\\n                    0,\\n                    block.timestamp\\n                );\\n                v.dy = v.tokenTo.balanceOf(address(this)) - oldBalance;\\n            }\\n            require(v.dy >= minDy, \\\"Swap didn't result in min tokens\\\");\\n        } else {\\n            // Both tokens are from the base swap pool\\n            v.dy = v.tokenTo.balanceOf(address(this));\\n            baseSwap.swap(\\n                tokenIndexFrom - baseLPTokenIndex,\\n                tokenIndexTo - baseLPTokenIndex,\\n                v.dx,\\n                minDy,\\n                block.timestamp\\n            );\\n            v.dy = v.tokenTo.balanceOf(address(this)).sub(v.dy);\\n        }\\n\\n        v.tokenTo.safeTransfer(msg.sender, v.dy);\\n\\n        emit TokenSwapUnderlying(\\n            msg.sender,\\n            dx,\\n            v.dy,\\n            tokenIndexFrom,\\n            tokenIndexTo\\n        );\\n\\n        return v.dy;\\n    }\\n\\n    /**\\n     * @notice Add liquidity to the pool\\n     * @param self Swap struct to read from and write to\\n     * @param amounts the amounts of each token to add, in their native precision\\n     * @param minToMint the minimum LP tokens adding this amount of liquidity\\n     * should mint, otherwise revert. Handy for front-running mitigation\\n     * allowed addresses. If the pool is not in the guarded launch phase, this parameter will be ignored.\\n     * @return amount of LP token user received\\n     */\\n    function addLiquidity(\\n        EvmoSwapUtils.Swap storage self,\\n        MetaSwap storage metaSwapStorage,\\n        uint256[] memory amounts,\\n        uint256 minToMint\\n    ) external returns (uint256) {\\n        IERC20[] memory pooledTokens = self.pooledTokens;\\n        require(\\n            amounts.length == self.pooledTokens.length,\\n            \\\"Amounts must match pooled tokens\\\"\\n        );\\n\\n        uint256[] memory fees = new uint256[](pooledTokens.length);\\n\\n        // current state\\n        ManageLiquidityInfo memory v =\\n            ManageLiquidityInfo(\\n                0,\\n                0,\\n                0,\\n                self.lpToken,\\n                0,\\n                getAPrecise(self),\\n                _updateBaseVirtualPrice(metaSwapStorage),\\n                self.tokenPrecisionMultipliers,\\n                self.balances\\n            );\\n        v.totalSupply = v.lpToken.totalSupply();\\n\\n        if (v.totalSupply != 0) {\\n            v.d0 = getD(\\n                _xp(\\n                    v.newBalances,\\n                    v.tokenPrecisionMultipliers,\\n                    v.baseVirtualPrice\\n                ),\\n                v.preciseA\\n            );\\n        }\\n\\n        for (uint256 i = 0; i < pooledTokens.length; i++) {\\n            require(\\n                v.totalSupply != 0 || amounts[i] > 0,\\n                \\\"Must supply all tokens in pool\\\"\\n            );\\n\\n            // Transfer tokens first to see if a fee was charged on transfer\\n            if (amounts[i] != 0) {\\n                uint256 beforeBalance =\\n                    pooledTokens[i].balanceOf(address(this));\\n                pooledTokens[i].safeTransferFrom(\\n                    msg.sender,\\n                    address(this),\\n                    amounts[i]\\n                );\\n\\n                // Update the amounts[] with actual transfer amount\\n                amounts[i] = pooledTokens[i].balanceOf(address(this)).sub(\\n                    beforeBalance\\n                );\\n            }\\n\\n            v.newBalances[i] = v.newBalances[i].add(amounts[i]);\\n        }\\n\\n        // invariant after change\\n        v.d1 = getD(\\n            _xp(v.newBalances, v.tokenPrecisionMultipliers, v.baseVirtualPrice),\\n            v.preciseA\\n        );\\n        require(v.d1 > v.d0, \\\"D should increase\\\");\\n\\n        // updated to reflect fees and calculate the user's LP tokens\\n        v.d2 = v.d1;\\n        uint256 toMint;\\n\\n        if (v.totalSupply != 0) {\\n            uint256 feePerToken = _feePerToken(self);\\n            for (uint256 i = 0; i < pooledTokens.length; i++) {\\n                uint256 idealBalance = v.d1.mul(self.balances[i]).div(v.d0);\\n                fees[i] = feePerToken\\n                    .mul(idealBalance.difference(v.newBalances[i]))\\n                    .div(FEE_DENOMINATOR);\\n                self.balances[i] = v.newBalances[i].sub(\\n                    fees[i].mul(self.adminFee).div(FEE_DENOMINATOR)\\n                );\\n                v.newBalances[i] = v.newBalances[i].sub(fees[i]);\\n            }\\n            v.d2 = getD(\\n                _xp(\\n                    v.newBalances,\\n                    v.tokenPrecisionMultipliers,\\n                    v.baseVirtualPrice\\n                ),\\n                v.preciseA\\n            );\\n            toMint = v.d2.sub(v.d0).mul(v.totalSupply).div(v.d0);\\n        } else {\\n            // the initial depositor doesn't pay fees\\n            self.balances = v.newBalances;\\n            toMint = v.d1;\\n        }\\n\\n        require(toMint >= minToMint, \\\"Couldn't mint min requested\\\");\\n\\n        // mint the user's LP tokens\\n        self.lpToken.mint(msg.sender, toMint);\\n\\n        emit AddLiquidity(\\n            msg.sender,\\n            amounts,\\n            fees,\\n            v.d1,\\n            v.totalSupply.add(toMint)\\n        );\\n\\n        return toMint;\\n    }\\n\\n    /**\\n     * @notice Remove liquidity from the pool all in one token.\\n     * @param self Swap struct to read from and write to\\n     * @param tokenAmount the amount of the lp tokens to burn\\n     * @param tokenIndex the index of the token you want to receive\\n     * @param minAmount the minimum amount to withdraw, otherwise revert\\n     * @return amount chosen token that user received\\n     */\\n    function removeLiquidityOneToken(\\n        EvmoSwapUtils.Swap storage self,\\n        MetaSwap storage metaSwapStorage,\\n        uint256 tokenAmount,\\n        uint8 tokenIndex,\\n        uint256 minAmount\\n    ) external returns (uint256) {\\n        LPToken lpToken = self.lpToken;\\n        uint256 totalSupply = lpToken.totalSupply();\\n        uint256 numTokens = self.pooledTokens.length;\\n        require(tokenAmount <= lpToken.balanceOf(msg.sender), \\\">LP.balanceOf\\\");\\n        require(tokenIndex < numTokens, \\\"Token not found\\\");\\n\\n        uint256 dyFee;\\n        uint256 dy;\\n\\n        (dy, dyFee) = calculateWithdrawOneToken(\\n            self,\\n            msg.sender,\\n            tokenAmount,\\n            tokenIndex,\\n            _updateBaseVirtualPrice(metaSwapStorage),\\n            totalSupply\\n        );\\n\\n        require(dy >= minAmount, \\\"dy < minAmount\\\");\\n\\n        self.balances[tokenIndex] = self.balances[tokenIndex].sub(\\n            dy.add(dyFee.mul(self.adminFee).div(FEE_DENOMINATOR))\\n        );\\n        lpToken.burnFrom(msg.sender, tokenAmount);\\n        self.pooledTokens[tokenIndex].safeTransfer(msg.sender, dy);\\n\\n        emit RemoveLiquidityOne(\\n            msg.sender,\\n            tokenAmount,\\n            totalSupply,\\n            tokenIndex,\\n            dy\\n        );\\n\\n        return dy;\\n    }\\n\\n    /**\\n     * @notice Remove liquidity from the pool, weighted differently than the\\n     * pool's current balances.\\n     *\\n     * @param self Swap struct to read from and write to\\n     * @param amounts how much of each token to withdraw\\n     * @param maxBurnAmount the max LP token provider is willing to pay to\\n     * remove liquidity. Useful as a front-running mitigation.\\n     * @return actual amount of LP tokens burned in the withdrawal\\n     */\\n    function removeLiquidityImbalance(\\n        EvmoSwapUtils.Swap storage self,\\n        MetaSwap storage metaSwapStorage,\\n        uint256[] memory amounts,\\n        uint256 maxBurnAmount\\n    ) public returns (uint256) {\\n        ManageLiquidityInfo memory v =\\n            ManageLiquidityInfo(\\n                0,\\n                0,\\n                0,\\n                self.lpToken,\\n                0,\\n                getAPrecise(self),\\n                _updateBaseVirtualPrice(metaSwapStorage),\\n                self.tokenPrecisionMultipliers,\\n                self.balances\\n            );\\n        v.totalSupply = v.lpToken.totalSupply();\\n\\n        require(\\n            amounts.length == v.newBalances.length,\\n            \\\"Amounts should match pool tokens\\\"\\n        );\\n        require(\\n            maxBurnAmount <= v.lpToken.balanceOf(msg.sender) &&\\n                maxBurnAmount != 0,\\n            \\\">LP.balanceOf\\\"\\n        );\\n\\n        uint256 feePerToken = _feePerToken(self);\\n\\n        uint256[] memory fees = new uint256[](v.newBalances.length);\\n        {\\n            uint256[] memory balances1 = new uint256[](v.newBalances.length);\\n\\n            v.d0 = getD(\\n                _xp(\\n                    v.newBalances,\\n                    v.tokenPrecisionMultipliers,\\n                    v.baseVirtualPrice\\n                ),\\n                v.preciseA\\n            );\\n            for (uint256 i = 0; i < v.newBalances.length; i++) {\\n                balances1[i] = v.newBalances[i].sub(\\n                    amounts[i],\\n                    \\\"Cannot withdraw more than available\\\"\\n                );\\n            }\\n            v.d1 = getD(\\n                _xp(balances1, v.tokenPrecisionMultipliers, v.baseVirtualPrice),\\n                v.preciseA\\n            );\\n\\n            for (uint256 i = 0; i < v.newBalances.length; i++) {\\n                uint256 idealBalance = v.d1.mul(v.newBalances[i]).div(v.d0);\\n                uint256 difference = idealBalance.difference(balances1[i]);\\n                fees[i] = feePerToken.mul(difference).div(FEE_DENOMINATOR);\\n                self.balances[i] = balances1[i].sub(\\n                    fees[i].mul(self.adminFee).div(FEE_DENOMINATOR)\\n                );\\n                balances1[i] = balances1[i].sub(fees[i]);\\n            }\\n\\n            v.d2 = getD(\\n                _xp(balances1, v.tokenPrecisionMultipliers, v.baseVirtualPrice),\\n                v.preciseA\\n            );\\n        }\\n\\n        uint256 tokenAmount = v.d0.sub(v.d2).mul(v.totalSupply).div(v.d0);\\n        require(tokenAmount != 0, \\\"Burnt amount cannot be zero\\\");\\n        tokenAmount = tokenAmount.add(1).mul(FEE_DENOMINATOR).div(\\n            FEE_DENOMINATOR.sub(calculateCurrentWithdrawFee(self, msg.sender))\\n        );\\n\\n        require(tokenAmount <= maxBurnAmount, \\\"tokenAmount > maxBurnAmount\\\");\\n\\n        v.lpToken.burnFrom(msg.sender, tokenAmount);\\n\\n        for (uint256 i = 0; i < v.newBalances.length; i++) {\\n            self.pooledTokens[i].safeTransfer(msg.sender, amounts[i]);\\n        }\\n\\n        emit RemoveLiquidityImbalance(\\n            msg.sender,\\n            amounts,\\n            fees,\\n            v.d1,\\n            v.totalSupply.sub(tokenAmount)\\n        );\\n\\n        return tokenAmount;\\n    }\\n}\",\"keccak256\":\"0xc2d8e2fe9d1e084d8fd353eac253e52b6ddc3e3e560dc996cc7eae89c83ba9ea\",\"license\":\"MIT\"}},\"version\":1}",
  "bytecode": "0x614cb5610026600b82828239805160001a60731461001957fe5b30600052607381538281f3fe730000000000000000000000000000000000000000301460806040526004361061010a5760003560e01c8063a892cd87116100a1578063becf967c11610070578063becf967c1461048a578063d011f91814610492578063d8b3a90d1461049a578063e04f37cd146104db5761010a565b8063a892cd8714610315578063a8a50ed7146103d3578063b2a491641461040f578063bbca125c1461045e5761010a565b80635dbcca1e116100dd5780635dbcca1e146101ed5780638995f39514610232578063a28c2341146102f0578063a7df2f89146102f85761010a565b80630296ab501461010f5780631160c0241461012d5780632b27b26d146101625780633edc82d81461019e575b600080fd5b610117610569565b6040805160ff9092168252519081900360200190f35b6101506004803603604081101561014357600080fd5b508035906020013561056e565b60408051918252519081900360200190f35b610150600480360360a081101561017857600080fd5b5080359060208101359060ff6040820135811691606081013590911690608001356106b8565b8180156101aa57600080fd5b50610150600480360360c08110156101c157600080fd5b5080359060208101359060ff604082013581169160608101359091169060808101359060a001356106da565b8180156101f957600080fd5b50610150600480360360a081101561021057600080fd5b5080359060208101359060408101359060ff60608201351690608001356113ac565b81801561023e57600080fd5b506101506004803603608081101561025557600080fd5b81359160208101359181019060608101604082013564010000000081111561027c57600080fd5b82018360208201111561028e57600080fd5b803590602001918460208302840111640100000000831117156102b057600080fd5b91908080602002602001604051908101604052809392919081815260200183836020028082843760009201919091525092955050913592506116f8915050565b610150612076565b6101506004803603602081101561030e57600080fd5b5035612082565b81801561032157600080fd5b506101506004803603608081101561033857600080fd5b81359160208101359181019060608101604082013564010000000081111561035f57600080fd5b82018360208201111561037157600080fd5b8035906020019184602083028401116401000000008311171561039357600080fd5b919080806020026020016040519081016040528093929190818152602001838360200280828437600092019190915250929550509135925061211c915050565b610150600480360360a08110156103e957600080fd5b5080359060208101359060ff6040820135811691606081013590911690608001356128e8565b81801561041b57600080fd5b50610150600480360360c081101561043257600080fd5b5080359060208101359060ff604082013581169160608101359091169060808101359060a00135612e2e565b6101506004803603604081101561047457600080fd5b50803590602001356001600160a01b03166131aa565b610150613251565b610150613257565b610150600480360360a08110156104b057600080fd5b5080359060208101359060408101356001600160a01b0316906060810135906080013560ff1661325c565b610150600480360360a08110156104f157600080fd5b8135916020810135916001600160a01b03604083013516919081019060808101606082013564010000000081111561052857600080fd5b82018360208201111561053a57600080fd5b8035906020019184602083028401116401000000008311171561055c57600080fd5b91935091503515156132ef565b601281565b600080610594610586856105818661350a565b613523565b61058f86612082565b6135db565b905060008460090160009054906101000a90046001600160a01b031690506000816001600160a01b03166318160ddd6040518163ffffffff1660e01b815260040160206040518083038186803b1580156105ed57600080fd5b505afa158015610601573d6000803e3d6000fd5b505050506040513d602081101561061757600080fd5b5051905080156106aa576106a08161069a846001600160a01b031663313ce5676040518163ffffffff1660e01b815260040160206040518083038186803b15801561066157600080fd5b505afa158015610675573d6000803e3d6000fd5b505050506040513d602081101561068b57600080fd5b5051869060ff16600a0a6137b2565b9061380b565b93505050506106b2565b600093505050505b92915050565b60006106cf868585856106ca8a61350a565b613872565b509695505050505050565b60006106e4614a59565b604051806101400160405280600081526020016000815260200160008152602001600060ff168152602001600060ff16815260200189600c0180548060200260200160405190810160405280929190818152602001828054801561076757602002820191906000526020600020905b815481526020019060010190808311610753575b50505050508152602001886003018054806020026020016040519081016040528092919081815260200182805480156107c957602002820191906000526020600020905b81546001600160a01b031681526001909101906020018083116107ab575b505050918352505060006020820181905260408201526060016107eb89613a23565b8152509050600060018260a001515103905060008260c0015151820190508060ff168860ff1610801561082357508060ff168760ff16105b61086f576040805162461bcd60e51b8152602060048201526018602482015277546f6b656e20696e646578206f7574206f662072616e676560401b604482015290519081900360640190fd5b5087546001600160a01b031660ff80831690891610156108c35789600a018860ff168154811061089b57fe5b6000918252602090912001546001600160a01b031660e084015260ff881660608401526108fb565b8260c0015182890360ff16815181106108d857fe5b60209081029190910101516001600160a01b031660e084015260ff821660608401525b8160ff168760ff1610156109445789600a018760ff168154811061091b57fe5b6000918252602090912001546001600160a01b031661010084015260ff8716608084015261097d565b8260c0015182880360ff168151811061095957fe5b60209081029190910101516001600160a01b031661010084015260ff821660808401525b8260e001516001600160a01b03166370a08231306040518263ffffffff1660e01b815260040180826001600160a01b0316815260200191505060206040518083038186803b1580156109ce57600080fd5b505afa1580156109e2573d6000803e3d6000fd5b505050506040513d60208110156109f857600080fd5b5051602084015260e0830151610a19906001600160a01b0316333089613ac6565b610aa483602001518460e001516001600160a01b03166370a08231306040518263ffffffff1660e01b815260040180826001600160a01b0316815260200191505060206040518083038186803b158015610a7257600080fd5b505afa158015610a86573d6000803e3d6000fd5b505050506040513d6020811015610a9c57600080fd5b505190613b26565b602084015260ff8083169089161080610ac257508160ff168760ff16105b156111a5576060610add8b8560a00151866101200151613b83565b90508260ff168960ff161015610b3e57610b1c8b600b018a60ff1681548110610b0257fe5b9060005260206000200154886137b290919063ffffffff16565b818a60ff1681518110610b2b57fe5b6020908102919091010151018452610daa565b60608460c001515167ffffffffffffffff81118015610b5c57600080fd5b50604051908082528060200260200182016040528015610b86578160200160208202803683370190505b509050846020015181858c0360ff1681518110610b9f57fe5b60200260200101818152505060008c600a018560ff1681548110610bbf57fe5b60009182526020918290200154604080516370a0823160e01b815230600482015290516001600160a01b03909216935083926370a0823192602480840193829003018186803b158015610c1157600080fd5b505afa158015610c25573d6000803e3d6000fd5b505050506040513d6020811015610c3b57600080fd5b50518652604051634d49e87d60e01b815260006024820181905242604483018190526060600484019081528551606485015285516001600160a01b03891694634d49e87d948894909390929091829160849091019060208781019102808383895b83811015610cb4578181015183820152602001610c9c565b50505050905001945050505050602060405180830381600087803b158015610cdb57600080fd5b505af1158015610cef573d6000803e3d6000fd5b505050506040513d6020811015610d0557600080fd5b50508551604080516370a0823160e01b81523060048201529051610d5592916001600160a01b038516916370a0823191602480820192602092909190829003018186803b158015610a7257600080fd5b60208701528251610da590849060ff8816908110610d6f57fe5b6020026020010151610d9f670de0b6b3a764000061069a8a61012001518b602001516137b290919063ffffffff16565b90613be0565b865250505b600080610dcb610db98e612082565b60608801516080890151895187613c3a565b9050610e056001610dff83868a6080015160ff1681518110610de957fe5b6020026020010151613b2690919063ffffffff16565b90613b26565b6040870181905260048e0154610e26916402540be4009161069a91906137b2565b9150610e638d600b01876080015160ff1681548110610e4157fe5b906000526020600020015461069a848960400151613b2690919063ffffffff16565b60408701525060ff808516908a1610610ea457610e9e85610120015161069a670de0b6b3a764000088604001516137b290919063ffffffff16565b60408601525b6000610ec66402540be40061069a8f60050154856137b290919063ffffffff16565b9050610efb8d600b01876080015160ff1681548110610ee157fe5b90600052602060002001548261380b90919063ffffffff16565b9050610f3286602001518760a00151886060015160ff1681518110610f1c57fe5b6020026020010151613be090919063ffffffff16565b8d600c01876060015160ff1681548110610f4857fe5b9060005260206000200181905550610f7981610dff88604001518960a001518a6080015160ff1681518110610de957fe5b8d600c01876080015160ff1681548110610f8f57fe5b9060005260206000200181905550508360ff168960ff16106111455760008561010001516001600160a01b03166370a08231306040518263ffffffff1660e01b815260040180826001600160a01b0316815260200191505060206040518083038186803b158015610fff57600080fd5b505afa158015611013573d6000803e3d6000fd5b505050506040513d602081101561102957600080fd5b505160408088015181516301f1d0ab60e51b8152600481019190915260ff888e0316602482015260006044820181905242606483015291519293506001600160a01b03871692633e3a156092608480840193602093929083900390910190829087803b15801561109857600080fd5b505af11580156110ac573d6000803e3d6000fd5b505050506040513d60208110156110c257600080fd5b5050610100860151604080516370a0823160e01b8152306004820152905183926001600160a01b0316916370a08231916024808301926020929190829003018186803b15801561111157600080fd5b505afa158015611125573d6000803e3d6000fd5b505050506040513d602081101561113b57600080fd5b5051036040870152505b868560400151101561119e576040805162461bcd60e51b815260206004820181905260248201527f53776170206469646e277420726573756c7420696e206d696e20746f6b656e73604482015290519081900360640190fd5b5050611320565b8261010001516001600160a01b03166370a08231306040518263ffffffff1660e01b815260040180826001600160a01b0316815260200191505060206040518083038186803b1580156111f757600080fd5b505afa15801561120b573d6000803e3d6000fd5b505050506040513d602081101561122157600080fd5b505160408085019190915260208481015182516348b4aac360e11b815260ff868d0381166004830152868c0316602482015260448101919091526064810188905242608482015291516001600160a01b0384169263916955869260a48083019391928290030181600087803b15801561129957600080fd5b505af11580156112ad573d6000803e3d6000fd5b505050506040513d60208110156112c357600080fd5b505060408084015161010085015182516370a0823160e01b8152306004820152925161131a936001600160a01b03909216916370a08231916024808301926020929190829003018186803b158015610a7257600080fd5b60408401525b6113473384604001518561010001516001600160a01b0316613ef49092919063ffffffff16565b6040808401518151888152602081019190915260ff808b168284015289166060820152905133917f6617207207e397b41fc98016d8c9febb7223f44c355db66ad429730f2b950a60919081900360800190a250506040015190505b9695505050505050565b6009850154604080516318160ddd60e01b815290516000926001600160a01b031691839183916318160ddd916004808301926020929190829003018186803b1580156113f757600080fd5b505afa15801561140b573d6000803e3d6000fd5b505050506040513d602081101561142157600080fd5b5051600a890154604080516370a0823160e01b8152336004820152905192935090916001600160a01b038516916370a08231916024808301926020929190829003018186803b15801561147357600080fd5b505afa158015611487573d6000803e3d6000fd5b505050506040513d602081101561149d57600080fd5b50518711156114e3576040805162461bcd60e51b815260206004820152600d60248201526c1f2628173130b630b731b2a7b360991b604482015290519081900360640190fd5b808660ff161061152c576040805162461bcd60e51b815260206004820152600f60248201526e151bdad95b881b9bdd08199bdd5b99608a1b604482015290519081900360640190fd5b6000806115458b338b8b61153f8f613a23565b89613f4b565b925090508681101561158f576040805162461bcd60e51b815260206004820152600e60248201526d191e480f081b5a5b905b5bdd5b9d60921b604482015290519081900360640190fd5b6115e76115bc6115b56402540be40061069a8f60050154876137b290919063ffffffff16565b8390613be0565b8c600c018a60ff16815481106115ce57fe5b9060005260206000200154613b2690919063ffffffff16565b8b600c018960ff16815481106115f957fe5b60009182526020822001919091556040805163079cc67960e41b8152336004820152602481018c905290516001600160a01b038816926379cc6790926044808201939182900301818387803b15801561165157600080fd5b505af1158015611665573d6000803e3d6000fd5b5050505061169c33828d600a018b60ff168154811061168057fe5b6000918252602090912001546001600160a01b03169190613ef4565b604080518a81526020810186905260ff8a168183015260608101839052905133917f43fb02998f4e03da2e0e6fff53fdbf0c40a9f45f145dc377fc30615d7d7a8a64919081900360800190a29450505050505b95945050505050565b6000606085600a0180548060200260200160405190810160405280929190818152602001828054801561175457602002820191906000526020600020905b81546001600160a01b03168152600190910190602001808311611736575b5050505050905085600a01805490508451146117b7576040805162461bcd60e51b815260206004820181905260248201527f416d6f756e7473206d757374206d6174636820706f6f6c656420746f6b656e73604482015290519081900360640190fd5b6060815167ffffffffffffffff811180156117d157600080fd5b506040519080825280602002602001820160405280156117fb578160200160208202803683370190505b509050611806614ac4565b604080516101208101825260008082526020820181905291810182905260098a01546001600160a01b03166060820152608081019190915260a0810161184b8a612082565b815260200161185989613a23565b815260200189600b018054806020026020016040519081016040528092919081815260200182805480156118ac57602002820191906000526020600020905b815481526020019060010190808311611898575b5050505050815260200189600c0180548060200260200160405190810160405280929190818152602001828054801561190457602002820191906000526020600020905b8154815260200190600101908083116118f0575b5050505050815250905080606001516001600160a01b03166318160ddd6040518163ffffffff1660e01b815260040160206040518083038186803b15801561194b57600080fd5b505afa15801561195f573d6000803e3d6000fd5b505050506040513d602081101561197557600080fd5b505160808201819052156119ab576119a861199e8261010001518360e001518460c00151613fcf565b8260a001516135db565b81525b60005b8351811015611bee5760808201511515806119dc575060008782815181106119d257fe5b6020026020010151115b611a2d576040805162461bcd60e51b815260206004820152601e60248201527f4d75737420737570706c7920616c6c20746f6b656e7320696e20706f6f6c0000604482015290519081900360640190fd5b868181518110611a3957fe5b6020026020010151600014611ba2576000848281518110611a5657fe5b60200260200101516001600160a01b03166370a08231306040518263ffffffff1660e01b815260040180826001600160a01b0316815260200191505060206040518083038186803b158015611aaa57600080fd5b505afa158015611abe573d6000803e3d6000fd5b505050506040513d6020811015611ad457600080fd5b50518851909150611b2490339030908b9086908110611aef57fe5b6020026020010151888681518110611b0357fe5b60200260200101516001600160a01b0316613ac6909392919063ffffffff16565b611b8881868481518110611b3457fe5b60200260200101516001600160a01b03166370a08231306040518263ffffffff1660e01b815260040180826001600160a01b0316815260200191505060206040518083038186803b158015610a7257600080fd5b888381518110611b9457fe5b602002602001018181525050505b611bca878281518110611bb157fe5b60200260200101518361010001518381518110610f1c57fe5b8261010001518281518110611bdb57fe5b60209081029190910101526001016119ae565b50611c0a61199e8261010001518360e001518460c00151613fcf565b60208201819052815110611c59576040805162461bcd60e51b8152602060048201526011602482015270442073686f756c6420696e63726561736560781b604482015290519081900360640190fd5b60208101516040820152608081015160009015611e93576000611c7b8a614103565b905060005b8551811015611e3e576000611cc3856000015161069a8e600c018581548110611ca557fe5b906000526020600020015488602001516137b290919063ffffffff16565b9050611d756402540be40061069a83733382D6140c6f3F29190f642FC19DBD1c8550D53063a95cb7f790918a61010001518881518110611cff57fe5b60200260200101516040518363ffffffff1660e01b8152600401808381526020018281526020019250505060206040518083038186803b158015611d4257600080fd5b505af4158015611d56573d6000803e3d6000fd5b505050506040513d6020811015611d6c57600080fd5b505186906137b2565b868381518110611d8157fe5b602002602001018181525050611dd4611dc36402540be40061069a8f600501548a8781518110611dad57fe5b60200260200101516137b290919063ffffffff16565b8661010001518481518110610de957fe5b8c600c018381548110611de357fe5b9060005260206000200181905550611e19868381518110611e0057fe5b60200260200101518661010001518481518110610de957fe5b8561010001518381518110611e2a57fe5b602090810291909101015250600101611c80565b50611e64611e5a8461010001518560e001518660c00151613fcf565b8460a001516135db565b6040840181905283516080850151611e8b9261069a9190611e859084613b26565b906137b2565b915050611eb7565b6101008201518051611eaf91600c8c0191602090910190614b19565b505060208101515b85811015611f0c576040805162461bcd60e51b815260206004820152601b60248201527f436f756c646e2774206d696e74206d696e207265717565737465640000000000604482015290519081900360640190fd5b6009890154604080516340c10f1960e01b81523360048201526024810184905290516001600160a01b03909216916340c10f199160448082019260009290919082900301818387803b158015611f6157600080fd5b505af1158015611f75573d6000803e3d6000fd5b50505050336001600160a01b03167f189c623b666b1b45b83d7178f39b8c087cb09774317ca2f53c2d3c3726f222a288858560200151611fc2868860800151613be090919063ffffffff16565b604051808060200180602001858152602001848152602001838103835287818151815260200191508051906020019060200280838360005b83811015612012578181015183820152602001611ffa565b50505050905001838103825286818151815260200191508051906020019060200280838360005b83811015612051578181015183820152602001612039565b50505050905001965050505050505060405180910390a293505050505b949350505050565b670de0b6b3a764000081565b60038101546001820154600091904282111561210e5760028401548454808311156120e0576120d56120ce6120b78685613b26565b61069a6120c44287613b26565b611e858887613b26565b8290613be0565b945050505050612117565b6120d56121076120f08685613b26565b61069a6120fd4287613b26565b611e858689613b26565b8290613b26565b91506121179050565b919050565b6000612126614ac4565b604080516101208101825260008082526020820181905291810182905260098801546001600160a01b03166060820152608081019190915260a0810161216b88612082565b815260200161217987613a23565b815260200187600b018054806020026020016040519081016040528092919081815260200182805480156121cc57602002820191906000526020600020905b8154815260200190600101908083116121b8575b5050505050815260200187600c0180548060200260200160405190810160405280929190818152602001828054801561222457602002820191906000526020600020905b815481526020019060010190808311612210575b5050505050815250905080606001516001600160a01b03166318160ddd6040518163ffffffff1660e01b815260040160206040518083038186803b15801561226b57600080fd5b505afa15801561227f573d6000803e3d6000fd5b505050506040513d602081101561229557600080fd5b50516080820152610100810151518451146122f7576040805162461bcd60e51b815260206004820181905260248201527f416d6f756e74732073686f756c64206d6174636820706f6f6c20746f6b656e73604482015290519081900360640190fd5b80606001516001600160a01b03166370a08231336040518263ffffffff1660e01b815260040180826001600160a01b0316815260200191505060206040518083038186803b15801561234857600080fd5b505afa15801561235c573d6000803e3d6000fd5b505050506040513d602081101561237257600080fd5b5051831180159061238257508215155b6123c3576040805162461bcd60e51b815260206004820152600d60248201526c1f2628173130b630b731b2a7b360991b604482015290519081900360640190fd5b60006123ce87614103565b905060608261010001515167ffffffffffffffff811180156123ef57600080fd5b50604051908082528060200260200182016040528015612419578160200160208202803683370190505b50905060608361010001515167ffffffffffffffff8111801561243b57600080fd5b50604051908082528060200260200182016040528015612465578160200160208202803683370190505b50905061248d6124838561010001518660e001518760c00151613fcf565b8560a001516135db565b845260005b84610100015151811015612517576124f88882815181106124af57fe5b6020026020010151604051806060016040528060238152602001614c5d6023913987610100015184815181106124e157fe5b60200260200101516141939092919063ffffffff16565b82828151811061250457fe5b6020908102919091010152600101612492565b5061252e612483828660e001518760c00151613fcf565b602085015260005b846101000151518110156126d357600061257d866000015161069a886101000151858151811061256257fe5b602002602001015189602001516137b290919063ffffffff16565b9050600081733382D6140c6f3F29190f642FC19DBD1c8550D53063a95cb7f790918686815181106125aa57fe5b60200260200101516040518363ffffffff1660e01b8152600401808381526020018281526020019250505060206040518083038186803b1580156125ed57600080fd5b505af4158015612601573d6000803e3d6000fd5b505050506040513d602081101561261757600080fd5b5051905061262e6402540be40061069a88846137b2565b85848151811061263a57fe5b6020026020010181815250506126726126666402540be40061069a8f60050154898881518110611dad57fe5b858581518110610de957fe5b8c600c01848154811061268157fe5b90600052602060002001819055506126b285848151811061269e57fe5b6020026020010151858581518110610de957fe5b8484815181106126be57fe5b60209081029190910101525050600101612536565b506126ea612483828660e001518760c00151613fcf565b6040850181905284516080860151600093506127109261069a9190611e85908490613b26565b905080612764576040805162461bcd60e51b815260206004820152601b60248201527f4275726e7420616d6f756e742063616e6e6f74206265207a65726f0000000000604482015290519081900360640190fd5b6127946127806127748b336131aa565b6402540be40090613b26565b61069a6402540be400611e85856001613be0565b9050858111156127eb576040805162461bcd60e51b815260206004820152601b60248201527f746f6b656e416d6f756e74203e206d61784275726e416d6f756e740000000000604482015290519081900360640190fd5b83606001516001600160a01b03166379cc679033836040518363ffffffff1660e01b815260040180836001600160a01b0316815260200182815260200192505050600060405180830381600087803b15801561284657600080fd5b505af115801561285a573d6000803e3d6000fd5b5050505060005b8461010001515181101561289e576128963389838151811061287f57fe5b60200260200101518c600a01848154811061168057fe5b600101612861565b50336001600160a01b03167f3631c28b1f9dd213e0319fb167b554d76b6c283a41143eb400a0d1adb1af175588848760200151611fc2868a60800151613b2690919063ffffffff16565b60006128f2614b64565b6040518060e001604052806129068861350a565b815287546001600160a01b03166020820152600060408201819052600389015460ff166060808401919091526080830182905260a0830182905260c090920152815191925090612957908990613523565b80516000190160ff908116604085018190526060850151929350919091019081811690881610801561298e57508060ff168660ff16105b6129da576040805162461bcd60e51b8152602060048201526018602482015277546f6b656e20696e646578206f7574206f662072616e676560401b604482015290519081900360640190fd5b50816040015160ff168660ff161015612a3857612a2e612a1f89600b018860ff1681548110612a0557fe5b9060005260206000200154866137b290919063ffffffff16565b828860ff1681518110610f1c57fe5b60a0830152612c6c565b6040820151958690039560ff9081169086161015612bca576060826060015160ff1667ffffffffffffffff81118015612a7057600080fd5b50604051908082528060200260200182016040528015612a9a578160200160208202803683370190505b50905084818860ff1681518110612aad57fe5b602002602001018181525050612bbf82846040015160ff1681518110612acf57fe5b6020026020010151610d9f670de0b6b3a764000061069a876000015188602001516001600160a01b031663f9273ffb308960016040518463ffffffff1660e01b815260040180846001600160a01b03168152602001806020018315158152602001828103825284818151815260200191508051906020019060200280838360005b83811015612b68578181015183820152602001612b50565b5050505090500194505050505060206040518083038186803b158015612b8d57600080fd5b505afa158015612ba1573d6000803e3d6000fd5b505050506040513d6020811015612bb757600080fd5b5051906137b2565b60a084015250612c64565b81602001516001600160a01b031663a95b089f8784604001518803876040518463ffffffff1660e01b8152600401808460ff1681526020018360ff168152602001828152602001935050505060206040518083038186803b158015612c2e57600080fd5b505afa158015612c42573d6000803e3d6000fd5b505050506040513d6020811015612c5857600080fd5b505192506116ef915050565b816040015195505b604082015160ff908116608084018190529086161015612c905760ff851660808301525b6000612caf612c9e8a612082565b8885608001518660a0015186613c3a565b9050612ccd6001610dff8385876080015160ff1681518110610de957fe5b60c0840181905260048a0154600091612cf0916402540be4009161069a916137b2565b60c0850151909150612d029082613b26565b60c08501525050604082015160ff9081169086161015612d5d57612d5388600b01836080015160ff1681548110612d3557fe5b90600052602060002001548360c0015161380b90919063ffffffff16565b60c0830152612e1f565b81602001516001600160a01b03166398899f4030612d98856000015161069a670de0b6b3a76400008860c001516137b290919063ffffffff16565b856040015189036040518463ffffffff1660e01b815260040180846001600160a01b031681526020018381526020018260ff168152602001935050505060206040518083038186803b158015612ded57600080fd5b505afa158015612e01573d6000803e3d6000fd5b505050506040513d6020811015612e1757600080fd5b505160c08301525b5060c001519695505050505050565b600080600088600a018760ff1681548110612e4557fe5b60009182526020918290200154604080516370a0823160e01b815233600482015290516001600160a01b03909216935083926370a0823192602480840193829003018186803b158015612e9757600080fd5b505afa158015612eab573d6000803e3d6000fd5b505050506040513d6020811015612ec157600080fd5b5051851115612f17576040805162461bcd60e51b815260206004820152601d60248201527f43616e6e6f742073776170206d6f7265207468616e20796f75206f776e000000604482015290519081900360640190fd5b6000816001600160a01b03166370a08231306040518263ffffffff1660e01b815260040180826001600160a01b0316815260200191505060206040518083038186803b158015612f6657600080fd5b505afa158015612f7a573d6000803e3d6000fd5b505050506040513d6020811015612f9057600080fd5b50519050612fa96001600160a01b038316333089613ac6565b612ffa81836001600160a01b03166370a08231306040518263ffffffff1660e01b815260040180826001600160a01b0316815260200191505060206040518083038186803b158015610a7257600080fd5b925050506000806130118a8989866106ca8e613a23565b915091508482101561306a576040805162461bcd60e51b815260206004820181905260248201527f53776170206469646e277420726573756c7420696e206d696e20746f6b656e73604482015290519081900360640190fd5b60006130ac8b600b018960ff168154811061308157fe5b906000526020600020015461069a6402540be40061069a8f60050154876137b290919063ffffffff16565b90506130dd848c600c018b60ff16815481106130c457fe5b9060005260206000200154613be090919063ffffffff16565b8b600c018a60ff16815481106130ef57fe5b906000526020600020018190555061311781610dff858e600c018c60ff16815481106115ce57fe5b8b600c018960ff168154811061312957fe5b906000526020600020018190555061314e33848d600a018b60ff168154811061168057fe5b604080518581526020810185905260ff808c16828401528a166060820152905133917fc6c1e0630dbe9130cc068028486c0d118ddcea348550819defd5cb8c257f8a38919081900360800190a250909998505050505050505050565b6001600160a01b0381166000908152600d8301602052604081205481906131d4906224ea00613be0565b9050428111156132475760006131ea8242613b26565b905061323e6402540be40061069a6224ea0061069a85611e858b600e0160008c6001600160a01b03166001600160a01b03168152602001908152602001600020548c600701546137b290919063ffffffff16565b925050506106b2565b5060009392505050565b61025881565b606481565b60006106cf8685858561326e8a61350a565b8b60090160009054906101000a90046001600160a01b03166001600160a01b03166318160ddd6040518163ffffffff1660e01b815260040160206040518083038186803b1580156132be57600080fd5b505afa1580156132d2573d6000803e3d6000fd5b505050506040513d60208110156132e857600080fd5b5051613f4b565b6000806132fb88612082565b9050600080600061330b8a61350a565b905060608b600c0180548060200260200160405190810160405280929190818152602001828054801561335d57602002820191906000526020600020905b815481526020019060010190808311613349575b5050505050905060008151905061337e6133788e8486613b83565b876135db565b945060005b8181101561342c5788156133d0576133b38b8b838181106133a057fe5b90506020020135848381518110610f1c57fe5b8382815181106133bf57fe5b602002602001018181525050613424565b61340b8b8b838181106133df57fe5b90506020020135604051806060016040528060238152602001614c5d602391398584815181106124e157fe5b83828151811061341757fe5b6020026020010181815250505b600101613383565b5061343b6133788e8486613b83565b935050505060008a60090160009054906101000a90046001600160a01b03166001600160a01b03166318160ddd6040518163ffffffff1660e01b815260040160206040518083038186803b15801561349257600080fd5b505afa1580156134a6573d6000803e3d6000fd5b505050506040513d60208110156134bc57600080fd5b5051905085156134e3576134d88361069a83611e858684613b26565b9450505050506113a2565b6134d86134f36127748d8c6131aa565b61069a6402540be400611e8587838783838b613b26565b80546000906106b29083906001600160a01b031661422a565b60606135d483600c0180548060200260200160405190810160405280929190818152602001828054801561357657602002820191906000526020600020905b815481526020019060010190808311613562575b505050505084600b018054806020026020016040519081016040528092919081815260200182805480156135c957602002820191906000526020600020905b8154815260200190600101908083116135b5575b505050505084613fcf565b9392505050565b815160009081805b8281101561361b576136118682815181106135fa57fe5b602002602001015183613be090919063ffffffff16565b91506001016135e3565b508061362c576000925050506106b2565b6000818161363a87866137b2565b905060005b61010081101561376e578260005b8781101561367c57613672613668898d8481518110611dad57fe5b61069a84886137b2565b915060010161364d565b5092935083926136ca6136aa61369783611e858b6001613be0565b610d9f606461069a89611e858a84613b26565b61069a86611e856136bb868d6137b2565b610d9f606461069a8b8f6137b2565b935083733382D6140c6f3F29190f642FC19DBD1c8550D5306313a1ec759091876040518363ffffffff1660e01b8152600401808381526020018281526020019250505060206040518083038186803b15801561372557600080fd5b505af4158015613739573d6000803e3d6000fd5b505050506040513d602081101561374f57600080fd5b50511561376557839750505050505050506106b2565b5060010161363f565b506040805162461bcd60e51b81526020600482015260136024820152724420646f6573206e6f7420636f6e766572676560681b604482015290519081900360640190fd5b6000826137c1575060006106b2565b828202828482816137ce57fe5b04146135d45760405162461bcd60e51b8152600401808060200182810382526021815260200180614c126021913960400191505060405180910390fd5b6000808211613861576040805162461bcd60e51b815260206004820152601a60248201527f536166654d6174683a206469766973696f6e206279207a65726f000000000000604482015290519081900360640190fd5b81838161386a57fe5b049392505050565b60008060606138818885613523565b905080518760ff16108015613899575080518660ff16105b6138e5576040805162461bcd60e51b8152602060048201526018602482015277546f6b656e20696e646578206f7574206f662072616e676560401b604482015290519081900360640190fd5b80516000906138f5906001613b26565b9050600061390e8a600b018a60ff1681548110610b0257fe5b9050818960ff16141561393457613931670de0b6b3a764000061069a83896137b2565b90505b61395d838a60ff168151811061394657fe5b602002602001015182613be090919063ffffffff16565b9050600061397661396d8c612082565b8b8b8588613c3a565b90506139906001610dff83878d60ff1681518110610de957fe5b9550828960ff1614156139b6576139b38761069a88670de0b6b3a76400006137b2565b95505b6139d66402540be40061069a8d60040154896137b290919063ffffffff16565b94506139e28686613b26565b9550613a138b600b018a60ff16815481106139f957fe5b90600052602060002001548761380b90919063ffffffff16565b9550505050509550959350505050565b6000610258826002015401421115613abb5781546040805163712d52fd60e11b815290516000926001600160a01b03169163e25aa5fa916004808301926020929190829003018186803b158015613a7957600080fd5b505afa158015613a8d573d6000803e3d6000fd5b505050506040513d6020811015613aa357600080fd5b50516001840181905542600285015591506121179050565b506001810154612117565b604080516001600160a01b0380861660248301528416604482015260648082018490528251808303909101815260849091019091526020810180516001600160e01b03166323b872dd60e01b179052613b209085906142b3565b50505050565b600082821115613b7d576040805162461bcd60e51b815260206004820152601e60248201527f536166654d6174683a207375627472616374696f6e206f766572666c6f770000604482015290519081900360640190fd5b50900390565b606061206e8385600b018054806020026020016040519081016040528092919081815260200182805480156135c957602002820191906000526020600020908154815260200190600101908083116135b557505050505084613fcf565b6000828201838110156135d4576040805162461bcd60e51b815260206004820152601b60248201527f536166654d6174683a206164646974696f6e206f766572666c6f770000000000604482015290519081900360640190fd5b805160009060ff8681169086161415613c9a576040805162461bcd60e51b815260206004820152601d60248201527f43616e277420636f6d7061726520746f6b656e20746f20697473656c66000000604482015290519081900360640190fd5b808660ff16108015613cae5750808560ff16105b613cf8576040805162461bcd60e51b8152602060048201526016602482015275151bdad95b9cc81b5d5cdd081899481a5b881c1bdbdb60521b604482015290519081900360640190fd5b6000613d0484896135db565b905080600080613d14858c6137b2565b90506000805b86811015613d8d578b60ff16811415613d3557899150613d5f565b8a60ff168114613d5a57888181518110613d4b57fe5b60200260200101519150613d5f565b613d85565b613d698483613be0565b9350613d82613d7883896137b2565b61069a87896137b2565b94505b600101613d1a565b50613daa613d9b83886137b2565b61069a6064611e85888a6137b2565b93506000613dc7613dc08461069a8960646137b2565b8590613be0565b9050600086815b610100811015613ea6579091508190613e01613df38a610dff87610d9f8760026137b2565b61069a8a610d9f86806137b2565b915081733382D6140c6f3F29190f642FC19DBD1c8550D5306313a1ec759091856040518363ffffffff1660e01b8152600401808381526020018281526020019250505060206040518083038186803b158015613e5c57600080fd5b505af4158015613e70573d6000803e3d6000fd5b505050506040513d6020811015613e8657600080fd5b505115613e9e575098506116ef975050505050505050565b600101613dce565b506040805162461bcd60e51b815260206004820152601e60248201527f417070726f78696d6174696f6e20646964206e6f7420636f6e76657267650000604482015290519081900360640190fd5b604080516001600160a01b038416602482015260448082018490528251808303909101815260649091019091526020810180516001600160e01b031663a9059cbb60e01b179052613f469084906142b3565b505050565b600080600080600080613f618c8a8c8b8b614364565b809450819350829650505050613f9c84610dff8e600b018c60ff1681548110613f8657fe5b60009182526020909120015461069a8686613b26565b92505050613fc06402540be40061069a613fb96127748e8e6131aa565b85906137b2565b9a909950975050505050505050565b8251825160609190811461402a576040805162461bcd60e51b815260206004820152601f60248201527f42616c616e636573206d757374206d61746368206d756c7469706c6965727300604482015290519081900360640190fd5b60608167ffffffffffffffff8111801561404357600080fd5b5060405190808252806020026020018201604052801561406d578160200160208202803683370190505b50905060005b828110156140bd5761409e86828151811061408a57fe5b6020026020010151888381518110611dad57fe5b8282815181106140aa57fe5b6020908102919091010152600101614073565b5060006001830390506140e2670de0b6b3a764000061069a87858581518110611dad57fe5b8282815181106140ee57fe5b60209081029190910101525095945050505050565b6000606082600a0180548060200260200160405190810160405280929190818152602001828054801561415f57602002820191906000526020600020905b81546001600160a01b03168152600190910190602001808311614141575b505050505090506135d46141836004611e8560018551613b2690919063ffffffff16565b8251600486015461069a916137b2565b600081848411156142225760405162461bcd60e51b81526004018080602001828103825283818151815260200191508051906020019080838360005b838110156141e75781810151838201526020016141cf565b50505050905090810190601f1680156142145780820380516001836020036101000a031916815260200191505b509250505060405180910390fd5b505050900390565b60006102588360020154014211156142a857816001600160a01b031663e25aa5fa6040518163ffffffff1660e01b815260040160206040518083038186803b15801561427557600080fd5b505afa158015614289573d6000803e3d6000fd5b505050506040513d602081101561429f57600080fd5b505190506106b2565b5060018201546106b2565b6060614308826040518060400160405280602081526020017f5361666545524332303a206c6f772d6c6576656c2063616c6c206661696c6564815250856001600160a01b03166146a89092919063ffffffff16565b805190915015613f465780806020019051602081101561432757600080fd5b5051613f465760405162461bcd60e51b815260040180806020018281038252602a815260200180614c33602a913960400191505060405180910390fd5b600080600060606143758987613523565b905080518860ff16106143ca576040805162461bcd60e51b8152602060048201526018602482015277546f6b656e20696e646578206f7574206f662072616e676560401b604482015290519081900360640190fd5b6143d2614ba0565b6040518060c001604052806000815260200160008152602001600081526020016000815260200160008152602001600081525090506144108a612082565b608082018190526144229083906135db565b8082526144429061443a90889061069a908c906137b2565b825190613b26565b60208201528151829060ff8b1690811061445857fe5b60200260200101518811156144b4576040805162461bcd60e51b815260206004820152601a60248201527f5769746864726177206578636565647320617661696c61626c65000000000000604482015290519081900360640190fd5b6144c881608001518a8484602001516146b7565b6040820152815160609067ffffffffffffffff811180156144e857600080fd5b50604051908082528060200260200182016040528015614512578160200160208202803683370190505b50905061451e8b614103565b606083015260005b83518110156145f55783818151811061453b57fe5b60200260200101518360a00181815250506145d66145cb6402540be40061069a86606001518f60ff1686146145a05761459b614590896000015161069a8b602001518c60a001516137b290919063ffffffff16565b60a08a015190613b26565b611e85565b611e858860400151610dff8a6000015161069a8c602001518d60a001516137b290919063ffffffff16565b60a085015190613b26565b8282815181106145e257fe5b6020908102919091010152600101614526565b50600061461e61460f84608001518d8587602001516146b7565b838d60ff1681518110610de957fe5b905061464c8c600b018c60ff168154811061463557fe5b60009182526020909120015461069a836001613b26565b905060018451038b60ff161415614676576146738961069a83670de0b6b3a76400006137b2565b90505b808360400151858d60ff168151811061468b57fe5b602002602001015196509650965050505050955095509592505050565b606061206e8484600085614891565b815160009060ff85168111614705576040805162461bcd60e51b815260206004820152600f60248201526e151bdad95b881b9bdd08199bdd5b99608a1b604482015290519081900360640190fd5b8260008061471389856137b2565b905060005b8481101561477a578860ff1681146147725761475088828151811061473957fe5b602002602001015184613be090919063ffffffff16565b925061476f614765868a8481518110611dad57fe5b61069a868a6137b2565b93505b600101614718565b5061479761478882866137b2565b61069a6064611e85878b6137b2565b925060006147b46147ad8361069a8a60646137b2565b8490613be0565b9050600087815b610100811015613ea65790915081906147ee6147e08b610dff87610d9f8760026137b2565b61069a89610d9f86806137b2565b915081733382D6140c6f3F29190f642FC19DBD1c8550D5306313a1ec759091856040518363ffffffff1660e01b8152600401808381526020018281526020019250505060206040518083038186803b15801561484957600080fd5b505af415801561485d573d6000803e3d6000fd5b505050506040513d602081101561487357600080fd5b5051156148895750965061206e95505050505050565b6001016147bb565b6060824710156148d25760405162461bcd60e51b8152600401808060200182810382526026815260200180614bec6026913960400191505060405180910390fd5b6148db856149ed565b61492c576040805162461bcd60e51b815260206004820152601d60248201527f416464726573733a2063616c6c20746f206e6f6e2d636f6e7472616374000000604482015290519081900360640190fd5b60006060866001600160a01b031685876040518082805190602001908083835b6020831061496b5780518252601f19909201916020918201910161494c565b6001836020036101000a03801982511681845116808217855250505050505090500191505060006040518083038185875af1925050503d80600081146149cd576040519150601f19603f3d011682016040523d82523d6000602084013e6149d2565b606091505b50915091506149e28282866149f3565b979650505050505050565b3b151590565b60608315614a025750816135d4565b825115614a125782518084602001fd5b60405162461bcd60e51b81526020600482018181528451602484015284518593919283926044019190850190808383600083156141e75781810151838201526020016141cf565b604051806101400160405280600081526020016000815260200160008152602001600060ff168152602001600060ff168152602001606081526020016060815260200160006001600160a01b0316815260200160006001600160a01b03168152602001600081525090565b60405180610120016040528060008152602001600081526020016000815260200160006001600160a01b0316815260200160008152602001600081526020016000815260200160608152602001606081525090565b828054828255906000526020600020908101928215614b54579160200282015b82811115614b54578251825591602001919060010190614b39565b50614b60929150614bd6565b5090565b6040805160e081018252600080825260208201819052918101829052606081018290526080810182905260a0810182905260c081019190915290565b6040518060c001604052806000815260200160008152602001600081526020016000815260200160008152602001600081525090565b5b80821115614b605760008155600101614bd756fe416464726573733a20696e73756666696369656e742062616c616e636520666f722063616c6c536166654d6174683a206d756c7469706c69636174696f6e206f766572666c6f775361666545524332303a204552433230206f7065726174696f6e20646964206e6f74207375636365656443616e6e6f74207769746864726177206d6f7265207468616e20617661696c61626c65a2646970667358221220b9e860cad3900cb4bcffcfb4901d9137ceb3b0180ec0d7f0bb8cb71523c7687c64736f6c634300060c0033",
  "deployedBytecode": "0x730000000000000000000000000000000000000000301460806040526004361061010a5760003560e01c8063a892cd87116100a1578063becf967c11610070578063becf967c1461048a578063d011f91814610492578063d8b3a90d1461049a578063e04f37cd146104db5761010a565b8063a892cd8714610315578063a8a50ed7146103d3578063b2a491641461040f578063bbca125c1461045e5761010a565b80635dbcca1e116100dd5780635dbcca1e146101ed5780638995f39514610232578063a28c2341146102f0578063a7df2f89146102f85761010a565b80630296ab501461010f5780631160c0241461012d5780632b27b26d146101625780633edc82d81461019e575b600080fd5b610117610569565b6040805160ff9092168252519081900360200190f35b6101506004803603604081101561014357600080fd5b508035906020013561056e565b60408051918252519081900360200190f35b610150600480360360a081101561017857600080fd5b5080359060208101359060ff6040820135811691606081013590911690608001356106b8565b8180156101aa57600080fd5b50610150600480360360c08110156101c157600080fd5b5080359060208101359060ff604082013581169160608101359091169060808101359060a001356106da565b8180156101f957600080fd5b50610150600480360360a081101561021057600080fd5b5080359060208101359060408101359060ff60608201351690608001356113ac565b81801561023e57600080fd5b506101506004803603608081101561025557600080fd5b81359160208101359181019060608101604082013564010000000081111561027c57600080fd5b82018360208201111561028e57600080fd5b803590602001918460208302840111640100000000831117156102b057600080fd5b91908080602002602001604051908101604052809392919081815260200183836020028082843760009201919091525092955050913592506116f8915050565b610150612076565b6101506004803603602081101561030e57600080fd5b5035612082565b81801561032157600080fd5b506101506004803603608081101561033857600080fd5b81359160208101359181019060608101604082013564010000000081111561035f57600080fd5b82018360208201111561037157600080fd5b8035906020019184602083028401116401000000008311171561039357600080fd5b919080806020026020016040519081016040528093929190818152602001838360200280828437600092019190915250929550509135925061211c915050565b610150600480360360a08110156103e957600080fd5b5080359060208101359060ff6040820135811691606081013590911690608001356128e8565b81801561041b57600080fd5b50610150600480360360c081101561043257600080fd5b5080359060208101359060ff604082013581169160608101359091169060808101359060a00135612e2e565b6101506004803603604081101561047457600080fd5b50803590602001356001600160a01b03166131aa565b610150613251565b610150613257565b610150600480360360a08110156104b057600080fd5b5080359060208101359060408101356001600160a01b0316906060810135906080013560ff1661325c565b610150600480360360a08110156104f157600080fd5b8135916020810135916001600160a01b03604083013516919081019060808101606082013564010000000081111561052857600080fd5b82018360208201111561053a57600080fd5b8035906020019184602083028401116401000000008311171561055c57600080fd5b91935091503515156132ef565b601281565b600080610594610586856105818661350a565b613523565b61058f86612082565b6135db565b905060008460090160009054906101000a90046001600160a01b031690506000816001600160a01b03166318160ddd6040518163ffffffff1660e01b815260040160206040518083038186803b1580156105ed57600080fd5b505afa158015610601573d6000803e3d6000fd5b505050506040513d602081101561061757600080fd5b5051905080156106aa576106a08161069a846001600160a01b031663313ce5676040518163ffffffff1660e01b815260040160206040518083038186803b15801561066157600080fd5b505afa158015610675573d6000803e3d6000fd5b505050506040513d602081101561068b57600080fd5b5051869060ff16600a0a6137b2565b9061380b565b93505050506106b2565b600093505050505b92915050565b60006106cf868585856106ca8a61350a565b613872565b509695505050505050565b60006106e4614a59565b604051806101400160405280600081526020016000815260200160008152602001600060ff168152602001600060ff16815260200189600c0180548060200260200160405190810160405280929190818152602001828054801561076757602002820191906000526020600020905b815481526020019060010190808311610753575b50505050508152602001886003018054806020026020016040519081016040528092919081815260200182805480156107c957602002820191906000526020600020905b81546001600160a01b031681526001909101906020018083116107ab575b505050918352505060006020820181905260408201526060016107eb89613a23565b8152509050600060018260a001515103905060008260c0015151820190508060ff168860ff1610801561082357508060ff168760ff16105b61086f576040805162461bcd60e51b8152602060048201526018602482015277546f6b656e20696e646578206f7574206f662072616e676560401b604482015290519081900360640190fd5b5087546001600160a01b031660ff80831690891610156108c35789600a018860ff168154811061089b57fe5b6000918252602090912001546001600160a01b031660e084015260ff881660608401526108fb565b8260c0015182890360ff16815181106108d857fe5b60209081029190910101516001600160a01b031660e084015260ff821660608401525b8160ff168760ff1610156109445789600a018760ff168154811061091b57fe5b6000918252602090912001546001600160a01b031661010084015260ff8716608084015261097d565b8260c0015182880360ff168151811061095957fe5b60209081029190910101516001600160a01b031661010084015260ff821660808401525b8260e001516001600160a01b03166370a08231306040518263ffffffff1660e01b815260040180826001600160a01b0316815260200191505060206040518083038186803b1580156109ce57600080fd5b505afa1580156109e2573d6000803e3d6000fd5b505050506040513d60208110156109f857600080fd5b5051602084015260e0830151610a19906001600160a01b0316333089613ac6565b610aa483602001518460e001516001600160a01b03166370a08231306040518263ffffffff1660e01b815260040180826001600160a01b0316815260200191505060206040518083038186803b158015610a7257600080fd5b505afa158015610a86573d6000803e3d6000fd5b505050506040513d6020811015610a9c57600080fd5b505190613b26565b602084015260ff8083169089161080610ac257508160ff168760ff16105b156111a5576060610add8b8560a00151866101200151613b83565b90508260ff168960ff161015610b3e57610b1c8b600b018a60ff1681548110610b0257fe5b9060005260206000200154886137b290919063ffffffff16565b818a60ff1681518110610b2b57fe5b6020908102919091010151018452610daa565b60608460c001515167ffffffffffffffff81118015610b5c57600080fd5b50604051908082528060200260200182016040528015610b86578160200160208202803683370190505b509050846020015181858c0360ff1681518110610b9f57fe5b60200260200101818152505060008c600a018560ff1681548110610bbf57fe5b60009182526020918290200154604080516370a0823160e01b815230600482015290516001600160a01b03909216935083926370a0823192602480840193829003018186803b158015610c1157600080fd5b505afa158015610c25573d6000803e3d6000fd5b505050506040513d6020811015610c3b57600080fd5b50518652604051634d49e87d60e01b815260006024820181905242604483018190526060600484019081528551606485015285516001600160a01b03891694634d49e87d948894909390929091829160849091019060208781019102808383895b83811015610cb4578181015183820152602001610c9c565b50505050905001945050505050602060405180830381600087803b158015610cdb57600080fd5b505af1158015610cef573d6000803e3d6000fd5b505050506040513d6020811015610d0557600080fd5b50508551604080516370a0823160e01b81523060048201529051610d5592916001600160a01b038516916370a0823191602480820192602092909190829003018186803b158015610a7257600080fd5b60208701528251610da590849060ff8816908110610d6f57fe5b6020026020010151610d9f670de0b6b3a764000061069a8a61012001518b602001516137b290919063ffffffff16565b90613be0565b865250505b600080610dcb610db98e612082565b60608801516080890151895187613c3a565b9050610e056001610dff83868a6080015160ff1681518110610de957fe5b6020026020010151613b2690919063ffffffff16565b90613b26565b6040870181905260048e0154610e26916402540be4009161069a91906137b2565b9150610e638d600b01876080015160ff1681548110610e4157fe5b906000526020600020015461069a848960400151613b2690919063ffffffff16565b60408701525060ff808516908a1610610ea457610e9e85610120015161069a670de0b6b3a764000088604001516137b290919063ffffffff16565b60408601525b6000610ec66402540be40061069a8f60050154856137b290919063ffffffff16565b9050610efb8d600b01876080015160ff1681548110610ee157fe5b90600052602060002001548261380b90919063ffffffff16565b9050610f3286602001518760a00151886060015160ff1681518110610f1c57fe5b6020026020010151613be090919063ffffffff16565b8d600c01876060015160ff1681548110610f4857fe5b9060005260206000200181905550610f7981610dff88604001518960a001518a6080015160ff1681518110610de957fe5b8d600c01876080015160ff1681548110610f8f57fe5b9060005260206000200181905550508360ff168960ff16106111455760008561010001516001600160a01b03166370a08231306040518263ffffffff1660e01b815260040180826001600160a01b0316815260200191505060206040518083038186803b158015610fff57600080fd5b505afa158015611013573d6000803e3d6000fd5b505050506040513d602081101561102957600080fd5b505160408088015181516301f1d0ab60e51b8152600481019190915260ff888e0316602482015260006044820181905242606483015291519293506001600160a01b03871692633e3a156092608480840193602093929083900390910190829087803b15801561109857600080fd5b505af11580156110ac573d6000803e3d6000fd5b505050506040513d60208110156110c257600080fd5b5050610100860151604080516370a0823160e01b8152306004820152905183926001600160a01b0316916370a08231916024808301926020929190829003018186803b15801561111157600080fd5b505afa158015611125573d6000803e3d6000fd5b505050506040513d602081101561113b57600080fd5b5051036040870152505b868560400151101561119e576040805162461bcd60e51b815260206004820181905260248201527f53776170206469646e277420726573756c7420696e206d696e20746f6b656e73604482015290519081900360640190fd5b5050611320565b8261010001516001600160a01b03166370a08231306040518263ffffffff1660e01b815260040180826001600160a01b0316815260200191505060206040518083038186803b1580156111f757600080fd5b505afa15801561120b573d6000803e3d6000fd5b505050506040513d602081101561122157600080fd5b505160408085019190915260208481015182516348b4aac360e11b815260ff868d0381166004830152868c0316602482015260448101919091526064810188905242608482015291516001600160a01b0384169263916955869260a48083019391928290030181600087803b15801561129957600080fd5b505af11580156112ad573d6000803e3d6000fd5b505050506040513d60208110156112c357600080fd5b505060408084015161010085015182516370a0823160e01b8152306004820152925161131a936001600160a01b03909216916370a08231916024808301926020929190829003018186803b158015610a7257600080fd5b60408401525b6113473384604001518561010001516001600160a01b0316613ef49092919063ffffffff16565b6040808401518151888152602081019190915260ff808b168284015289166060820152905133917f6617207207e397b41fc98016d8c9febb7223f44c355db66ad429730f2b950a60919081900360800190a250506040015190505b9695505050505050565b6009850154604080516318160ddd60e01b815290516000926001600160a01b031691839183916318160ddd916004808301926020929190829003018186803b1580156113f757600080fd5b505afa15801561140b573d6000803e3d6000fd5b505050506040513d602081101561142157600080fd5b5051600a890154604080516370a0823160e01b8152336004820152905192935090916001600160a01b038516916370a08231916024808301926020929190829003018186803b15801561147357600080fd5b505afa158015611487573d6000803e3d6000fd5b505050506040513d602081101561149d57600080fd5b50518711156114e3576040805162461bcd60e51b815260206004820152600d60248201526c1f2628173130b630b731b2a7b360991b604482015290519081900360640190fd5b808660ff161061152c576040805162461bcd60e51b815260206004820152600f60248201526e151bdad95b881b9bdd08199bdd5b99608a1b604482015290519081900360640190fd5b6000806115458b338b8b61153f8f613a23565b89613f4b565b925090508681101561158f576040805162461bcd60e51b815260206004820152600e60248201526d191e480f081b5a5b905b5bdd5b9d60921b604482015290519081900360640190fd5b6115e76115bc6115b56402540be40061069a8f60050154876137b290919063ffffffff16565b8390613be0565b8c600c018a60ff16815481106115ce57fe5b9060005260206000200154613b2690919063ffffffff16565b8b600c018960ff16815481106115f957fe5b60009182526020822001919091556040805163079cc67960e41b8152336004820152602481018c905290516001600160a01b038816926379cc6790926044808201939182900301818387803b15801561165157600080fd5b505af1158015611665573d6000803e3d6000fd5b5050505061169c33828d600a018b60ff168154811061168057fe5b6000918252602090912001546001600160a01b03169190613ef4565b604080518a81526020810186905260ff8a168183015260608101839052905133917f43fb02998f4e03da2e0e6fff53fdbf0c40a9f45f145dc377fc30615d7d7a8a64919081900360800190a29450505050505b95945050505050565b6000606085600a0180548060200260200160405190810160405280929190818152602001828054801561175457602002820191906000526020600020905b81546001600160a01b03168152600190910190602001808311611736575b5050505050905085600a01805490508451146117b7576040805162461bcd60e51b815260206004820181905260248201527f416d6f756e7473206d757374206d6174636820706f6f6c656420746f6b656e73604482015290519081900360640190fd5b6060815167ffffffffffffffff811180156117d157600080fd5b506040519080825280602002602001820160405280156117fb578160200160208202803683370190505b509050611806614ac4565b604080516101208101825260008082526020820181905291810182905260098a01546001600160a01b03166060820152608081019190915260a0810161184b8a612082565b815260200161185989613a23565b815260200189600b018054806020026020016040519081016040528092919081815260200182805480156118ac57602002820191906000526020600020905b815481526020019060010190808311611898575b5050505050815260200189600c0180548060200260200160405190810160405280929190818152602001828054801561190457602002820191906000526020600020905b8154815260200190600101908083116118f0575b5050505050815250905080606001516001600160a01b03166318160ddd6040518163ffffffff1660e01b815260040160206040518083038186803b15801561194b57600080fd5b505afa15801561195f573d6000803e3d6000fd5b505050506040513d602081101561197557600080fd5b505160808201819052156119ab576119a861199e8261010001518360e001518460c00151613fcf565b8260a001516135db565b81525b60005b8351811015611bee5760808201511515806119dc575060008782815181106119d257fe5b6020026020010151115b611a2d576040805162461bcd60e51b815260206004820152601e60248201527f4d75737420737570706c7920616c6c20746f6b656e7320696e20706f6f6c0000604482015290519081900360640190fd5b868181518110611a3957fe5b6020026020010151600014611ba2576000848281518110611a5657fe5b60200260200101516001600160a01b03166370a08231306040518263ffffffff1660e01b815260040180826001600160a01b0316815260200191505060206040518083038186803b158015611aaa57600080fd5b505afa158015611abe573d6000803e3d6000fd5b505050506040513d6020811015611ad457600080fd5b50518851909150611b2490339030908b9086908110611aef57fe5b6020026020010151888681518110611b0357fe5b60200260200101516001600160a01b0316613ac6909392919063ffffffff16565b611b8881868481518110611b3457fe5b60200260200101516001600160a01b03166370a08231306040518263ffffffff1660e01b815260040180826001600160a01b0316815260200191505060206040518083038186803b158015610a7257600080fd5b888381518110611b9457fe5b602002602001018181525050505b611bca878281518110611bb157fe5b60200260200101518361010001518381518110610f1c57fe5b8261010001518281518110611bdb57fe5b60209081029190910101526001016119ae565b50611c0a61199e8261010001518360e001518460c00151613fcf565b60208201819052815110611c59576040805162461bcd60e51b8152602060048201526011602482015270442073686f756c6420696e63726561736560781b604482015290519081900360640190fd5b60208101516040820152608081015160009015611e93576000611c7b8a614103565b905060005b8551811015611e3e576000611cc3856000015161069a8e600c018581548110611ca557fe5b906000526020600020015488602001516137b290919063ffffffff16565b9050611d756402540be40061069a8373__$7bcaacd56beb19a20ee5df8a4f1dc67de1$__63a95cb7f790918a61010001518881518110611cff57fe5b60200260200101516040518363ffffffff1660e01b8152600401808381526020018281526020019250505060206040518083038186803b158015611d4257600080fd5b505af4158015611d56573d6000803e3d6000fd5b505050506040513d6020811015611d6c57600080fd5b505186906137b2565b868381518110611d8157fe5b602002602001018181525050611dd4611dc36402540be40061069a8f600501548a8781518110611dad57fe5b60200260200101516137b290919063ffffffff16565b8661010001518481518110610de957fe5b8c600c018381548110611de357fe5b9060005260206000200181905550611e19868381518110611e0057fe5b60200260200101518661010001518481518110610de957fe5b8561010001518381518110611e2a57fe5b602090810291909101015250600101611c80565b50611e64611e5a8461010001518560e001518660c00151613fcf565b8460a001516135db565b6040840181905283516080850151611e8b9261069a9190611e859084613b26565b906137b2565b915050611eb7565b6101008201518051611eaf91600c8c0191602090910190614b19565b505060208101515b85811015611f0c576040805162461bcd60e51b815260206004820152601b60248201527f436f756c646e2774206d696e74206d696e207265717565737465640000000000604482015290519081900360640190fd5b6009890154604080516340c10f1960e01b81523360048201526024810184905290516001600160a01b03909216916340c10f199160448082019260009290919082900301818387803b158015611f6157600080fd5b505af1158015611f75573d6000803e3d6000fd5b50505050336001600160a01b03167f189c623b666b1b45b83d7178f39b8c087cb09774317ca2f53c2d3c3726f222a288858560200151611fc2868860800151613be090919063ffffffff16565b604051808060200180602001858152602001848152602001838103835287818151815260200191508051906020019060200280838360005b83811015612012578181015183820152602001611ffa565b50505050905001838103825286818151815260200191508051906020019060200280838360005b83811015612051578181015183820152602001612039565b50505050905001965050505050505060405180910390a293505050505b949350505050565b670de0b6b3a764000081565b60038101546001820154600091904282111561210e5760028401548454808311156120e0576120d56120ce6120b78685613b26565b61069a6120c44287613b26565b611e858887613b26565b8290613be0565b945050505050612117565b6120d56121076120f08685613b26565b61069a6120fd4287613b26565b611e858689613b26565b8290613b26565b91506121179050565b919050565b6000612126614ac4565b604080516101208101825260008082526020820181905291810182905260098801546001600160a01b03166060820152608081019190915260a0810161216b88612082565b815260200161217987613a23565b815260200187600b018054806020026020016040519081016040528092919081815260200182805480156121cc57602002820191906000526020600020905b8154815260200190600101908083116121b8575b5050505050815260200187600c0180548060200260200160405190810160405280929190818152602001828054801561222457602002820191906000526020600020905b815481526020019060010190808311612210575b5050505050815250905080606001516001600160a01b03166318160ddd6040518163ffffffff1660e01b815260040160206040518083038186803b15801561226b57600080fd5b505afa15801561227f573d6000803e3d6000fd5b505050506040513d602081101561229557600080fd5b50516080820152610100810151518451146122f7576040805162461bcd60e51b815260206004820181905260248201527f416d6f756e74732073686f756c64206d6174636820706f6f6c20746f6b656e73604482015290519081900360640190fd5b80606001516001600160a01b03166370a08231336040518263ffffffff1660e01b815260040180826001600160a01b0316815260200191505060206040518083038186803b15801561234857600080fd5b505afa15801561235c573d6000803e3d6000fd5b505050506040513d602081101561237257600080fd5b5051831180159061238257508215155b6123c3576040805162461bcd60e51b815260206004820152600d60248201526c1f2628173130b630b731b2a7b360991b604482015290519081900360640190fd5b60006123ce87614103565b905060608261010001515167ffffffffffffffff811180156123ef57600080fd5b50604051908082528060200260200182016040528015612419578160200160208202803683370190505b50905060608361010001515167ffffffffffffffff8111801561243b57600080fd5b50604051908082528060200260200182016040528015612465578160200160208202803683370190505b50905061248d6124838561010001518660e001518760c00151613fcf565b8560a001516135db565b845260005b84610100015151811015612517576124f88882815181106124af57fe5b6020026020010151604051806060016040528060238152602001614c5d6023913987610100015184815181106124e157fe5b60200260200101516141939092919063ffffffff16565b82828151811061250457fe5b6020908102919091010152600101612492565b5061252e612483828660e001518760c00151613fcf565b602085015260005b846101000151518110156126d357600061257d866000015161069a886101000151858151811061256257fe5b602002602001015189602001516137b290919063ffffffff16565b905060008173__$7bcaacd56beb19a20ee5df8a4f1dc67de1$__63a95cb7f790918686815181106125aa57fe5b60200260200101516040518363ffffffff1660e01b8152600401808381526020018281526020019250505060206040518083038186803b1580156125ed57600080fd5b505af4158015612601573d6000803e3d6000fd5b505050506040513d602081101561261757600080fd5b5051905061262e6402540be40061069a88846137b2565b85848151811061263a57fe5b6020026020010181815250506126726126666402540be40061069a8f60050154898881518110611dad57fe5b858581518110610de957fe5b8c600c01848154811061268157fe5b90600052602060002001819055506126b285848151811061269e57fe5b6020026020010151858581518110610de957fe5b8484815181106126be57fe5b60209081029190910101525050600101612536565b506126ea612483828660e001518760c00151613fcf565b6040850181905284516080860151600093506127109261069a9190611e85908490613b26565b905080612764576040805162461bcd60e51b815260206004820152601b60248201527f4275726e7420616d6f756e742063616e6e6f74206265207a65726f0000000000604482015290519081900360640190fd5b6127946127806127748b336131aa565b6402540be40090613b26565b61069a6402540be400611e85856001613be0565b9050858111156127eb576040805162461bcd60e51b815260206004820152601b60248201527f746f6b656e416d6f756e74203e206d61784275726e416d6f756e740000000000604482015290519081900360640190fd5b83606001516001600160a01b03166379cc679033836040518363ffffffff1660e01b815260040180836001600160a01b0316815260200182815260200192505050600060405180830381600087803b15801561284657600080fd5b505af115801561285a573d6000803e3d6000fd5b5050505060005b8461010001515181101561289e576128963389838151811061287f57fe5b60200260200101518c600a01848154811061168057fe5b600101612861565b50336001600160a01b03167f3631c28b1f9dd213e0319fb167b554d76b6c283a41143eb400a0d1adb1af175588848760200151611fc2868a60800151613b2690919063ffffffff16565b60006128f2614b64565b6040518060e001604052806129068861350a565b815287546001600160a01b03166020820152600060408201819052600389015460ff166060808401919091526080830182905260a0830182905260c090920152815191925090612957908990613523565b80516000190160ff908116604085018190526060850151929350919091019081811690881610801561298e57508060ff168660ff16105b6129da576040805162461bcd60e51b8152602060048201526018602482015277546f6b656e20696e646578206f7574206f662072616e676560401b604482015290519081900360640190fd5b50816040015160ff168660ff161015612a3857612a2e612a1f89600b018860ff1681548110612a0557fe5b9060005260206000200154866137b290919063ffffffff16565b828860ff1681518110610f1c57fe5b60a0830152612c6c565b6040820151958690039560ff9081169086161015612bca576060826060015160ff1667ffffffffffffffff81118015612a7057600080fd5b50604051908082528060200260200182016040528015612a9a578160200160208202803683370190505b50905084818860ff1681518110612aad57fe5b602002602001018181525050612bbf82846040015160ff1681518110612acf57fe5b6020026020010151610d9f670de0b6b3a764000061069a876000015188602001516001600160a01b031663f9273ffb308960016040518463ffffffff1660e01b815260040180846001600160a01b03168152602001806020018315158152602001828103825284818151815260200191508051906020019060200280838360005b83811015612b68578181015183820152602001612b50565b5050505090500194505050505060206040518083038186803b158015612b8d57600080fd5b505afa158015612ba1573d6000803e3d6000fd5b505050506040513d6020811015612bb757600080fd5b5051906137b2565b60a084015250612c64565b81602001516001600160a01b031663a95b089f8784604001518803876040518463ffffffff1660e01b8152600401808460ff1681526020018360ff168152602001828152602001935050505060206040518083038186803b158015612c2e57600080fd5b505afa158015612c42573d6000803e3d6000fd5b505050506040513d6020811015612c5857600080fd5b505192506116ef915050565b816040015195505b604082015160ff908116608084018190529086161015612c905760ff851660808301525b6000612caf612c9e8a612082565b8885608001518660a0015186613c3a565b9050612ccd6001610dff8385876080015160ff1681518110610de957fe5b60c0840181905260048a0154600091612cf0916402540be4009161069a916137b2565b60c0850151909150612d029082613b26565b60c08501525050604082015160ff9081169086161015612d5d57612d5388600b01836080015160ff1681548110612d3557fe5b90600052602060002001548360c0015161380b90919063ffffffff16565b60c0830152612e1f565b81602001516001600160a01b03166398899f4030612d98856000015161069a670de0b6b3a76400008860c001516137b290919063ffffffff16565b856040015189036040518463ffffffff1660e01b815260040180846001600160a01b031681526020018381526020018260ff168152602001935050505060206040518083038186803b158015612ded57600080fd5b505afa158015612e01573d6000803e3d6000fd5b505050506040513d6020811015612e1757600080fd5b505160c08301525b5060c001519695505050505050565b600080600088600a018760ff1681548110612e4557fe5b60009182526020918290200154604080516370a0823160e01b815233600482015290516001600160a01b03909216935083926370a0823192602480840193829003018186803b158015612e9757600080fd5b505afa158015612eab573d6000803e3d6000fd5b505050506040513d6020811015612ec157600080fd5b5051851115612f17576040805162461bcd60e51b815260206004820152601d60248201527f43616e6e6f742073776170206d6f7265207468616e20796f75206f776e000000604482015290519081900360640190fd5b6000816001600160a01b03166370a08231306040518263ffffffff1660e01b815260040180826001600160a01b0316815260200191505060206040518083038186803b158015612f6657600080fd5b505afa158015612f7a573d6000803e3d6000fd5b505050506040513d6020811015612f9057600080fd5b50519050612fa96001600160a01b038316333089613ac6565b612ffa81836001600160a01b03166370a08231306040518263ffffffff1660e01b815260040180826001600160a01b0316815260200191505060206040518083038186803b158015610a7257600080fd5b925050506000806130118a8989866106ca8e613a23565b915091508482101561306a576040805162461bcd60e51b815260206004820181905260248201527f53776170206469646e277420726573756c7420696e206d696e20746f6b656e73604482015290519081900360640190fd5b60006130ac8b600b018960ff168154811061308157fe5b906000526020600020015461069a6402540be40061069a8f60050154876137b290919063ffffffff16565b90506130dd848c600c018b60ff16815481106130c457fe5b9060005260206000200154613be090919063ffffffff16565b8b600c018a60ff16815481106130ef57fe5b906000526020600020018190555061311781610dff858e600c018c60ff16815481106115ce57fe5b8b600c018960ff168154811061312957fe5b906000526020600020018190555061314e33848d600a018b60ff168154811061168057fe5b604080518581526020810185905260ff808c16828401528a166060820152905133917fc6c1e0630dbe9130cc068028486c0d118ddcea348550819defd5cb8c257f8a38919081900360800190a250909998505050505050505050565b6001600160a01b0381166000908152600d8301602052604081205481906131d4906224ea00613be0565b9050428111156132475760006131ea8242613b26565b905061323e6402540be40061069a6224ea0061069a85611e858b600e0160008c6001600160a01b03166001600160a01b03168152602001908152602001600020548c600701546137b290919063ffffffff16565b925050506106b2565b5060009392505050565b61025881565b606481565b60006106cf8685858561326e8a61350a565b8b60090160009054906101000a90046001600160a01b03166001600160a01b03166318160ddd6040518163ffffffff1660e01b815260040160206040518083038186803b1580156132be57600080fd5b505afa1580156132d2573d6000803e3d6000fd5b505050506040513d60208110156132e857600080fd5b5051613f4b565b6000806132fb88612082565b9050600080600061330b8a61350a565b905060608b600c0180548060200260200160405190810160405280929190818152602001828054801561335d57602002820191906000526020600020905b815481526020019060010190808311613349575b5050505050905060008151905061337e6133788e8486613b83565b876135db565b945060005b8181101561342c5788156133d0576133b38b8b838181106133a057fe5b90506020020135848381518110610f1c57fe5b8382815181106133bf57fe5b602002602001018181525050613424565b61340b8b8b838181106133df57fe5b90506020020135604051806060016040528060238152602001614c5d602391398584815181106124e157fe5b83828151811061341757fe5b6020026020010181815250505b600101613383565b5061343b6133788e8486613b83565b935050505060008a60090160009054906101000a90046001600160a01b03166001600160a01b03166318160ddd6040518163ffffffff1660e01b815260040160206040518083038186803b15801561349257600080fd5b505afa1580156134a6573d6000803e3d6000fd5b505050506040513d60208110156134bc57600080fd5b5051905085156134e3576134d88361069a83611e858684613b26565b9450505050506113a2565b6134d86134f36127748d8c6131aa565b61069a6402540be400611e8587838783838b613b26565b80546000906106b29083906001600160a01b031661422a565b60606135d483600c0180548060200260200160405190810160405280929190818152602001828054801561357657602002820191906000526020600020905b815481526020019060010190808311613562575b505050505084600b018054806020026020016040519081016040528092919081815260200182805480156135c957602002820191906000526020600020905b8154815260200190600101908083116135b5575b505050505084613fcf565b9392505050565b815160009081805b8281101561361b576136118682815181106135fa57fe5b602002602001015183613be090919063ffffffff16565b91506001016135e3565b508061362c576000925050506106b2565b6000818161363a87866137b2565b905060005b61010081101561376e578260005b8781101561367c57613672613668898d8481518110611dad57fe5b61069a84886137b2565b915060010161364d565b5092935083926136ca6136aa61369783611e858b6001613be0565b610d9f606461069a89611e858a84613b26565b61069a86611e856136bb868d6137b2565b610d9f606461069a8b8f6137b2565b93508373__$7bcaacd56beb19a20ee5df8a4f1dc67de1$__6313a1ec759091876040518363ffffffff1660e01b8152600401808381526020018281526020019250505060206040518083038186803b15801561372557600080fd5b505af4158015613739573d6000803e3d6000fd5b505050506040513d602081101561374f57600080fd5b50511561376557839750505050505050506106b2565b5060010161363f565b506040805162461bcd60e51b81526020600482015260136024820152724420646f6573206e6f7420636f6e766572676560681b604482015290519081900360640190fd5b6000826137c1575060006106b2565b828202828482816137ce57fe5b04146135d45760405162461bcd60e51b8152600401808060200182810382526021815260200180614c126021913960400191505060405180910390fd5b6000808211613861576040805162461bcd60e51b815260206004820152601a60248201527f536166654d6174683a206469766973696f6e206279207a65726f000000000000604482015290519081900360640190fd5b81838161386a57fe5b049392505050565b60008060606138818885613523565b905080518760ff16108015613899575080518660ff16105b6138e5576040805162461bcd60e51b8152602060048201526018602482015277546f6b656e20696e646578206f7574206f662072616e676560401b604482015290519081900360640190fd5b80516000906138f5906001613b26565b9050600061390e8a600b018a60ff1681548110610b0257fe5b9050818960ff16141561393457613931670de0b6b3a764000061069a83896137b2565b90505b61395d838a60ff168151811061394657fe5b602002602001015182613be090919063ffffffff16565b9050600061397661396d8c612082565b8b8b8588613c3a565b90506139906001610dff83878d60ff1681518110610de957fe5b9550828960ff1614156139b6576139b38761069a88670de0b6b3a76400006137b2565b95505b6139d66402540be40061069a8d60040154896137b290919063ffffffff16565b94506139e28686613b26565b9550613a138b600b018a60ff16815481106139f957fe5b90600052602060002001548761380b90919063ffffffff16565b9550505050509550959350505050565b6000610258826002015401421115613abb5781546040805163712d52fd60e11b815290516000926001600160a01b03169163e25aa5fa916004808301926020929190829003018186803b158015613a7957600080fd5b505afa158015613a8d573d6000803e3d6000fd5b505050506040513d6020811015613aa357600080fd5b50516001840181905542600285015591506121179050565b506001810154612117565b604080516001600160a01b0380861660248301528416604482015260648082018490528251808303909101815260849091019091526020810180516001600160e01b03166323b872dd60e01b179052613b209085906142b3565b50505050565b600082821115613b7d576040805162461bcd60e51b815260206004820152601e60248201527f536166654d6174683a207375627472616374696f6e206f766572666c6f770000604482015290519081900360640190fd5b50900390565b606061206e8385600b018054806020026020016040519081016040528092919081815260200182805480156135c957602002820191906000526020600020908154815260200190600101908083116135b557505050505084613fcf565b6000828201838110156135d4576040805162461bcd60e51b815260206004820152601b60248201527f536166654d6174683a206164646974696f6e206f766572666c6f770000000000604482015290519081900360640190fd5b805160009060ff8681169086161415613c9a576040805162461bcd60e51b815260206004820152601d60248201527f43616e277420636f6d7061726520746f6b656e20746f20697473656c66000000604482015290519081900360640190fd5b808660ff16108015613cae5750808560ff16105b613cf8576040805162461bcd60e51b8152602060048201526016602482015275151bdad95b9cc81b5d5cdd081899481a5b881c1bdbdb60521b604482015290519081900360640190fd5b6000613d0484896135db565b905080600080613d14858c6137b2565b90506000805b86811015613d8d578b60ff16811415613d3557899150613d5f565b8a60ff168114613d5a57888181518110613d4b57fe5b60200260200101519150613d5f565b613d85565b613d698483613be0565b9350613d82613d7883896137b2565b61069a87896137b2565b94505b600101613d1a565b50613daa613d9b83886137b2565b61069a6064611e85888a6137b2565b93506000613dc7613dc08461069a8960646137b2565b8590613be0565b9050600086815b610100811015613ea6579091508190613e01613df38a610dff87610d9f8760026137b2565b61069a8a610d9f86806137b2565b91508173__$7bcaacd56beb19a20ee5df8a4f1dc67de1$__6313a1ec759091856040518363ffffffff1660e01b8152600401808381526020018281526020019250505060206040518083038186803b158015613e5c57600080fd5b505af4158015613e70573d6000803e3d6000fd5b505050506040513d6020811015613e8657600080fd5b505115613e9e575098506116ef975050505050505050565b600101613dce565b506040805162461bcd60e51b815260206004820152601e60248201527f417070726f78696d6174696f6e20646964206e6f7420636f6e76657267650000604482015290519081900360640190fd5b604080516001600160a01b038416602482015260448082018490528251808303909101815260649091019091526020810180516001600160e01b031663a9059cbb60e01b179052613f469084906142b3565b505050565b600080600080600080613f618c8a8c8b8b614364565b809450819350829650505050613f9c84610dff8e600b018c60ff1681548110613f8657fe5b60009182526020909120015461069a8686613b26565b92505050613fc06402540be40061069a613fb96127748e8e6131aa565b85906137b2565b9a909950975050505050505050565b8251825160609190811461402a576040805162461bcd60e51b815260206004820152601f60248201527f42616c616e636573206d757374206d61746368206d756c7469706c6965727300604482015290519081900360640190fd5b60608167ffffffffffffffff8111801561404357600080fd5b5060405190808252806020026020018201604052801561406d578160200160208202803683370190505b50905060005b828110156140bd5761409e86828151811061408a57fe5b6020026020010151888381518110611dad57fe5b8282815181106140aa57fe5b6020908102919091010152600101614073565b5060006001830390506140e2670de0b6b3a764000061069a87858581518110611dad57fe5b8282815181106140ee57fe5b60209081029190910101525095945050505050565b6000606082600a0180548060200260200160405190810160405280929190818152602001828054801561415f57602002820191906000526020600020905b81546001600160a01b03168152600190910190602001808311614141575b505050505090506135d46141836004611e8560018551613b2690919063ffffffff16565b8251600486015461069a916137b2565b600081848411156142225760405162461bcd60e51b81526004018080602001828103825283818151815260200191508051906020019080838360005b838110156141e75781810151838201526020016141cf565b50505050905090810190601f1680156142145780820380516001836020036101000a031916815260200191505b509250505060405180910390fd5b505050900390565b60006102588360020154014211156142a857816001600160a01b031663e25aa5fa6040518163ffffffff1660e01b815260040160206040518083038186803b15801561427557600080fd5b505afa158015614289573d6000803e3d6000fd5b505050506040513d602081101561429f57600080fd5b505190506106b2565b5060018201546106b2565b6060614308826040518060400160405280602081526020017f5361666545524332303a206c6f772d6c6576656c2063616c6c206661696c6564815250856001600160a01b03166146a89092919063ffffffff16565b805190915015613f465780806020019051602081101561432757600080fd5b5051613f465760405162461bcd60e51b815260040180806020018281038252602a815260200180614c33602a913960400191505060405180910390fd5b600080600060606143758987613523565b905080518860ff16106143ca576040805162461bcd60e51b8152602060048201526018602482015277546f6b656e20696e646578206f7574206f662072616e676560401b604482015290519081900360640190fd5b6143d2614ba0565b6040518060c001604052806000815260200160008152602001600081526020016000815260200160008152602001600081525090506144108a612082565b608082018190526144229083906135db565b8082526144429061443a90889061069a908c906137b2565b825190613b26565b60208201528151829060ff8b1690811061445857fe5b60200260200101518811156144b4576040805162461bcd60e51b815260206004820152601a60248201527f5769746864726177206578636565647320617661696c61626c65000000000000604482015290519081900360640190fd5b6144c881608001518a8484602001516146b7565b6040820152815160609067ffffffffffffffff811180156144e857600080fd5b50604051908082528060200260200182016040528015614512578160200160208202803683370190505b50905061451e8b614103565b606083015260005b83518110156145f55783818151811061453b57fe5b60200260200101518360a00181815250506145d66145cb6402540be40061069a86606001518f60ff1686146145a05761459b614590896000015161069a8b602001518c60a001516137b290919063ffffffff16565b60a08a015190613b26565b611e85565b611e858860400151610dff8a6000015161069a8c602001518d60a001516137b290919063ffffffff16565b60a085015190613b26565b8282815181106145e257fe5b6020908102919091010152600101614526565b50600061461e61460f84608001518d8587602001516146b7565b838d60ff1681518110610de957fe5b905061464c8c600b018c60ff168154811061463557fe5b60009182526020909120015461069a836001613b26565b905060018451038b60ff161415614676576146738961069a83670de0b6b3a76400006137b2565b90505b808360400151858d60ff168151811061468b57fe5b602002602001015196509650965050505050955095509592505050565b606061206e8484600085614891565b815160009060ff85168111614705576040805162461bcd60e51b815260206004820152600f60248201526e151bdad95b881b9bdd08199bdd5b99608a1b604482015290519081900360640190fd5b8260008061471389856137b2565b905060005b8481101561477a578860ff1681146147725761475088828151811061473957fe5b602002602001015184613be090919063ffffffff16565b925061476f614765868a8481518110611dad57fe5b61069a868a6137b2565b93505b600101614718565b5061479761478882866137b2565b61069a6064611e85878b6137b2565b925060006147b46147ad8361069a8a60646137b2565b8490613be0565b9050600087815b610100811015613ea65790915081906147ee6147e08b610dff87610d9f8760026137b2565b61069a89610d9f86806137b2565b91508173__$7bcaacd56beb19a20ee5df8a4f1dc67de1$__6313a1ec759091856040518363ffffffff1660e01b8152600401808381526020018281526020019250505060206040518083038186803b15801561484957600080fd5b505af415801561485d573d6000803e3d6000fd5b505050506040513d602081101561487357600080fd5b5051156148895750965061206e95505050505050565b6001016147bb565b6060824710156148d25760405162461bcd60e51b8152600401808060200182810382526026815260200180614bec6026913960400191505060405180910390fd5b6148db856149ed565b61492c576040805162461bcd60e51b815260206004820152601d60248201527f416464726573733a2063616c6c20746f206e6f6e2d636f6e7472616374000000604482015290519081900360640190fd5b60006060866001600160a01b031685876040518082805190602001908083835b6020831061496b5780518252601f19909201916020918201910161494c565b6001836020036101000a03801982511681845116808217855250505050505090500191505060006040518083038185875af1925050503d80600081146149cd576040519150601f19603f3d011682016040523d82523d6000602084013e6149d2565b606091505b50915091506149e28282866149f3565b979650505050505050565b3b151590565b60608315614a025750816135d4565b825115614a125782518084602001fd5b60405162461bcd60e51b81526020600482018181528451602484015284518593919283926044019190850190808383600083156141e75781810151838201526020016141cf565b604051806101400160405280600081526020016000815260200160008152602001600060ff168152602001600060ff168152602001606081526020016060815260200160006001600160a01b0316815260200160006001600160a01b03168152602001600081525090565b60405180610120016040528060008152602001600081526020016000815260200160006001600160a01b0316815260200160008152602001600081526020016000815260200160608152602001606081525090565b828054828255906000526020600020908101928215614b54579160200282015b82811115614b54578251825591602001919060010190614b39565b50614b60929150614bd6565b5090565b6040805160e081018252600080825260208201819052918101829052606081018290526080810182905260a0810182905260c081019190915290565b6040518060c001604052806000815260200160008152602001600081526020016000815260200160008152602001600081525090565b5b80821115614b605760008155600101614bd756fe416464726573733a20696e73756666696369656e742062616c616e636520666f722063616c6c536166654d6174683a206d756c7469706c69636174696f6e206f766572666c6f775361666545524332303a204552433230206f7065726174696f6e20646964206e6f74207375636365656443616e6e6f74207769746864726177206d6f7265207468616e20617661696c61626c65a2646970667358221220b9e860cad3900cb4bcffcfb4901d9137ceb3b0180ec0d7f0bb8cb71523c7687c64736f6c634300060c0033",
  "libraries": {
    "MathUtils": "0x3382D6140c6f3F29190f642FC19DBD1c8550D530",
    "EvmoSwapUtils": "0xaD00abb2bE74815F54FCc31fe94895148d48Fc24"
  },
  "devdoc": {
    "details": "Contracts relying on this library must initialize EvmoSwapUtils.Swap struct then use this library for EvmoSwapUtils.Swap struct. Note that this library contains both functions called by users and admins. Admin functions should be protected within contracts using this library.",
    "kind": "dev",
    "methods": {
      "addLiquidity(EvmoSwapUtils.Swap storage,MetaSwapUtils.MetaSwap storage,uint256[],uint256)": {
        "params": {
          "amounts": "the amounts of each token to add, in their native precision",
          "minToMint": "the minimum LP tokens adding this amount of liquidity should mint, otherwise revert. Handy for front-running mitigation allowed addresses. If the pool is not in the guarded launch phase, this parameter will be ignored.",
          "self": "Swap struct to read from and write to"
        },
        "returns": {
          "_0": "amount of LP token user received"
        }
      },
      "calculateCurrentWithdrawFee(EvmoSwapUtils.Swap storage,address)": {
        "params": {
          "user": "address you want to calculate withdraw fee of"
        },
        "returns": {
          "_0": "current withdraw fee of the user"
        }
      },
      "calculateSwap(EvmoSwapUtils.Swap storage,MetaSwapUtils.MetaSwap storage,uint8,uint8,uint256)": {
        "params": {
          "dx": "the number of tokens to sell. If the token charges a fee on transfers, use the amount that gets transferred after the fee.",
          "self": "Swap struct to read from",
          "tokenIndexFrom": "the token to sell",
          "tokenIndexTo": "the token to buy"
        },
        "returns": {
          "dy": "the number of tokens the user will get"
        }
      },
      "calculateTokenAmount(EvmoSwapUtils.Swap storage,MetaSwapUtils.MetaSwap storage,address,uint256[],bool)": {
        "details": "This shouldn't be used outside frontends for user estimates.",
        "params": {
          "account": "address of the account depositing or withdrawing tokens",
          "amounts": "an array of token amounts to deposit or withdrawal, corresponding to pooledTokens. The amount should be in each pooled token's native precision. If a token charges a fee on transfers, use the amount that gets transferred after the fee.",
          "deposit": "whether this is a deposit or a withdrawal",
          "self": "Swap struct to read from"
        },
        "returns": {
          "_0": "if deposit was true, total amount of lp token that will be minted and if deposit was false, total amount of lp token that will be burned"
        }
      },
      "calculateWithdrawOneToken(EvmoSwapUtils.Swap storage,MetaSwapUtils.MetaSwap storage,address,uint256,uint8)": {
        "params": {
          "account": "the address that is withdrawing",
          "self": "Swap struct to read from",
          "tokenAmount": "the amount to withdraw in the pool's precision",
          "tokenIndex": "which token will be withdrawn"
        },
        "returns": {
          "dy": "the amount of token user will receive"
        }
      },
      "getAPrecise(EvmoSwapUtils.Swap storage)": {
        "details": "See the StableSwap paper for details",
        "params": {
          "self": "Swap struct to read from"
        },
        "returns": {
          "_0": "A parameter in its raw precision form"
        }
      },
      "getVirtualPrice(EvmoSwapUtils.Swap storage,MetaSwapUtils.MetaSwap storage)": {
        "params": {
          "self": "Swap struct to read from"
        },
        "returns": {
          "_0": "the virtual price, scaled to precision of POOL_PRECISION_DECIMALS"
        }
      },
      "removeLiquidityImbalance(EvmoSwapUtils.Swap storage,MetaSwapUtils.MetaSwap storage,uint256[],uint256)": {
        "params": {
          "amounts": "how much of each token to withdraw",
          "maxBurnAmount": "the max LP token provider is willing to pay to remove liquidity. Useful as a front-running mitigation.",
          "self": "Swap struct to read from and write to"
        },
        "returns": {
          "_0": "actual amount of LP tokens burned in the withdrawal"
        }
      },
      "removeLiquidityOneToken(EvmoSwapUtils.Swap storage,MetaSwapUtils.MetaSwap storage,uint256,uint8,uint256)": {
        "params": {
          "minAmount": "the minimum amount to withdraw, otherwise revert",
          "self": "Swap struct to read from and write to",
          "tokenAmount": "the amount of the lp tokens to burn",
          "tokenIndex": "the index of the token you want to receive"
        },
        "returns": {
          "_0": "amount chosen token that user received"
        }
      },
      "swap(EvmoSwapUtils.Swap storage,MetaSwapUtils.MetaSwap storage,uint8,uint8,uint256,uint256)": {
        "params": {
          "dx": "the amount of tokens the user wants to sell",
          "minDy": "the min amount the user would like to receive, or revert.",
          "self": "Swap struct to read from and write to",
          "tokenIndexFrom": "the token the user wants to sell",
          "tokenIndexTo": "the token the user wants to buy"
        },
        "returns": {
          "_0": "amount of token user received on swap"
        }
      }
    },
    "title": "MetaSwapUtils library",
    "version": 1
  },
  "userdoc": {
    "kind": "user",
    "methods": {
      "addLiquidity(EvmoSwapUtils.Swap storage,MetaSwapUtils.MetaSwap storage,uint256[],uint256)": {
        "notice": "Add liquidity to the pool"
      },
      "calculateCurrentWithdrawFee(EvmoSwapUtils.Swap storage,address)": {
        "notice": "Calculate the fee that is applied when the given user withdraws. Withdraw fee decays linearly over 4 weeks."
      },
      "calculateSwap(EvmoSwapUtils.Swap storage,MetaSwapUtils.MetaSwap storage,uint8,uint8,uint256)": {
        "notice": "Externally calculates a swap between two tokens."
      },
      "calculateTokenAmount(EvmoSwapUtils.Swap storage,MetaSwapUtils.MetaSwap storage,address,uint256[],bool)": {
        "notice": "A simple method to calculate prices from deposits or withdrawals, excluding fees but including slippage. This is helpful as an input into the various \"min\" parameters on calls to fight front-running"
      },
      "calculateWithdrawOneToken(EvmoSwapUtils.Swap storage,MetaSwapUtils.MetaSwap storage,address,uint256,uint8)": {
        "notice": "Calculate the dy, the amount of selected token that user receives."
      },
      "getAPrecise(EvmoSwapUtils.Swap storage)": {
        "notice": "Return A in its raw precision"
      },
      "getVirtualPrice(EvmoSwapUtils.Swap storage,MetaSwapUtils.MetaSwap storage)": {
        "notice": "Get the virtual price, to help calculate profit"
      },
      "removeLiquidityImbalance(EvmoSwapUtils.Swap storage,MetaSwapUtils.MetaSwap storage,uint256[],uint256)": {
        "notice": "Remove liquidity from the pool, weighted differently than the pool's current balances."
      },
      "removeLiquidityOneToken(EvmoSwapUtils.Swap storage,MetaSwapUtils.MetaSwap storage,uint256,uint8,uint256)": {
        "notice": "Remove liquidity from the pool all in one token."
      },
      "swap(EvmoSwapUtils.Swap storage,MetaSwapUtils.MetaSwap storage,uint8,uint8,uint256,uint256)": {
        "notice": "swap two tokens in the pool"
      }
    },
    "notice": "A library to be used within MetaSwap.sol. Contains functions responsible for custody and AMM functionalities.",
    "version": 1
  },
  "storageLayout": {
    "storage": [],
    "types": null
  }
}